title,link,description,comp_name,address,email,telephone_number,keywords,contact_person,type_or_sector,founded_year,revenue,funding,headquarters,No_of_employees,company_status,address_confidence,tp_confidence,headquarters_confidence,contact_confidence,Total_confidence
HackLabs: Home,https://hacklabs.com/,,hacklabs,"['Level  3 / 54 Miller Street NORTH SYDNEY  NSW 2060 Australia', 'https://hacklabs.com/contact/']",None,"['+61 1300 031337', 'https://hacklabs.com/about/']","['discovered security vulnerabilities', 'known security vulnerabilities', 'security testing tools', 'typical security vulnerabilities', 'network security', 'web application penetration testing course', 'security testing', 'other network security controls', 'traditional security testing targets corporate networks', 'finds columns']","[['Chris Gatford', 'founder'], 'https://hacklabs.com/the-red-team']","['IT - Software, Mining, oil and gas', 'from_classification_model']",None,"['$57.69 million USD', 'https://www.dnb.com/business-directory/company-profiles.hacklabs_pty_ltd.73fd27fb6d259ce188f19c49e54d1d34.html']",None,None,None,"['Proprietorship Subsidiary', 'https://www.dnb.com/business-directory/company-profiles.hacklabs_pty_ltd.73fd27fb6d259ce188f19c49e54d1d34.html']",0.25,0.25,0.375,0.0,0.21875
CSG: IT Managed Services and Office IT Solutions,https://www.csg.com.au/,"We are dedicated to providing the best managed print solutions and print financing options possible for our customers. For us  it’s all about you.
CSG is a wholly owned subsidiary of Fuji Xerox Asia Pacific Pte Ltd. ",csg,"['5218 SYDNEY NSW 2001', 'https://www.csg.com.au/legal-information/privacy']","['info@csg.com.au', 'https://www.crunchbase.com/organization/csg-limited']","['1800 985 445', 'https://www.csg.com.au/campaign/audit2020']","['business solutions', 'total business solutions', 'business solutions portfolio', 'business technology', 'business printing', 'new businesses', 'managed print solutions', 'business', 'small business technology', 'managed printing solutions']","[['Ken Sugiyama', 'Managing_Director'], 'https://www.csg.com.au/about-us/executive-team']","[['Information TechnologySoftware'], 'https://www.crunchbase.com/organization/csg-limited']","['1988', 'https://www.crunchbase.com/organization/csg-limited']","['$150.68 million USD', 'https://www.dnb.com/business-directory/company-profiles.csg_limited.b4d72cf596524d3bb7f99ee905749ff9.html']",None,"['Australia', 'https://opencorporates.com/companies/au/123989631']",None,"['Public', 'https://www.crunchbase.com/organization/csg-limited']",0.25,0.25,0.375,0.0,0.21875
Pin Payments: Accept card payments securely | Online ...,https://pinpayments.com/,Take card payments online for your business with Pin Payments. No merchant account required. Easy setup._Take card payments online for your business with Pin Payments. No merchant account required. Easy setup._Take card payments online for your business with Pin Payments. No merchant account required. Easy setup.,pinpayments,"['Level  4 , 147 Collins Street, Melbourne VIC 3000', 'https://pinpayments.com/terms/macquarie-bank']","['support@pinpayments.com', 'https://www.crunchbase.com/organization/pin-payments']","['1300 364 800', 'https://pinpayments.com/contact']","['payments integrate payment features', 'payment parameters pin payments', 'online card payments', 'credit card payments', 'payment card details', 'payment card data', 'live card payments', 'twd card payments', 'instant credit card payments', 'multicurrency credit card payments']","[['Grant Bissett', 'founder'], 'https://www.crunchbase.com/person/grant-bissett']","[['AccountingDeveloper APIsPayments'], 'https://www.crunchbase.com/organization/pin-payments']","['Nov 1, 2011', 'https://www.crunchbase.com/organization/pin-payments']",None,None,None,None,"['Private', 'https://www.crunchbase.com/organization/pin-payments']",0.25,0.25,0.375,0.0,0.21875
CTRL Group: Agile and Tailored Cybersecurity Services,https://ctrlgroup.io/,info@ctrlgroup.io · Group CTRL. linkedIn. © 2019 CTRL Group. All rights reserved. SEO by SEO Melbourne. CONTACT US. close slider. Contact Us Slider.,ctrlgroup.io,"['U 9 L 1 677 Springvale Rd Mulgrave, VICTORIA, 3170 Australia', 'https://www.dnb.com/business-directory/company-profiles.ctrl_security_pty_ltd.21a4abd26dde927035a4b01e11998a8b.html']","['info@controlgroup.com', 'https://www.crunchbase.com/organization/control-group']","['+61 1300 287 528', 'https://ctrlgroup.io/']",None,"[['STEVE JAMES WILLIAMS', 'Director'], 'https://www.dnb.com/business-directory/company-profiles.ctrl_security_pty_ltd.21a4abd26dde927035a4b01e11998a8b.html']","[['Cloud ComputingConsultingInformation Technology'], 'https://www.crunchbase.com/organization/control-group']","['2001', 'https://www.crunchbase.com/organization/control-group']","['$1.26 million USD', 'https://www.dnb.com/business-directory/company-profiles.ctrl_security_pty_ltd.21a4abd26dde927035a4b01e11998a8b.html']",None,None,None,"['Private', 'https://www.crunchbase.com/organization/control-group']",0.0,0.25,0.0,0.0,0.0625
FeeSynergy Australia & New Zealand | Debtor Management ...,https://feesynergy.com.au/,FeeSynergy is Australasia's leading provider of automated debtor management  payment gateway and fee finance solutions to the accounting and legal ...,feesynergy,"['Suite  3 , 990 Toorak Rd Camberwell VIC 3124', 'https://feesynergy.com.au/documents/direct-debit-request-service-agreement/']","['info@timelio.com.au', 'https://www.crunchbase.com/organization/timelio']","['+61 3 9822-1300', 'https://feesynergy.com.au/contact-us/']","['feesynergy firms', 'feesynergy clients', '100th feesynergy collect client', 'many accounting firms', 'other professional services firms', 'nz accounting firms', 'feesynergy collect debtor management platform', 'business advisory services', 'accounting services', 'other firms']","[['Malcolm Ebb', 'founder'], 'https://au.linkedin.com/in/malcolm-ebb-b432615']","[['Financial ServicesFinTechMarketplace'], 'https://www.crunchbase.com/organization/timelio']","['2014', 'https://www.crunchbase.com/organization/timelio']","['2.1M', 'https://app.avention.com/company/7786ed98-d7a6-3ab4-a4df-a5be3a6c4a24#report/company_summary']",None,"[' Melbourne, Victoria, Australia', 'https://www.crunchbase.com/organization/timelio']","['30', 'https://app.avention.com/company/7786ed98-d7a6-3ab4-a4df-a5be3a6c4a24#report/company_summary']","['Private', 'https://www.crunchbase.com/organization/timelio']",0.25,0.25,0.375,0.0,0.21875
AP van den Berg: Cone Penetration Test equipment and ...,https://www.apvandenberg.com/,Cone Penetration Testing (CPTU) equipment for onshore  offshore & near shore soil investigation  that is what A.P. van den Berg designs and supplies.,apvandenberg,None,"['ngi@ngi.no', 'https://www.apvandenberg.com/nl/over-a-p-van-den-berg/samenwerkingsverbanden']",None,"['van de universiteit van', 'van de ontwikkeling van', 'de werkomstandigheden van de', 'eén van de voorwaarden van de nieuwe', 'de scope van de accreditatie van het kalibratielaboratorium', 'van a.p. van', 'van de bediening van spoorbruggen', 'lid van de raad van', 'van de', 'de afwikkeling van de orders']",None,"['Manufacturing, Healthcare', 'from_classification_model']",None,None,None,None,None,None,0.0,0.0,0.0,0.0,0.0
THREAT INTELLIGENCE | THE NEXT ERA IN SECURITY,https://www.threatintelligence.com/,,threatintelligence,"['11 York Street, Sydney NSW 2000', 'https://www.threatintelligence.com/contact-us/']","['info@threatintelligence.com', 'https://www.crunchbase.com/organization/threat-intelligence']","['1300 809 437', 'https://www.threatintelligence.com/']","['security breaches', 'application security', 'security teams', 'security experience', 'security controls', 'security budget', 'security flaws', 'security training', 'security architectures', 'security experts']","[['Ty Miller', 'CEO'], 'https://www.crunchbase.com/organization/threat-intelligence']","[['Cyber SecurityInformation TechnologySecurity'], 'https://www.crunchbase.com/organization/threat-intelligence']","['2015', 'https://www.crunchbase.com/organization/threat-intelligence']",None,None,None,None,"['Private', 'https://www.crunchbase.com/organization/threat-intelligence']",0.25,0.25,0.75,0.0,0.3125
Blazeclan North America - The Leading Cloud Solutions ...,https://www.blazeclan.com/,Blazeclan is born-in-cloud  strategic partner of choice to organisations that want to deliver business excellence using cloud as a tool,blazeclan,"['Suite  30 , 401 Pacific Highway, Artarmon, NSW 2064 Australia', 'https://www.blazeclan.com/contact/']","['info@blazeclan.com', 'https://www.crunchbase.com/organization/blazeclan-technologies']","['+61 28068 1855', 'https://www.blazeclan.com/contact/']","['aws cloud services', 'aws cloud cost optimization', 'aws cloud environment', 'aws cloud cost optimization tools', 'aws cloud computing aws business essentials', 'aws cloud continuous logging', 'cloud native applications', 'cloud services', 'aws services', 'cloud based services']","[['Amit Bassi', 'CEO'], 'https://www.arnnet.com.au/article/627006/amit-bassi-brings-blazeclan-australia/']","[['Cloud ComputingCloud ManagementInformation TechnologySoftware'], 'https://www.crunchbase.com/organization/blazeclan-technologies']","['Jun 1, 2011', 'https://www.crunchbase.com/organization/blazeclan-technologies']",None,None,"['Australia', 'https://opencorporates.com/companies/au/619364359']",None,"['Private', 'https://www.crunchbase.com/organization/blazeclan-technologies']",0.25,0.25,0.375,0.0,0.21875
Lonely Planet | Travel Guides & Travel Information - Lonely ...,https://www.lonelyplanet.com/,Love travel? Discover  plan and book your perfect trip with expert advice  travel guides  destination information and inspiration from Lonely Planet.,lonelyplanet,"['3 Barrack Street Jetty, Perth WA 6000', 'https://www.lonelyplanet.com/australia/western-australia/perth/activities']","['social@lonelyplanet.com', 'https://www.crunchbase.com/organization/lonely-planet']","['+61 3 8379 8000', 'https://www.crunchbase.com/organization/lonely-planet']","['royal national park watarrka national park', 'francois peron national park sydney', 'conway national park national anzac', 'noosa national park art gallery', 'booti national park shark bay', 'road national park', 'royal national park', 'kuranda rainforest tour bundjalung national park', 'litchfield national park boronia beach', 'south australia burleigh head national park sarapiqui river cruise']","[['Tony Wheeler', 'CEO'], 'https://en.wikipedia.org/wiki/Lonely_Planet']","[['PublishingTravel'], 'https://www.crunchbase.com/organization/lonely-planet']","['1972', 'https://www.crunchbase.com/organization/lonely-planet']","['$10.61 million USD', 'https://www.dnb.com/business-directory/company-profiles.lonely_planet_publications_pty_limited.b3bed1344197cc7a.html']",None,None,None,"['Private', 'https://www.crunchbase.com/organization/lonely-planet']",0.25,0.0,0.25,0.0,0.125
Amazon Simple Storage Service endpoints and quotas - AWS ...,https://docs.aws.amazon.com/general/latest/gr/s3.html,s3-accesspoint.dualstack.ap-northeast-2.amazonaws.com**. ap-northeast-2  HTTP and HTTPS  Version 4 only. Asia Pacific (Singapore)  ap-southeast-1.,s3-ap-southeast-2.amazonaws,None,"['hello@coverhero.com.au', 'https://www.crunchbase.com/organization/coverhero/timeline/timeline']",None,None,"['Hyacinthe HAMON', 'founder(s)', 'https://www.crunchbase.com/organization/coverhero/timeline/timeline']","[['BlockchainFinanceFinTechInsuranceInsurTechMillennialsMobile Apps'], 'https://www.crunchbase.com/organization/coverhero/timeline/timeline']","['Jun 5, 2017', 'https://www.crunchbase.com/organization/coverhero/timeline/timeline']",None,None,"[' Sydney, New South Wales, Australia', 'https://www.crunchbase.com/organization/coverhero/timeline/timeline']",None,"['Private', 'https://www.crunchbase.com/organization/coverhero/timeline/timeline']",0.0,0.0,0.0,0.0,0.0
CQR: Cyber Security Consultants,https://www.cqr.com/,CQR’s Cyber Security Consultants will ensure your business  your people  your information and your technology are protected and empowered.,cqr,"['16 141 058 022 Office addresses: 136 Greenhill Road, UNLEY SA 5061', 'https://www.cqr.com/contact/']","['enquiries@cqr.com', 'https://www.crunchbase.com/organization/cqr']","['+61 (0)8 7325 6201', 'https://www.cqr.com/contact/']","['information security specialist cqr', 'information security services', 'information security management system', 'independent information security services', 'information security industry', 'information security awareness', 'information security specialist', 'cqr staff cyber security services', 'information security professionals', 'information security testers']","[['John Mitchell', 'Managing_Director'], 'https://au.linkedin.com/in/john-mitchell-b600314']","[['Cyber SecurityInformation TechnologyNetwork Security'], 'https://www.crunchbase.com/organization/cqr']","['2004', 'https://www.crunchbase.com/organization/cqr']","['$525,000 USD', 'https://www.dnb.com/business-directory/company-profiles.cqr_pty_ltd.4f4cc7e8d08d3a19fa25b0ad14edc9c3.html']",None,"['Australia', 'https://opencorporates.com/companies/au/151656218']",None,"['Private', 'https://www.crunchbase.com/organization/cqr']",0.25,0.25,0.375,0.0,0.21875
Lucidity Cloud Services,https://www.lucidity.co.nz/,Simplify your IT with our trusted cloud computing and managed IT services. Formerly known as MHA Cloud Computing  we are now Lucidity.,lucidity,"['PO Box 1387 , Shortland Street Auckland 1010', 'https://www.lucidity.co.nz/contact-us/']","['info@golucidity.com', 'https://www.crunchbase.com/organization/kr8os']","['+64 9 377 2227', 'https://www.lucidity.co.nz/contact-us/']","['microsoft powerapps training microsoft project', 'teams microsoft office', 'microsoft office', 'lucidity leverage microsoft azure', 'microsoft teams users', 'microsoft teams', 'microsoft new zealand', 'microsoft partner awards lucidity', 'microsoft applications', 'lucidity cloud strategy workshop microsoft teams']","[['Jarrad Clift', 'CEO'], 'https://au.linkedin.com/in/jarrad-clift-13662755']","[['AdvertisingAdvertising PlatformsBlockchainMobile Advertising'], 'https://www.crunchbase.com/organization/kr8os']","['Aug 2017', 'https://www.crunchbase.com/organization/kr8os']","['$19.6M', 'None']","['$0', 'None']",None,"['157', 'None']","['Private', 'https://www.crunchbase.com/organization/kr8os']",0.25,0.25,0.0,0.0,0.125
The Growth Fund: Home,https://thegrowthfund.com.au/,About The Growth Fund,thegrowthfund,"['Suite  2 , Level 33 Chifley Tower 2 Chifley Square Sydney NSW 2000 Australia', 'https://thegrowthfund.com.au/']","['enquiry@thegrowthfund.com.au', 'https://www.crunchbase.com/organization/the-growth-fund']","['+61 2 8052 0800', 'https://thegrowthfund.com.au/']","['other growth fund portfolio businesses', 'businesses', 'management teams', 'business performance', 'growth fund', 'other management team members', 'valuable business lessons', 'customer service expertise', 'specialised fuel services', 'sales teams']","[['SCOTT GRECK', 'Director'], 'https://www.dnb.com/business-directory/company-profiles.the_growth_fund_pty_ltd.7c4eea6fbd94709a8fe4b9885c7cc815.html']","['Finance and insurance, Real estate', 'from_classification_model']",None,"['$995,021 USD', 'https://www.dnb.com/business-directory/company-profiles.the_growth_fund_pty_ltd.7c4eea6fbd94709a8fe4b9885c7cc815.html']",None,None,None,"['Proprietorship Subsidiary', 'https://www.dnb.com/business-directory/company-profiles.the_growth_fund_pty_ltd.7c4eea6fbd94709a8fe4b9885c7cc815.html']",1.0,0.375,0.0,0.0,0.34375
Testpoint - Australia's Software Testing Consultancy - Official ...,https://testpoint.com.au/,Technology consulting  program project management  performance testing services  load testing services  managed testing services  test automation services.,testpoint,"['351 Oran Park Drive, Oran Park, NSW 1300', 'https://testpoint.com.au/']",None,"['+61 2 8315 4113', 'https://testpoint.com.au/contact-us/']","['software automation testing', 'test automation testing tools', 'application testing', 'automated software testing', 'automation testing solutions', 'necessary software testing experience', 'performance testing', 'automation testing services', 'automation testing', 'seamless software testing']","[['Fadi Hawli', 'CEO'], 'https://thesiliconreview.com/magazine/profile/testpoint--shines-a-new-light-on-the--software-industry']","[['Information TechnologyQuality AssuranceUsability Testing'], 'https://www.crunchbase.com/organization/testpoint']","['Jan 1, 2007', 'https://www.crunchbase.com/organization/testpoint']","['$1.63 million USD', 'https://www.dnb.com/business-directory/company-profiles.testpoint_pty_ltd.4b09cdbb2af82b11895bbf99fd0e4f1e.html']",None,None,None,"['Private', 'https://www.crunchbase.com/organization/testpoint']",0.25,0.25,0.375,0.0,0.21875
PCI Consulting Australia,https://www.pciconsultingaustralia.com.au/,PCI Consulting Australia’s goal is to assist your business in achieving PCI DSS compliance. Our team of skilled Information Security professionals work in partnership with our clients for you to not only achieve compliance but also maintain it.,pciconsultingaustralia,"['Level  14 , 309 Kent Street, Sydney NSW 2000', 'https://www.pciconsultingaustralia.com.au/contact']","['info@pciconsultingaustralia.com.au', 'https://www.pciconsultingaustralia.com.au/contact']","['1300 997 290', 'https://www.pciconsultingaustralia.com.au/']","['pci consulting australia', 'remediation pci consulting australia', 'pci consulting australia testimonials industry', 'pci dss assessments', 'pci dss compliance', 'pci consulting australia code reviews careers', 'pci related assessment work', 'pci compliance', 'pci compliant', 'pci dss requirement']",None,"[['Web Hosting'], 'https://www.crunchbase.com/organization/ecorner']","['2003', 'https://www.crunchbase.com/organization/ecorner']",None,None,None,None,"['Private', 'https://www.crunchbase.com/organization/ecorner']",0.25,0.25,0.0,0.0,0.125
Braintree | Online Payment Solutions and Global Payment ...,https://www.braintreepayments.com/,Reach more buyers and drive higher conversion with an online payment solution that processes PayPal  Venmo  credit and debit cards  Apple Pay  and Google Pay.,braintreepayments,"['1 York Street Sydney NSW 2000 Australia', 'https://www.braintreepayments.com/contact']","['support@braintreepayments.com', 'https://www.crunchbase.com/organization/braintree-payment-solutions']",None,"['eligible braintree merchants', 'braintree direct merchants', 'braintree merchant poshmark', 'braintree payments system', 'braintree helps', 'merchant initiated transactions', 'new merchants', 'existing braintree customers', 'merchant data chargebacks', 'online merchants']","['Bryan Johnson', 'founder(s)', 'https://www.crunchbase.com/organization/braintree-payment-solutions']","[['BillingCredit CardsFinTechPayments'], 'https://www.crunchbase.com/organization/braintree-payment-solutions']","['Oct 2007', 'https://www.crunchbase.com/organization/braintree-payment-solutions']",None,None,None,None,"['Private', 'https://www.crunchbase.com/organization/braintree-payment-solutions']",0.25,0.0,0.0,0.0,0.0625
BT Consulting: Home,https://btconsulting.co.nz/,,btconsulting,"['Level  27 , PwC Tower 188 Quay Street Auckland 1010 New Zealand', 'https://btconsulting.co.nz/contact/']",None,"['+64 22 657 3252', 'https://btconsulting.co.nz/about/']","['security threats', 'security solution', 'cyber security threats', 'cyber security solutions', 'outsourced security solutions', 'network security infrastructures', 'network security management', 'high level security solutions', 'security', 'security teams']","[['Bao Truong', 'Managing_Director'], 'https://au.linkedin.com/in/bao-truong-39bb7045']","[['Cyber SecurityNetwork Security'], 'https://www.crunchbase.com/organization/bt-consulting-57ab']","['Jan 1, 2015', 'https://www.crunchbase.com/organization/bt-consulting-57ab']",None,None,"['Australia', 'https://opencorporates.com/companies/au/145568458']",None,"['Private', 'https://www.crunchbase.com/organization/bt-consulting-57ab']",0.25,0.25,0.0,0.0,0.125
Financial Review - Business_ Finance and Investment News ...,https://www.afr.com/,Skip to navigationSkip to contentSkip to footerHelp using this website - Accessibility statementExperience the AFR for half the priceSave 50% Now. Today's ...,afr,"['506 Sydney NSW 2001', 'https://www.afr.com/privacy-policy?Embed=Y']","['nila.sweeney@afr.com.au', 'https://www.afr.com/property/residential/work-from-anywhere-fuels-demand-for-airbnb-rentals-20200923-p55y9o']","['+61 2 7966 6900', 'https://www.afr.com/conditions-of-use']","['government bond rates', 'more australian state government bonds', 'government bonds', 'us government bonds', 'australian governments', 'australian government debt', 'government bond record', 'commonwealth government bonds', 'state governments', 'cent interest rate']","[['Nick Hawkins', 'CEO'], 'https://www.afr.com/companies/financial-services/iag-names-nick-hawkins-new-ceo-20200921-p55xjj']","[['NewsPublishingSocial News'], 'https://www.crunchbase.com/organization/australian-financial-review']","['30 June 2020', 'https://opencorporates.com/companies/au/642201821']","['3.5M', 'https://app.avention.com/company/1cb4cca9-f5d2-3366-adfc-4e3ea586f6ff#report/company_summary']",None,"[' Pyrmont, New South Wales, Australia', 'https://www.crunchbase.com/organization/australian-financial-review']","['30', 'https://app.avention.com/company/1cb4cca9-f5d2-3366-adfc-4e3ea586f6ff#report/company_summary']","['Private', 'https://www.crunchbase.com/organization/australian-financial-review']",0.25,0.25,0.0,0.0,0.125
ANZ Bank New Zealand Ltd | Online Banking | ANZ,https://www.anz.co.nz/personal/,We offer a wide range of financial services in NZ  with global reach as a subsidiary of the ANZ Group. Talk to the Bank with more experts in more places.,anz,"['23 -29 Albert St Auckland 1010 New Zealand', 'https://www.anz.co.nz/personal/']","['companycards@anz.com', 'https://www.anz.co.nz/business/products-services/business-credit-cards/manage-business-commercial-cards/']","['+64 9 252 3493', 'https://www.anz.co.nz/institutional/finance-capital/specialised-finance/']","['anz new zealand', 'relevant anz business workshops', 'anz investments anz financial wellbeing report', 'anz customers', 'anz', 'anz bank new zealand limited', 'anz accounts', 'anz new zealand investments limited', 'new zealand businesses', 'anz credit']","[['Shayne Cary ELLIOTT', 'Director'], 'https://www.dnb.com/business-directory/company-profiles.anz_bank_new_zealand_limited.c134680133c75e1036e7e4e8d7e6574d.html']","[['BankingFinanceFinancial ServicesWealth Management'], 'https://www.crunchbase.com/organization/anz']","['Mar 2, 1835', 'https://www.crunchbase.com/organization/anz']","['$4.82 billion USD', 'https://www.dnb.com/business-directory/company-profiles.anz_bank_new_zealand_limited.c134680133c75e1036e7e4e8d7e6574d.html']",None,"['New Zealand', 'https://opencorporates.com/companies/nz/35976']",None,"['Public', 'https://www.crunchbase.com/organization/anz']",0.625,0.25,0.0,0.0,0.21875
Vonage: Communication APIs_ Contact Centre_ Business ...,https://www.vonage.com.au/,Vonage offers flexible and scalable voice  messaging  video and data capabilities across Unified Communications  Contact Centres and Communications APIs.,vonage,None,"['press@nexmo.com', 'https://www.crunchbase.com/organization/vonage']",None,"['customer communication channels', 'customer communication', 'aramex customer communications', 'customer experience companies', 'customer experience analytics vonage sms network', 'customer experience industry', 'customer experience insight', 'innovative customer messaging experiences', 'better customer experiences', 'business communications']","[['Alan Masarek', 'CEO'], 'https://www.itwire.com/business-technology/vonage-opening-second-australian-office.html']","[['Developer APIsEnterpriseEnterprise ApplicationsMessagingMobilePaaSSoftwareTelecommunications'], 'https://www.crunchbase.com/organization/vonage']","['2001', 'https://www.crunchbase.com/organization/vonage']",None,"['$0', 'None']",None,"['3', 'None']","['Public', 'https://www.crunchbase.com/organization/vonage']",0.0,0.0,0.0,0.0,0.0
Over the Wire - IT Telecommunications Provider,https://overthewire.com.au/,We are your one-stop-shop for IT & Telco services including data networks  VOIP  hosting & IT security & support. Let's talk about your business today.,overthewire,"['LEVEL 24 100 CREEK STREET BRISBANE, QUEENSLAND, 4000 Australia', 'https://www.dnb.com/business-directory/company-profiles.over_the_wire_holdings_limited.ade8e6cc66978d49.html']","['privacy@overthewire.com.au', 'https://overthewire.com.au/privacy-policy/']","['+612 9191 9333', 'https://overthewire.com.au/contact/sydney/']","['private network services', 'traditional fibre business services', 'business grade telecommunications services', 'business security', 'business grade ethernet services', 'new business systems', 'cloud based infrastructure solutions businesses', 'business grade solutions', 'australian businesses', 'network solution']","[['MICHAEL NICTARIOS OMEROS', 'Director'], 'https://www.dnb.com/business-directory/company-profiles.over_the_wire_holdings_limited.ade8e6cc66978d49.html']","[['Data CenterInformation TechnologyInternetTelecommunications'], 'https://www.crunchbase.com/organization/over-the-wire']","['2007', 'https://www.crunchbase.com/organization/over-the-wire']","['$57.34 million USD', 'https://www.dnb.com/business-directory/company-profiles.over_the_wire_holdings_limited.ade8e6cc66978d49.html']",None,"['New Zealand', 'https://opencorporates.com/companies/nz/1482566']",None,"['Private', 'https://www.crunchbase.com/organization/over-the-wire']",0.375,0.25,0.1875,0.0,0.203125
