title,link,description,comp_name,address,email,telephone_number,keywords,contact_person,type_or_sector,founded_year,revenue,funding,headquarters,No_of_employees,company_status,address_confidence,tp_confidence,headquarters_confidence,contact_confidence,Total_confidence
MarketResearch.com: Market Research Reports and Industry ...,https://www.marketresearch.com/,The leading provider of market research reports and industry analysis on products  markets  companies  industries  and countries worldwide.,marketresearch,"['CRONULLA2230New South WalesAustralia', 'https://opencorporates.com/companies/au/630099393']","['reustice@marketresearch.com', 'https://www.marketresearch.com/customer/help']","['+6192 13640162', 'https://www.marketresearch.com/rss/standard/1715.xml']","['market analysis services', 'market research market', 'market growth', 'research services market', 'strategic market growth analysis', 'security market', 'market data', 'global market size', 'market research companies', 'market share analysis']","[['Jordan Tran ', 'Marketing Manager_AA Smartfuel'], 'from linkedin search google']","['Finance and insurance, IT - Software', 'from_classification_model']","['19 November 2018', 'https://opencorporates.com/companies/au/630099393']",None,None,"['Australia', 'https://opencorporates.com/companies/au/630099393']",None,"['Australian Proprietary Company, Limited By Shares', 'https://opencorporates.com/companies/au/630099393']",0.0,0.25,0.0,0.0,0.0625
IT Consulting Australia | AJQ Business & Technology Services,https://ajq.com.au/,Our company is a leading provider in the delivery of Information Technology & Professional Services  delivered by Industry Specialists with extensive experience.,ajq,"['CHIFLEY PLAZA CHIFLEY TOWER SHOP 29 2 CHIFLEY SQUARE SYDNEY, NEW SOUTH WALES, 2000 Australia', 'https://www.dnb.com/business-directory/company-profiles.the_trustee_for_ajq_trust.b3b896fafb20998c87c84b5834904cae.html']","['info@ajq.com.au', 'https://ajq.com.au/contact/']","['+61 2 92475999', 'https://ajq.com.au/2020/05/20/automation-for-a-fintech-in-a-salesforce-environment/']","['agile automation testing services', 'software test automation', 'project delivery software test automation', '#testing', 'software testing', '#testautomation #automation #ajq', '#automation #digitaltransformation #ajq', 'software testing environments', '#automation', 'manual testing specialists']","[['Bruce Clement', 'CEO'], 'https://themarketherald.com.au/armour-energy-asxajq-appoints-bruce-clement-as-ceo-2020-03-12/']","['IT - Software, Healthcare', 'from_classification_model']","['16 April 2020', 'https://opencorporates.com/companies/au/640339528']","['$145,811 USD', 'https://www.dnb.com/business-directory/company-profiles.the_trustee_for_ajq_trust.b3b896fafb20998c87c84b5834904cae.html']",None,"['Australia', 'https://opencorporates.com/companies/au/640339528']",None,"['Independent', 'https://www.dnb.com/business-directory/company-profiles.the_trustee_for_ajq_trust.b3b896fafb20998c87c84b5834904cae.html']",0.375,0.25,0.0,0.0,0.15625
Direct Debit_ BPAY_ Online Payment Solutions | Ezidebit ...,https://www.ezidebit.com/en-au,Ezidebit offers all of your business payment needs in one easy place. Choose from Direct Debit  BPAY  EFTPOS  and Real Time Payments  all under one system.,ezidebit,"['480 St Pauls Terrace, Fortitude Valley QLD 4006', ['Ezidebit, address', 'knowledge_panel']]","['info@ezidebit.com.au', 'https://www.crunchbase.com/organization/ezidebit']","['1300 763 256', 'https://www.ezidebit.com/en-au']","['customer payments', 'direct debit payments', 'payment solutions', 'payments', 'card payments', 'payment security', 'making payments', 'payment services', 'payment data', 'payment methods']","[['David Urry ', 'General Manager / Partner ..._LinkedIn'], 'None']","[['CRME-CommercePaymentsReal Time'], 'https://www.crunchbase.com/organization/ezidebit']","['1998', 'https://www.crunchbase.com/organization/ezidebit']","['$67.11 million USD', 'https://www.dnb.com/business-directory/company-profiles.ezidebit_pty_ltd.65c657adfafbacaf523f3c408d8faaf9.html']",None,"['Australia', 'https://opencorporates.com/companies/au/096902813']",None,"['Private', 'https://www.crunchbase.com/organization/ezidebit']",0.0,0.25,0.375,0.0,0.15625
Paychoice: Online Payment Gateway in Australia,https://www.paychoice.com.au/,Paychoice offers a complete Online Payment Gateway solution  including secure Online Payment Systems and more. Learn more today.,paychoice,"['Suite  6 , Level 2, 58-60 Victor Crescent, Narre Warren, VIC 3805', 'https://www.paychoice.com.au/']","['support@paychoice.com.au', 'https://www.crunchbase.com/organization/paychoice-07d7']","['1300 360 837', 'https://www.paychoice.com.au/']","['credit card payments', 'business processing credit card payments', 'processing credit card payments', 'secure credit card payments', 'real time payments', 'payments', 'cash payments', 'online payments', 'payment options', 'processing payments']","[['Mark Cordy', 'CEO'], 'https://www.crunchbase.com/person/mark-cordy']","[['Financial Services'], 'https://www.crunchbase.com/organization/paychoice-07d7']","['Jan 1, 2010', 'https://www.crunchbase.com/organization/paychoice-07d7']","['$306,448 USD', 'https://www.dnb.com/business-directory/company-profiles.paychoice_pty_ltd.605493924139f34db39d45f25d0a7e0d.html']",None,None,None,"['Private', 'https://www.crunchbase.com/organization/paychoice-07d7']",1.0,0.375,0.5,0.0,0.46875
Australian Information Security Awareness and Advisory ...,https://kirbyidau.com/,Contact. contact@kirbyIDau.com. Brisbane Queensland Australia. Advisory Services. Information Security Governance Risk and Compliance; Identity and ...,kirbyidau,None,None,None,"['australian information security incident reported', 'smh australian information security incident', 'l australian information security incident reported', 'l australian information security incident', 'australian information security incident', 'data breach |', 'security breach | zdnet incident', 'australian information security report', 'australian capital territory australian information security incident', 'security breach']","[['Steven Kirby ', 'Principal Advisor_kirbyIDau.com'], 'from linkedin search google']","['IT - Software, Finance and insurance', 'from_classification_model']",None,None,None,None,None,None,0.0,0.0,0.0,0.0,0.0
ILX Group: Accredited Project Training Courses & Consulting,https://www.ilxgroup.com/,Australia's largest and most trusted training provider  with online  virtual and classroom courses including PRINCE2  PRINCE2 Agile and ITIL since 2010.,ilxgroup,"['730 Springvale Rd, Mulgrave VIC 3170', ['ILX Group Australia, address', 'knowledge_panel']]","['contactus@ilxgroup.com', 'https://www.crunchbase.com/organization/ilx-group']","['+61-399352721', 'https://www.dnb.com/business-directory/company-profiles.dlc_property_group_pty_ltd.7de5ba4223b945a6483f4f8f6bdcae36.html']",None,"[['DANIEL CAPITANIO', 'Director'], 'https://www.dnb.com/business-directory/company-profiles.dlc_property_group_pty_ltd.7de5ba4223b945a6483f4f8f6bdcae36.html']","[['ConsultingEducationHuman ResourcesInformation TechnologyRecruiting'], 'https://www.crunchbase.com/organization/ilx-group']","['1988', 'https://www.crunchbase.com/organization/ilx-group']","['$520,000 USD', 'https://www.dnb.com/business-directory/company-profiles.dlc_property_group_pty_ltd.7de5ba4223b945a6483f4f8f6bdcae36.html']",None,"['New Zealand', 'https://opencorporates.com/companies/nz/3710501']",None,"['Public', 'https://www.crunchbase.com/organization/ilx-group']",0.0,0.0,0.0,0.0,0.0
Future in Australia: Home,https://www.futureinaustralia.com/,Previous Next Hey! Get a free assessment done by our experts. It takes just 10 mins to submit this assessment form and get insights from our immigration councilors on your Australia immigration. Pre-Assessment Form Our Credential Registered Migration Agent – Australia Registered Migration Agent – New Zealand Member of Migration Alliance Member of Migration Institute […],futureinaustralia,"['4 /40 Alexandra palace, Bentley, WA 6102 Australia', 'https://www.futureinaustralia.com/']","['edu@futureinaustralia.com', 'https://www.futureinaustralia.com/employer/what-if-my-visa-gets-rejected/']","['+61 406784646', 'https://www.futureinaustralia.com/']","['student visa australia', 'repealed visas student visa', 'student visa applications', 'i’ve applied student visa', 'australia study visa', 'new student visa', 'international student visa applications', 'international student visas', 'student visa subclasses', 'student visa rejection']","[['Zaldy Bolneo ', 'Owner_Future in Australia Migration'], 'from linkedin search google']","['Education, Finance and insurance', 'from_classification_model']",None,None,None,None,None,None,0.25,0.25,0.0,0.0,0.125
Home Thales,https://www.thalesgroup.com/en,From Aerospace  Space  Defence to Security & Transportation  Thales helps its customers to create a safer world by giving them the tools they need to perform ...,thalesgroup,None,"['pilar.gonzalez@thalesgroup.com', 'https://www.thalesgroup.com/en/countries/europe/spain']",None,"['de la ligne de produits altimétriques de thales alenia space', 'de la ligne de', 'de thales', 'd’apprentissage et de formation interne de thales', 'et solutions de thales microwave', 'thales thales', 'de la science et de l’espace', 'la medición de la altura de la superficie', 'reconnue de thales et', 'de la terre et la gestion de l’environnement']","[['Ashley Deacon ', 'Thales Australia and New Zealand_LinkedIn'], 'from linkedin search google']","['IT - Software, Manufacturing', 'from_classification_model']",None,None,None,None,None,None,0.0,0.0,0.0,0.0,0.0
Cyber Citadel: Cyber Security Services - Protection against ...,https://www.cybercitadel.com/,We specialise in protecting companies from cyber attacks. It’s all we do  all over the world  and we’re good at it.,cybercitadel,"['Level  25 , Tower 3 300 Barangaroo Ave Barangaroo NSW 2000', 'https://www.cybercitadel.com/']","['info@cybercitadel.com', 'https://www.crunchbase.com/organization/cyber-citadel']","['+64 9 940 2250', 'https://www.cybercitadel.com/']","['company security', 'logistics company security', 'traditional security companies', 'device security', 'security vulnerabilities', 'many security vulnerabilities', 'cyber security risks', 'security risk', 'data security issues', 'cryptolocker cyber security']","[['Jonathan Sharrock', 'Managing_Director'], 'https://www.cybercitadel.com/toll-costly-recovery/']","[['Cyber SecuritySecurity'], 'https://www.crunchbase.com/organization/cyber-citadel']","['Jan 1, 2017', 'https://www.crunchbase.com/organization/cyber-citadel']",None,None,"['Australia', 'https://opencorporates.com/companies/au/622880657']",None,"['Private', 'https://www.crunchbase.com/organization/cyber-citadel']",0.25,0.25,0.0,0.0,0.125
Interactive - Australia's Largest Privately Owned IT Company,https://www.interactive.com.au/,We deliver Cloud Managed Services  Data Centre  Business Continuity and Hardware Maintenance for organisations of all sizes. Contact us to find out more.,interactive,"['19 McKechnie Drive Brisbane Technology Park Eight Mile Plains QLD 4113', 'https://www.interactive.com.au/contact-us/']",None,"['1800 468 372', 'https://www.interactive.com.au/services-info-hub/network-maintenance-services/']","['critical business data', 'cloud service providers', 'cloud service', 'business continuity providers', 'cloud managed services', 'business network support', 'more business', 'business technology systems', 'outside cloud service providers', 'businesses']","[['Mal McHutchison', 'Managing_Director'], 'https://www.crn.com.au/news/interactive-hires-macquarie-capitals-mal-mchutchison-as-new-ceo-as-christopher-ride-steps-down-476957']","[['Software'], 'https://www.crunchbase.com/organization/interactive']","['1988', 'https://www.crunchbase.com/organization/interactive']","['1.1B', 'https://app.avention.com/company/e10fc7dd-e457-3dd5-8e93-277c71907b61#report/company_summary']",None,"[' Port Melbourne, Victoria, Australia', 'https://www.crunchbase.com/organization/interactive']","['9k', 'https://app.avention.com/company/e10fc7dd-e457-3dd5-8e93-277c71907b61#report/company_summary']","['Private', 'https://www.crunchbase.com/organization/interactive']",0.25,0.25,0.25,0.0,0.1875
eCorner,https://www.ecorner.com.au/,Sell online with eCorner - Australian provider of secure eCommerce solutions and online stores for your online retail or wholesale business_Web site,ecorner,"['5 51 INDUSTRY COURT YANDINA, QUEENSLAND, 4561 Australia', 'https://www.dnb.com/business-directory/company-profiles.ecorner_pty_limited.abe74433dcd178575cc2962fba7970a9.html']","['info@ecorner.com.au', 'https://www.ecorner.com.au/Assist-Contact']","['+612 9893 1870', 'https://www.ecorner.com.au/Assist-Contact']","['business critical online systems', 'ecorner stores', 'online store content', 'ecorner merchants ecorner', 'secure online stores', 'online store accesses', 'most online stores', 'ecommerce ecorner', 'ecommerce business', 'ecorner systems']","[['John Debrincat', 'CEO'], 'https://www.retailglobal.com.au/speaker/john-debrincat-2/']","[['Web Hosting'], 'https://www.crunchbase.com/organization/ecorner']","['2003', 'https://www.crunchbase.com/organization/ecorner']","['$868,079 USD', 'https://www.dnb.com/business-directory/company-profiles.ecorner_pty_limited.abe74433dcd178575cc2962fba7970a9.html']",None,None,None,"['Private', 'https://www.crunchbase.com/organization/ecorner']",0.0,0.25,0.375,0.0,0.15625
Law Institute of Victoria: Home,https://www.liv.asn.au/,2020 LIV Council Elections ... VIC 3000; Post PO Box 263  Melbourne VIC 3001; Phone +61 3 9607 9311; Fax +61 3 9602 5270; Email inquiries@liv.asn.au.,liv.asn.au,"['PO Box 263 Melbourne VIC 3001', 'https://www.liv.asn.au/find-a-lawyer']","['membership@liv.asn.au', 'https://www.liv.asn.au/Professional-Practice/Supporting-You/COVID-19-Hub/LIV-Member-Services---Support']","['+61 3 9602 5270', 'https://www.liv.asn.au/find-a-lawyer']",None,"[['STEVE BUTLER', 'Secretary'], 'https://www.dnb.com/business-directory/company-profiles.electrical_trades_union_of_aust_nsw.641a70b54c7e77ab584320090e5f561d.html']","[['E-CommerceEnterprise SoftwareTravel'], 'https://www.crunchbase.com/organization/livn-group']","['Oct 1, 2010', 'https://www.crunchbase.com/organization/livn-group']","['$4.84 million USD', 'https://www.dnb.com/business-directory/company-profiles.electrical_trades_union_of_aust_nsw.641a70b54c7e77ab584320090e5f561d.html']",None,"['Australia', 'https://opencorporates.com/companies/au/144964858']",None,"['Private', 'https://www.crunchbase.com/organization/livn-group']",0.25,0.25,0.25,0.0,0.1875
INX Software | Workforce Management Software | OHS ...,https://www.inxsoftware.com/,INX Software's workplace health  safety  environment  workforce scheduling and quality management solution enables organisations to achieve compliance  ...,inxsoftware,"['Level  2 , 1111 Hay Street, West Perth, Western Australia 6005', 'https://www.inxsoftware.com/about']","['support@inxsoftware.com', 'https://www.crunchbase.com/organization/inx-software']","['+61 (0)7 3303 0165', 'https://www.inxsoftware.com/about']","['inx software safety management', 'inx software people information', 'relevant inx software solutions', 'inx software appoints', 'updates inx software', 'inx software update', 'safety inx', 'inx software service', 'inx software inc.', 'inx software ceo']","[['Basil Lenzo', 'CEO'], 'https://www.zoominfo.com/p/Basil-Lenzo/1492267248']","[['ComputerEnterprise SoftwareLocal BusinessSoftware'], 'https://www.crunchbase.com/organization/inx-software']","['2000', 'https://www.crunchbase.com/organization/inx-software']","['$15.44 million USD', 'https://www.dnb.com/business-directory/company-profiles.inx_software_pty_ltd.f5adc42d1ec826cfebcfe64530186528.html']",None,"[' Perth, Western Australia, Australia', 'https://www.crunchbase.com/organization/inx-software']",None,"['Private', 'https://www.crunchbase.com/organization/inx-software']",1.0,0.25,0.375,0.0,0.40625
Reseller News - The voice of the New Zealand IT channel,https://www.reseller.co.nz/,The source for IT industry news  views and analysis across the channel  business and technology.,reseller,None,"['investors@vitagroup.com.au', 'https://www.crunchbase.com/organization/next-byte']","['+61 1 30036 1119', 'https://www.crunchbase.com/organization/next-byte']","['new zealand reseller news', 'business partner', 'new zealand distributors', 'ict awards reseller news', 'new partners', 'such personal data', 'channel partners', 'reseller news', 'personal data', 'idgc partners']","[['Annette Kimmitt', 'CEO'], 'https://www.minterellison.com/people/annette-kimmitt']","[['HardwareSoftware'], 'https://www.crunchbase.com/organization/next-byte']","['1995', 'https://www.crunchbase.com/organization/next-byte']",None,None,"[' Sydney, New South Wales, Australia', 'https://www.crunchbase.com/organization/next-byte']",None,"['Private', 'https://www.crunchbase.com/organization/next-byte']",0.0,0.0,0.0,0.0,0.0
CodeBlue Australia: Managed IT services and technology ...,https://code-blue.com.au/,"CodeBlue is the largest IT Services company working with small-to-medium businesses and organisations across Australia and New Zealand._CodeBlue is the largest IT Services company working with small-to-medium businesses and organisations across Australia and New Zealand._Empowering people through technology – one solution at a time.

We put people back into technology  taking the time to understand your business and matching it with the technology you need. WHERE IS YOUR TECHNOLOGY LEADING YOU?",code-blue,"['5218 SYDNEY NSW 2001', 'https://code-blue.com.au/privacy-notice/']","['hello@codecamp.com.au', 'https://www.crunchbase.com/organization/code-camp']","['1300 562 886', 'https://code-blue.com.au/']","['data businesses', 'business systems', 'it business model', 'business customers', 'more businesses', 'business recovery', 'business disasters', 'many businesses', 'digital business', 'business productivity']","[['Luke Smithson', 'Managing_Director'], 'https://au.linkedin.com/in/luke-smithson-75a92a110']","[['STEM Education'], 'https://www.crunchbase.com/organization/code-camp']","['Dec 1, 2013', 'https://www.crunchbase.com/organization/code-camp']","['$23.43 million USD', 'https://www.dnb.com/business-directory/company-profiles.code_blue_recruitment_pty_ltd.04ca42f0c75b265a886cf40d6069ab3a.html']",None,"['Australia', 'https://opencorporates.com/companies/au/103394529']",None,"['Private', 'https://www.crunchbase.com/organization/code-camp']",0.25,0.25,0.0,0.0,0.125
First Focus: Managed Service Provider | Managed Services,https://www.firstfocus.com.au/,Australia's #1 Rated Managed Service Provider. Professional Managed IT Services in Sydney  Melbourne  Brisbane  Perth  Adelaide  Hobart  Wollongong & Auckland.,firstfocus,"['L2 4A Lord St Botany, NEW SOUTH WALES, 2019 Australia', 'https://www.dnb.com/business-directory/company-profiles.first_focus_it_pty_limited.b423c01812d6dfe2.html']","['info@firstfocus.org', 'https://www.crunchbase.com/organization/first-focus']","['+61 2 9007 8100', 'https://www.firstfocus.com.au/blog/locations/manila-msp/']","['services first focus', 'it services', 'it services provider', 'business it', 'first focus mfa', 'many other it support services', 'managed wan services', 'trust first focus', 'it service providers', 'redundancy first focus']","[['ROSS SARDI', 'Chief Executive Officer'], 'https://www.dnb.com/business-directory/company-profiles.first_focus_it_pty_limited.b423c01812d6dfe2.html']","[['Education'], 'https://www.crunchbase.com/organization/first-focus']","['2005', 'https://www.crunchbase.com/organization/first-focus']","['$16.47 million USD', 'https://www.dnb.com/business-directory/company-profiles.first_focus_it_pty_limited.b423c01812d6dfe2.html']",None,"['New Zealand', 'https://opencorporates.com/companies/nz/3402272']",None,"['Private', 'https://www.crunchbase.com/organization/first-focus']",0.0,0.25,0.0,0.0,0.0625
Blackpeak Capital: Home,https://www.blackpeakcapital.com.au/,,blackpeakcapital,"['40 -42 Young St Sydney NSW 2000', 'https://www.blackpeakcapital.com.au']","['inquiries@blackpeakcapital.com.au', 'https://www.crunchbase.com/organization/blackpeak-capital']","['+61 2 8823 3464', 'https://www.crunchbase.com/organization/blackpeak-capital']","['blackpeak capital technology market', 'blackpeak capital blackpeak capital', 'blackpeak capital technology market update', 'hcf blackpeak capital technology market update', 'oz minerals blackpeak capital technology market', 'blackpeak capital fintech market update', 'blackpeak capital it services market', 'australis blackpeak capital fintech market update', 'technology growth companies', 'technology markets']","[['Scott Colvin', 'CEO'], 'https://www.blackpeakcapital.com.au/']","[['BankingFinanceFinancial ServicesLocal Business'], 'https://www.crunchbase.com/organization/blackpeak-capital']","['Jan 1, 2014', 'https://www.crunchbase.com/organization/blackpeak-capital']","['$418,188 USD', 'https://www.dnb.com/business-directory/company-profiles.blackpeak_capital_pty_ltd.747988a2de94df4a2a7290bde09993f1.html']",None,None,None,"['Private', 'https://www.crunchbase.com/organization/blackpeak-capital']",0.25,0.375,0.75,0.0,0.34375
Bulletpoint | Australia's Highest Rated Government Grant ...,https://www.bulletpoint.com.au/,"Bulletpoint is Australia's Highest Rated Government Grant and R&D Tax Incentive Consultant. They can help you obtain grants for R&D Tax Incentive and EMDG.__As featured in 
How I can help you get a government grant 
Tell me a bit about your business and why you need a government grant",bulletpoint,"['500 ,000 $1,670,000 Dandenong South, VIC 3175', 'https://www.bulletpoint.com.au/advanced-manufacturing-growth-fund/']",None,"['1300 658 508', 'https://www.bulletpoint.com.au/contact-us-2/']","['nexusmyst pty ltd shorthand pty ltd', 'cybermetrix pty ltd hermetia biosystems pty ltd', 'pty ltd', 'pty ltd funding', 'mcgregor diesel pty ltd conveyor innovations international pty ltd', 'haystack australia pty ltd', 'biotein australia pty ltd', 'sorted australia pty ltd', 'infofish australia pty ltd', 'codemakers australia pty ltd']","[['Ben Cusack', 'founder'], 'https://www.bulletpoint.com.au/']","['Finance and insurance, Education', 'from_classification_model']",None,"['$296,469 USD', 'https://www.dnb.com/business-directory/company-profiles.bulletpoint_pty_ltd.372d1e60c04505376758cba9a68a72ed.html']",None,None,None,"['Proprietorship Independent', 'https://www.dnb.com/business-directory/company-profiles.bulletpoint_pty_ltd.372d1e60c04505376758cba9a68a72ed.html']",0.25,0.25,0.375,0.0,0.21875
Glassdoor Job Search | Find the job that fits your life,https://www.glassdoor.com/index.htm,Search millions of jobs and get the inside scoop on companies with employee reviews  personalized salary tools  and more. Hiring? Post a job for free.,glassdoor,None,"['omurray@accessintel.com', 'https://www.glassdoor.com/Jobs/TDS-Telecommunications-Jobs-E33603.htm']",None,"['glassdoor jobs', 'glassdoor employees', 'time jobs', 'glassdoor other employee reviews glassdoor reviews', 'jobs glassdoor', 'tds telecommunications jobs', 'westchester part time jobs', 'senior financial analyst career glassdoor jobs restaurants', 'tds telecommunications employees', 'other job information']","[['Allison Harvey ', 'HR Business Partner_ APAC_Itron ...'], 'from linkedin search google']","['Finance and insurance, Arts, entertainment and recreation', 'from_classification_model']",None,None,None,None,None,None,0.0,0.0,0.0,0.0,0.0
phew – Practical Cyber Security,https://phew.co.nz/,"With a team of experienced and qualified specialists  phew prides itself on making cyber security accessible and understandable to all businesses._With a team of experienced and qualified specialists  phew prides itself on making cyber security accessible and understandable to all businesses._Simplifying cyber security
Clarity on where you are up to  what you should change  and what is most important for the security  stability and growth of your business.    

OUR SERVICES    
Cyber Health Report 
Robust and in-depth audit and report of your
business cyber risks  with a",phew,"['2020 On 1 December 2020 the new New Zealand Privacy Act', 'https://phew.co.nz/the-new-privacy-act-2020/']","['info@phew.co.nz', 'https://phew.co.nz/']","['+649 884 0969', 'https://phew.co.nz/']","['cyber security incidents', 'information security', 'recent cyber security incidents', 'cyber security risks', 'cyber security issues', 'cyber security specialists', 'access security', 'better data security', 'small business websites', 'cyber security']","[['Paul Bryant ', 'Director_phew.'], 'None']","['IT - Software, Finance and insurance', 'from_classification_model']","['22 November 2017', 'https://opencorporates.com/companies/nz/6564592']",None,None,"['New Zealand', 'https://opencorporates.com/companies/nz/6564592']",None,"['NZ Limited Company', 'https://opencorporates.com/companies/nz/6564592']",0.25,0.25,0.375,0.0,0.21875
