title,link,description,comp_name,address,email,telephone_number,keywords,contact_person,type_or_sector,founded_year,revenue,funding,headquarters,No_of_employees,company_status,address_confidence,tp_confidence,headquarters_confidence,contact_confidence,Total_confidence
Wintec,https://www.wintec.ac.nz/,Wintec : Courses In Hamilton and the Waikato. Courses  certificates  diplomas and degrees. Learn in real work environments from industry experts. Create your world.,wintec.ac.nz,"['2011 . Master of Management Studies (Honours), University of Waikato 2009', 'https://www.wintec.ac.nz/study-at-wintec/faculty/centre-for-health-and-social-practice/our-staff/rachel-hunter']","['wintec@winweb.co.jp', 'https://www.crunchbase.com/organization/wintec-cba5']","['+64 7 834 8800', 'https://www.wintec.ac.nz/study-at-wintec/faculty/centre-for-health-and-social-practice/our-staff/rawiri-(david)-waretini-karena']","['pasifika students', 'wintec māori pasifika', 'wintec māori pasifika trades', 'wintec programmes', 'health pathway students', 'wintec māori', 'ko te Vectra Corp.,https://www.vectra-corp.com/,Vectra is an Australian leader in the provision of cyber security consulting  risk management  compliance and managed services.,vectra-corp,"['145 South Tce Adelaide, SOUTH AUSTRALIA, 5000 Australia', 'https://www.dnb.com/business-directory/company-profiles.vectra_corporation_limited.d3bd4abceda06a3abb3dd8696f6b95ce.html']","['info@vectra.ai', 'https://www.crunchbase.com/organization/vectra-networks']","['+61 2 9276 1800', 'https://www.vectra-corp.com/contact']","['data security threats', 'data security solutions', 'data security', 'information security threats', 'security services', 'managed security services', 'business security', 'security systems', 'vectNEXION Networks: Cloud | Security | Networking | Data Centre,https://www.nexionnetworks.com/,Global Cloud  Security  Networking & Data Centre Company. Experience in full end-to-end ICT Solutions. Hybrid  Public & Private Cloud. Call us today!,nexionnetworks,"['37 -39 Robinson Avenue (Cnr Robinson & Francisco St), Belmont, WA 6104 Australia', 'https://www.nexionnetworks.com/contact/']","['servicedesk@nexionnetworks.com', 'https://www.nexionnetworks.com/fortinet-network-security-threat-map/']","['+61 8 9441 4835', 'https://www.nexionnetworks.com/contact/']","['leading nexion networks data solution', 'customer nexion networks', 'adelaide nexion networks', 'nexion networks failure', 'nexion networks suppliers', 'saas nexion networks', 'nexion networks signed', 'nexion networks liability', 'nexion networks top', 'payments nexion networks']","[['Paul Glass', 'CEO'], 'https://au.linkedin.com/in/paul-glass-041a9920']","['IT - Software, Finance and insurance', 'from_classification_model']",None,None,None,None,None,None,0.25,0.25,0.0,0.0,0.125
Unitec | Study in Auckland. Certificate_ Diploma_ Degree ...,https://www.unitec.ac.nz/,Unitec Institute of Technology offers short courses  certificates  diplomas and degrees at Mt Albert and Henderson campuses in Auckland  NZ._Unitec Institute of Technology offers short courses  certificates  diplomas and degrees at Mt Albert and Henderson campuses in Auckland  NZ.,unitec.ac.nz,"['205 Queen Street Branch, Auckland New Zealand', 'https://www.unitec.ac.nz/application-and-funding/fees/paying-your-fees']","['research@aut.ac.nz', 'https://www.crunchbase.com/organization/auckland-university-of-technology']","['+649 358 5453', 'https://www.unitec.ac.nz/about-us/coronaviruscovid-19-updates-from-unitec']","['unitec students', 'unitec science students', 'new students', 'unitec drainlaying student yirui miao', 'unitec new zealand ltd library', 'student central date new zealand', 'unitec student services', 'unitec graduates', 'student support teams', 'student support services']","[['RICK EDE', 'Chief Executive Officer'], 'https://www.dnb.com/business-directory/company-profiles.unitec_institute_of_technology.f6dade3a7a0d49e329439a52d2091019.html']","[['EducationHigher EducationUniversities'], 'https://www.crunchbase.com/organization/auckland-university-of-technology']","['2000', 'https://www.crunchbase.com/organization/auckland-university-of-technology']","['$147.68 million USD', 'https://www.dnb.com/business-directory/company-profiles.unitec_institute_of_technology.f6dade3a7a0d49e329439a52d2091019.html']",None,"['New Zealand', 'https://opencorporates.com/companies/nz/9429041925287']",None,"['Parent', 'https://www.dnb.com/business-directory/company-profiles.unitec_institute_of_technology.f6dade3a7a0d49e329439a52d2091019.html']",0.25,0.25,0.0,0.0,0.125
Citrix: People-centric solutions for a better way to work - Citrix,https://www.citrix.com/,Citrix delivers people-centric solutions that power a better way to work by offering secure apps and data on any device  network or digital workspace.,citrix,"['Level  23 , 100 Mount Street North Sydney NSW 2060 Australia', 'https://www.citrix.com/en-id/about/executive-briefing/sydney.html']","['secure@citrix.com', 'https://www.crunchbase.com/organization/citrix-systems']","['+61 2 8870 0800', 'https://www.citrix.com/en-au/']","['citrix och', '############################################################################# collaborate', '####################################################', 'citrix för', 'citrix vars funktion liknar citrix receiver', 'för citrix workspace', 'citrix workspace', 'citrix solutions', 'citrix support', 'citrix customers']","[['David Henshall', 'Managing_Director'], 'https://www.citrix.com/en-au/about/executives/david-henshall.html']","[['Enterprise SoftwareSaaSSoftwareVirtualization'], 'https://www.crunchbase.com/organization/citrix-systems']","['1989', 'https://www.crunchbase.com/organization/citrix-systems']",None,None,None,None,"['Public', 'https://www.crunchbase.com/organization/citrix-systems']",1.0,0.25,0.0,0.0,0.3125
Simuserv - Pioneer in CAE_ simulation software_ operating in ...,https://www.simuserv.com/,,simuserv,"['3 Glenside Crescent Eden Terrace Auckland, AUCKLAND, 1010 New Zealand', 'https://www.dnb.com/business-directory/company-profiles.simuserv_pty_ltd.9204301750aaad2198f19bfcb78d38b0.html']","['info@simuserv.com', 'https://www.simuserv.com/contact.php']","['+61 (8) 9277 8847', 'https://www.simuserv.com/support.php']","['product simulation', 'simulation system', 'simulation solutions', 'abaqus simulation system', 'simulation software', 'simulation suite', 'simulation models', 'designer simulation', 'simulation process capabilities', 'simulation technology']","[['Gerd Diegelmann', 'Managing_Director'], 'https://au.linkedin.com/in/gerd-diegelmann']","['Manufacturing, IT - Software', 'from_classification_model']",None,"['$1.28 million USD', 'https://www.dnb.com/business-directory/company-profiles.simuserv_pty_ltd.9204301750aaad2198f19bfcb78d38b0.html']",None,None,None,"['Foreign\xa0Company Subsidiary', 'https://www.dnb.com/business-directory/company-profiles.simuserv_pty_ltd.9204301750aaad2198f19bfcb78d38b0.html']",0.75,0.25,0.75,0.0,0.4375
Aura Information Security,https://www.aurainfosec.com/,New Zealand's top cyber security consultants  Aura Information Security offers leading IT risk assessments to help NZ businesses make better security decisions.,aurainfosec,"['79 Boulcott Street, Wellington Central, Wellington6011NZ', 'https://opencorporates.com/companies/nz/1757025']","['emilyb@peadpr.co.nz', 'https://www.aurainfosec.com/news-and-events/files/frans-lategan-joins-aura-information-security-as-principal-consultant.html']","['0800 2872 12', 'https://www.crunchbase.com/organization/aura-information-security']","['information security business', 'successful cyber security businesses', 'information security', 'cyber security', 'security', 'data security', 'security companies', 'information security risk', 'systems security', 'cyber security services']","['Andy Prow', 'founder(s)', 'https://www.crunchbase.com/organization/aura-information-security']","[['ConsultingCyber SecurityInformation TechnologyProfessional NetworkingProfessional Services'], 'https://www.crunchbase.com/organization/aura-information-security']","['2001', 'https://www.crunchbase.com/organization/aura-information-security']","['$275,000 USD', 'https://www.dnb.com/business-directory/company-profiles.ppnk_limited.290bfa8e41191ec8e2b9550e1ce78c7a.html']",None,"['New Zealand', 'https://opencorporates.com/companies/nz/1757025']",None,"['Private', 'https://www.crunchbase.com/organization/aura-information-security']",0.375,0.375,0.5,0.0,0.3125
Synergy Enterprise Solutions I Contact Centre and CRM Experts,https://synergyes.com.au/,Trusted Contact Centre and CRM experts to help you deliver the ultimate customer experience and engagement.,synergyes,"['152 Elizabeth Street Melbourne, VIC 3000 Australia', 'https://synergyes.com.au/']",None,"['0800 85 66 96', 'https://synergyes.com.au/']","['customer experience', 'customer communications', 'better customer experiences', 'customers', 'exceptional customer experiences', 'customer service operations', 'customer success', 'customer satisfaction', 'customer interactions', 'ongoing customer management']","[['Bob Ferrigno', 'CEO'], 'https://www.linkedin.com/in/bob-ferrigno-2262422a']","[['EnergyRenewable EnergyRetail'], 'https://www.crunchbase.com/organization/synergy-3']","['2006', 'https://www.crunchbase.com/organization/synergy-3']",None,None,"['Australia', 'https://opencorporates.com/companies/au/641506989']",None,"['Private', 'https://www.crunchbase.com/organization/synergy-3']",0.25,0.25,0.0,0.0,0.125
Australian Cyber Security Magazine — Australia's Leading ...,https://australiancybersecuritymagazine.com.au/,Australia's Leading Cyber Security Magazine,australiancybersecuritymagazine,"['Level  15 , 1 William Street, Perth WA 6000', 'https://australiancybersecuritymagazine.com.au/launch-of-austcyber-allstars-michelle-price-and-alex-van-someren-fireside-chat-about-investment-in-innovative-cyber/']","['promoteme@mysecuritymedia.com', 'https://austBlack Insitu Testing,http://www.blackinsitutesting.com.au/,_BLACK   INSITU TESTING   Our services,blackinsitutesting,"['258 HYDE STREET YARRAVILLE, VICTORIA, 3013 Australia', 'https://www.dnb.com/business-directory/company-profiles.black_insitu_testing_pty_ltd.98cb228c833209691bdfdcc1987858c5.html']","['office@blackinsitutesting.com.au', 'http://www.blackinsitutesting.com.au/']","['+61-396890033', 'https://www.dnb.com/business-directory/company-profiles.black_insitu_testing_pty_ltd.98cb228c833209691bdfdcc1987858c5.html']","['cpt geotechnical testing', 'cpt testing', 'design cpt testing', 'insitu testing soil samiTWire - Technology News_ Technology Jobs Australia,https://www.itwire.com/,iTWire Technology News & Jobs Australia.,itwire,"['1/9 Dadley St, Alexandria NSW 2015', ['iTWire Technology News Sydney, address', 'knowledge_panel']]","['andrew.matler@itwire.com', 'https://www.crunchbase.com/organization/itwire']","['+614122390000', 'https://www.itwire.com/component-k2-38300']","['promapp business process', 'new processes', 'new zealand business process management software company', 'ongoing business process improvement', 'core business processes', 'process management', 'process information', 'managing processes', 'process improvements', 'internet services provider']","[['Narelle Clark', 'CEO'], 'https://www.itwire.com/people-moves/narelle-clark-appointed-ceo-of-internet-association.html']","[['NewsPublishing'], 'https://www.crunchbase.com/organization/itwire']","['2005', 'https://www.crunchbase.com/organization/itwire']",None,None,None,None,"['Private', 'https://www.crunchbase.com/organization/itwire']",0.0,0.25,0.0,0.0,0.0625
Nuvola Group - Nuvola Group Home,https://www.nuvolagroup.com.au/,Nuvola Group Home,nuvolagroup,None,"['info@nuvo-group.com', 'https://www.crunchbase.com/organization/nuvo-group']",None,"['nuvola solutions nuvola solution partners data', 'support \xa0 customer communications nuvola technology partners nuvola partners transparent', 'soar contact us nuvola', 'customer communications', 'media clips', 'market', 'motion', 'payments', 'omni-channel', 'your benefits']","['Oren Oz', 'founder(s)', 'https://www.crunchbase.com/organization/nuvo-group']","[['FamilyHealth CareInformation TechnologyMedicalMedical Device'], 'https://www.crunchbase.com/organization/nuvo-group']","['2007', 'https://www.crunchbase.com/organization/nuvo-group']",None,None,None,None,"['Private', 'https://www.crunchbase.com/organization/nuvo-group']",0.0,0.0,0.0,0.0,0.0
Civica US homepage | Civica,https://www.civica.com/,Civica are a global IT-based services partner in digital solutions  software applications  and managed services.,civica,"[""L 10 163-175 O'Riordan St Mascot, New South Wales, 2020 Australia"", 'https://app.avention.com/company/4895ae9b-451d-3cb5-94ad-bef693554a44#report/company_summary']","['compliance@civica.co.uk', 'https://www.civica.com/en-au/civica-election-services-privacy-policy/']","['+61 2 8324 3000', 'https://www.civica.com/en-au/']","['civica northstar civica', 'civica election services civica', 'digital services customer service business process services', 'government digital services', 'public cloud services', 'public service organisations', 'improved customer services', 'deliver civica', 'field service management civica group limited', 'civica customers']","[['Ben Cowling', 'Managing_Director'], 'https://www.civica.com/en-au/container---news-library/civica-broadens-management-team-and-invests-for-growth-in-apac/']","['Computer Programming', 'https://app.avention.com/company/4895ae9b-451d-3cb5-94ad-bef693554a44#report/company_summary']",None,"['120M', 'https://app.avention.com/company/4895ae9b-451d-3cb5-94ad-bef693554a44#report/company_summary']",None,None,"['890', 'https://app.avention.com/company/4895ae9b-451d-3cb5-94ad-bef693554a44#report/company_summary']","['Private Subsidiary, Headquarters', 'https://app.avention.com/company/4895ae9b-451d-3cb5-94ad-bef693554a44#report/company_summary']",0.0,0.25,0.0,0.0,0.0625
SoNET Systems,https://sonet.com.au/,SoNET Systems is one of Australia's leading software development companies  providing clients with high quality SaaS software products and software ...,sonet,"['15 Gordon Street Cremorne, Victoria, 3121 Australia', 'https://app.avention.com/company/f2a5aea4-5b7f-38e5-b442-5caf29ed0036#report/company_summary']","['privacy@sonet.com.au', 'https://sonet.com.au/privacy-statement/']","['+61 3 8533 7700', 'https://sonet.com.au/privacy-statement/']","['specific service provider software functions', 'sonet systems assessment', 'specific employment services software solution', 'icase comprehensive employment services software', 'specialised service provider software functions', 'sonet systems assessment master services', 'sonet systems icase', 'industry specific employment services software solution', 'sonet systems pty ltd. sonet system', 'disability employment service providers']","[['Adam Legg', 'Director'], 'https://app.avention.com/company/f2a5aea4-5b7f-38e5-b442-5caf29ed0036#report/company_summary']","[['Enterprise SoftwareInformation TechnologySaaSSoftware'], 'https://www.crunchbase.com/organization/sonet-systems']","['1995', 'https://www.crunchbase.com/organization/sonet-systems']","['2.7M', 'https://app.avention.com/company/f2a5aea4-5b7f-38e5-b442-5caf29ed0036#report/company_summary']",None,"[' Cremorne, New South Wales, Australia', 'https://www.crunchbase.com/organization/sonet-systems']","['29', 'https://app.avention.com/company/f2a5aea4-5b7f-38e5-b442-5caf29ed0036#report/company_summary']","['Private', 'https://www.crunchbase.com/organization/sonet-systems']",0.75,0.25,0.0,0.0,0.25
GitHub: Where the world builds software · GitHub,https://github.com/,GitHub is where over 56 million developers shape the future of software  together. Contribute to the open source community  manage your Git repositories  review code like a pro  track bugs and features  power your CI/CD and DevOps workflows  and secure code before you commit it._GitHub is where over 56 million developers shape the future of software  together. Contribute to the open source community  manage your Git repositories  review code like a pro  track bugs and feat...,github,None,"['hello@buildkite.com', 'https://www.crunchbase.com/organization/buildkite']",None,"['private github repositories', 'public github repositories', 'github data', 'github marketplace', 'github services', 'github terms', 'github issues', 'github enterprise', 'github support', 'github actions']","[['Sam Hunt', 'CEO'], 'https://www.zdnet.com/article/why-github-wants-to-get-involved-in-australias-innovation-ecosystem/']","[['Developer PlatformDeveloper ToolsPaaSSoftwareSoftware Engineering'], 'https://www.crunchbase.com/organization/buildkite']","['Sep 1, 2013', 'https://www.crunchbase.com/organization/buildkite']",None,None,None,None,"['Private', 'https://www.crunchbase.com/organization/buildkite']",0.5,0.0,0.375,0.0,0.21875
Agenda,https://na.eventscloud.com/website,Admission to the networking forum on June 6; Admission to the exhibition area on June 7 & 8; Admission to the Mumbrella Cocktail Party on June 7; Arrival tea ...,na.eventscloud,None,"['clpna@buksa.com', 'https://na.eventscloud.com/ereg/newreg.php?eventid=293929']",None,"['data pipeline', 'modern data experience', 'architecture', '3rd party orchestration toolsets demystifying analytics', 'class se flasharray technologies', 'data pipeline reference architecture - containers', 'data protection solutions architecture - fb', 'maximum file size', 'advanced flasharray performance sizing', 'best practices']","[['Glen Pidgeon ', 'Retail Design Director_Diriyah Gate ...'], 'from linkedin search google']","['IT - Software, Manufacturing', 'from_classification_model']",None,None,None,None,None,None,0.0,0.0,0.0,0.0,0.0
InnovationAus: Home,https://www.innovationaus.com/,,innovationaus,None,"['enquiries@metsignited.org', 'https://www.crunchbase.com/organization/mets-ignited']","['+61 424 300 992', 'https://www.innovationaus.com/contact-us/']","['digital government services', 'digital government', 'government business', 'government information', 'government online services', 'government service delivery', 'government digital services', 'government programs', 'various government services', 'government technology investment policy']","[['James Riley', 'founder'], 'https://www.innovationaus.com/about-us/']","[['MininFACTS Management AU: Home,https://factsmgt.com.au/,Automated payments streamline tuition management for private schools. See how else FACTS elevates the education experience.,factsmgt,"['Suite  13 -15, 2 Brandon Park Drive Wheelers Hill, VIC 3150', 'https://factsmgt.com.au/contact-us']","['raudt@nelnet.net', 'https://factsmgt.com.au/privacy-policy/']","['+64 9 889 3936', 'https://factsmgt.com.au/contact-us']","['payment information', 'student information', 'other schools', 'school fee payments', 'other identifying information', 'renweb lms update', 'helping schools', 'such information', 'student schedules renweb lms update', 'personal information']",None,"['IT - Software, Agriculture', 'from_classification_model']",None,None,None,None,None,None,0.25,0.25,0.0,0.0,0.125
RPL For Australia Immigration | ACS RPL | ACSRPLAustralia ...,https://acsrplaustralia.com/,ACS RPL for Australia Immigration for Skill Assessment from ACS society. Premium quality ACS RPL report prepared by our experts for engineers._Get YourBSIDES MELBOURNE - BSides Melbourne,https://www.bsidesmelbourne.com/,BSides Melbourne,bsidesmelbourne,"['2020 ! Where: Goods Shed North, 710 Collins St, Docklands VIC 3008', 'https://www.bsidesmelbourne.com/']","['committee@bsidesmelbourne.com', 'https://www.bsidesmelbourne.com/covid-19.html']","['+6102) 9519 0048', ['Young Henrys, phone', 'knowledge_panel']]","['conduct rookie track', 'career track', 'workshops rookie track / career village', 'our mentors main track training courses panels', 'sponsors/donations/friends career track meet our volunteers conference code of conduct rookie track', 'our volunteers conference code', '2020 sponsors/donations/friends', 'us']",None,"['Education, Construction', 'from_classification_model']",None,None,None,None,None,None,0.25,0.0,0.0,0.0,0.0625
Insurance News - insuranceNEWS.com.au - Insurance and ...,https://www.insurancenews.com.au/,insuranceNEWS.com.au is a free online daily news bulletin for Australia's general insurance industry and the wider financial services community. insuranceNEWS.com.au features local  corporate  regulatory and government  financial services and international news as well as insurance industry events.,insurancenews,"['SUITE 4 120 UPPER HEIDELBERG RD IVANHOE, VICTORIA, 3079 Australia', 'https://www.dnb.com/business-directory/company-profiles.insurance_news_pty_ltd.a603ed22b0c8827d.html']","['editor@insurancenews.com.au', 'https://www.insurancenews.com.au/enhance-your-insurancenews-com-au-experience']","['+61-394995538', 'https://www.dnb.com/business-directory/company-profiles.insurance_news_pty_ltd.a603ed22b0c8827d.html']","['insurance insurance council', 'insurance claims', 'business interruption insurance policies', 'insurance mr whelan', 'general insurance claims', 'insurance claims managers', 'insurance policies', 'insurance claims processing', 'business interruption insurance pandemic exclusions', 'insurance brokers']","['Brenton Charnley', 'founder(s)', 'https://www.crunchbase.com/organization/insurtech-australia']","[['InsurTech'], 'https://www.crunchbase.com/organization/insurtech-australia']","['2017', 'https://www.crunchbase.com/organization/insurtech-australia']","['$1.01 million USD', 'https://www.dnb.com/business-directory/company-profiles.insurance_news_pty_ltd.a603ed22b0c8827d.html']",None,None,None,"['Private', 'https://www.crunchbase.com/organization/insurtech-australia']",0.0,0.0,0.0,0.0,0.0
Associated Press News,https://apnews.com/,News from The Associated Press  the definitive source for independent journalism from every corner of the globe.,apnews,None,"['privacy@ap.org', 'https://apnews.com/privacystatement']","['+61 3 8413 3200', 'https://www.crunchbase.com/organization/australian-associated-press']",None,None,"[['MarketingNewsPublishing'], 'https://www.crunchbase.com/organization/australian-associated-press']","['1935', 'https://www.crunchbase.com/organization/australian-associated-press']",None,None,None,None,"['Private', 'https://www.crunchbase.com/organization/australian-associated-press']",0.0,0.0,0.0,0.0,0.0
NetWireless: Home,https://www.netwireless.com.au/,NetWireless is a premium network service and solutions managed service provider. Highly qualified engineers support organisations networks.,netwireless,"['18 Harker Street Burwood, Victoria 3125 Australia', 'https://www.netwireless.com.au/contact-us/']","['kirstyg@netwireless.com.au', 'https://www.netwireless.com.au/2020/02/wi-fi-training-day/']","['1300 324 844', 'https://www.netwireless.com.au']","['network security solution', 'email security aruba networks', 'aruba networks', 'network access', 'network solutions', 'wireless network design', 'network infrastructure', 'network performance', 'network management', 'high performing wireless network']","['Craig Wilkins', 'founder(s)', 'https://www.crunchbase.com/organization/netwireless']","[['InternetMobileTelecommunications'], 'https://www.crunchbase.com/organization/netwireless']",None,"['$2.50 million USD', 'https://www.dnb.com/business-directory/company-profiles.netwireless_pty_ltd.b325fd67de65cc7000f51ba894421fd6.html']",None,None,None,"['Private', 'https://www.crunchbase.com/organization/netwireless']",1.0,0.25,0.0,0.0,0.3125
Objective Corporation: Content_ collaboration and process ...,https://www.objective.com.au/,We invite you to join the family. Logo glasgow city council. WC Logo. Logo government western australia.,objective,"['L 30 177 Pacific Hwy North Sydney, New South Wales, 2060 Australia', 'https://app.avention.com/company/85f00e3e-73a8-315a-9f34-b620a1588b3f#report/company_summary']","['info@objective.co.uk', 'https://www.crunchbase.com/organization/objective-corporation']","['+61 2 9955 2288', 'https://www.crunchbase.com/organization/objective-corporation']","['objective objective', 'objective connect objective corporation', 'objective chris britton objective connect', 'use objective connect', 'objective connect workspace', 'objective ecm', 'objective connect webinar', 'design objective connect', 'objective connect share', 'workspace objective']","[['Tony Walls', 'CEO'], 'https://idm.net.au/article/009997-objective-ceo-driver-s-seat']","[['Business DevelopmentManagement Consulting'], 'https://www.crunchbase.com/organization/objective-corporation']","['1987', 'https://www.crunchbase.com/organization/objective-corporation']","['44M', 'https://app.avention.com/company/85f00e3e-73a8-315a-9f34-b620a1588b3f#report/company_summary']",None,"[' North Sydney, New South Wales, Australia', 'https://www.crunchbase.com/organization/objective-corporation']","['170', 'https://app.avention.com/company/85f00e3e-73a8-315a-9f34-b620a1588b3f#report/company_summary']","['Private', 'https://www.crunchbase.com/organization/objective-corporation']",0.375,0.375,0.375,0.0,0.28125
