title,link,description,comp_name,address,email,telephone_number,keywords,contact_person,type_or_sector,founded_year,revenue,funding,headquarters,No_of_employees,company_status,address_confidence,tp_confidence,headquarters_confidence,contact_confidence,Total_confidence
IDC: The premier global market intelligence firm.,https://www.idc.com/,IDC examines consumer markets by devices  applications  networks  and services to provide complete solutions for succeeding in these expanding markets.,idc,"['Level  11 , 160 Sussex St Sydney, NSW, 2000 Australia', 'https://www.idc.com/about/worldwideoffices']","['upport@idc.com', 'https://www.idc.com/about/contact_techinq.jsp']","['+649 377 0370', 'https://www.idc.com/about/worldwideoffices']","['doc #prjpj46807620 doc #us46363820 doc #us45374320 doc #us45796820 doc #eur146626020', '#lcus46905820 doc #us45857020 doc #us46866420 doc #', 'doc #us45441220 doc #eur146836220 doc #eur145012219', 'idc poland doc #', 'doc #us46863920 idc', 'doc #us46859020 idc', 'doc #ap46717120 idc', 'doc #us43152617 doc', 'doc #ca45063720 doc', 'doc #jpj45390120 doc #us46749720']","[['Tehmasp Parekh', 'Managing_Director'], 'https://www.idc.com/getdoc.jsp?containerId=prAP45567519']","['IT - Software, Mining, oil and gas', 'from_classification_model']","['10 February 2020', 'https://opencorporates.com/companies/au/639017226']",None,None,"['Australia', 'https://opencorporates.com/companies/au/639017226']",None,"['Australian Proprietary Company, Limited By Shares', 'https://opencorporates.com/companies/au/639017226']",0.625,0.25,0.0,0.0,0.21875
ARN - The voice of the Australian IT channel,https://www.arnnet.com.au/,Microsoft has made its recently announced Azure VMware Solution (AVS) generally available  meaning the service will now be available to partners in Australia ...,arnnet,"['14 Darling Drive, Pyrmont, NSW 2000', 'https://www.arnnet.com.au/events/upcoming/']","['james_henderson@idg.com.au', 'https://www.crunchbase.com/organization/arn']","['+61 2 8873 4400', 'https://www.arnnet.com.au/event/4535/world-business-forum-sydney-2020']","['business partners', 'new business', 'business solutions', 'customer service', 'vmware professional services business vifx', 'personal data', 'channel businesses', 'cloud infrastructure services spending year', 'such personal data', 'many channel partners']","[['Jane Livesey', 'CEO'], 'https://www.arnnet.com.au/mediareleases/135146/cognizant-names-jane-livesey-as-ceo-for-australia/']","[['News'], 'https://www.crunchbase.com/organization/arn']","['Jan 1, 1995', 'https://www.crunchbase.com/organization/arn']",None,None,"[' Sydney, New South Wales, Australia', 'https://www.crunchbase.com/organization/arn']",None,"['Private', 'https://www.crunchbase.com/organization/arn']",0.25,0.25,0.0,0.0,0.125
Nova Systems – Home,https://novasystems.com/,Nova Systems is a Professional Service Provider  specialising in the provision of engineering and management services  providing industry and government with world class independent expertise in delivering complex projects and solving technologically challenging problems,novasystems,"['27 -31 London Road, Mile End South SA 5031', 'https://novasystems.com/privacy-and-disclaimer/']","['tim.anderson@novasystems.com', 'https://novasystems.com/news/nova-systems-insights-digital-twin-energy-resources-sectors/']",None,"['nova systems utilities downloads nova systems', 'project nova systems', 'nova systems australia', 'nova systems companies', 'support nova systems', 'nova systems transport', 'nova systems expertise', 'nova systems satcom', 'nova systems personnel', 'training nova systems']","[['Jim Paychoice: Online Payment Gateway in Australia,https://www.paychoice.com.au/,Paychoice offers a complete Online Payment Gateway solution  including secure Online Payment Systems and more. Learn more today.,paychoice,"['Suite  6 , Level 2, 58-60 Victor Crescent, Narre Warren, VIC 3805', 'https://www.paychoice.com.au/']","['support@paychoice.com.au', 'https://www.crunchbase.comemt Distribution Pty Ltd - security solutions for enterprise_ govt ...,https://www.emtdist.com/,emt Distribution Pty Ltd distributes the most effective software security solutions designed to mitigate the majority of cyber threats. emt distributes security software throughout Australia  New Zealand and the Asia Pacific. If you are a security software vendor OR partner call us on +61 8 8273 3033 to learn more.,emtdist,"['83 King William Road Unley South Australia, 5061 Australia', 'https://www.emtdist.com/contact-us/']",None,"['+61 (0)2 9387 2332', 'https://www.emtdist.com/news/']","['cyber security vulnerabilities', 'security solutions', 'cyber security solutions', 'other security solutions', 'other cyber security solutions', 'known security vulnerabilities', 'data security', 'security awareness solutions', 'security partner', 'cyber security']",None,"[['Information ServicesInformation TechnologyProfessional Services'], 'https://www.crunchbase.com/organization/emt-distribution']","['Jan 1, 2008', 'https://www.crunchbase.com/organization/emt-distribution']",None,None,None,None,"['Private', 'https://www.crunchbase.com/organization/emt-distribution']",0.25,0.25,0.0,0.0,0.125
Support Hours of Operation - MyAPS - Reckon,https://myaps.reckon.com/ContactUs/,APS support services are available 11 hours a day  5 days a week  excluding public holidays. ... http://dynamicimages.aps.reckon.com/3%20Product% ...,dynamicimages.aps.reckon,None,"['customerservice@reckon.com.au', 'https://www.crunchbase.com/organization/reckon']","['1300 306 561', 'https://myaps.reckon.com/Products/Elite/']","['hotfix files hotfix files', 'aps practice management', 'statement files', 'aps hotfix files', 'aps nz tax', 'install aps practice management', 'aps databases', 'invoice file', 'release files', 'hotfix files']","['Greg Wilkinson', 'founder(s)', 'https://www.crunchbase.com/organization/reckon']","[['AccountingComputer VisionInformation TechnologySoftware'], 'https://www.crunchbase.com/organization/reckon']","['1987', 'https://www.crunchbase.com/organization/reckon']",None,None,"[' Sydney, New South Wales, Australia', 'https://www.crunchbase.com/organization/reckon']",None,"['Private', 'https://www.crunchbase.com/organization/reckon']",0.0,0.25,0.0,0.0,0.0625
Travel Agency Software Solutions - Tramada Systems,https://tramada.com/,Tramada Systems is a multi-award winner and leading provider of Corporate Travel Management and Travel Agency Software Solutions to the travel industry.,tramada,"['Level  13 , 255 Elizabeth Street Sydney NSW 2000 Australia', 'https://tramada.com/']","['sales@tramada.com', 'https://www.crunchbase.com/organization/tramada']","['+61 2 8227 7333', 'https://tramada.com/disclaimer/']","['tramada travel agencies', 'tramada systems tramada systems', 'travel technology leader tramada systems', 'travel management system provider tramada systems', 'travel agency businesses', 'travel agencies', 'travel management agencies', 'travel agency processes', 'australian based travel financial management solutions provider tramada systems', 'travel businesses']","[[""Jo O'Brien"", 'CEO'], 'https://tramada.com/tramada-wins-global-cloud-awards/']","[['SoftwareTravel'], 'https://www.crunchbase.com/organization/tramada']","['Jan 1, 2000', 'https://www.crunchbase.com/organization/tramada']","['$3.7M', 'None']",None,None,None,"['Private', 'https://www.crunchbase.com/organization/tramada']",0.25,0.75,0.0,0.0,0.25
Construction Materials Testing (CMT) - Australia_ New ...,https://www.insitutest.com.au/,Helping you get clear insight on what's going below the surface so you can make better informed timely decisions.,insitutest,"['PO Box 141 , Albert Park, VIC 3206 Australia', 'https://www.insitutest.com.au/contact-us/']","['test@insitutest.com.au', 'https://www.insitutest.com.au/contact-us/']","['+61 (0)404 114 751', 'https://www.insitutest.com.au/contact-us/']","['using intelligent compaction', 'dynamic load plate test', 'plate load tests', 'test results', 'other geotechnical test results', 'test methods', 'instrumented plate load test', 'geotechnical tests', 'test equipment', 'plate load test']","[['Robin Power ', 'Head of Business Development ..._LinkedIn'], 'from linkedin search google']","['Manufacturing, Healthcare', 'from_classification_model']",None,None,None,None,None,None,0.25,0.25,0.0,0.0,0.125
Orca Tech | orcatech.com.au,https://www.orcatech.com.au/,,orcatech,"['9 -11 Myrtle Street, Crows Nest, New South Wales 2065', 'https://www.orcatech.com.au/privacy-policy/']","['finance@orcatech.com.au', 'https://www.orcatech.com.au/contact/']","['+612 9432 7835', 'https://www.orcatech.com.au/contact/']","['it security distributor orca tech', 'sydney it security distributor orca tech', 'cyber security threats', 'cyber security vendors', 'security partners', 'security threats', 'orca tech hunts partners', 'cyber security company forcepoint', 'extrahop orca tech', 'data security']","[['Greg Brunt', 'founder'], 'https://www.crn.com.au/news/orca-tech-and-brace-168-simplify-cybersecurity-532492']","['IT - Software, Finance and insurance', 'from_classification_model']",None,None,None,None,None,None,0.25,0.25,0.0,0.0,0.125
Datacom: Home,https://datacom.com/,Datacom is Australasia's largest home-grown tech company. We bring together the right technology and expertise to deliver sustainable solutions for some of New ...,datacom,"['Level 10, South Tower, 68 Jervois Quay Wellington, 6011 New Zealand ', 'https://app.avention.com/company/d1064cc7-fec7-3b31-95db-1f4fbf24875d#report/company_summary']","['info@datacom.com.au', 'https://www.crunchbase.com/organization/datacom']","['+64-44601500', 'https://www.dnb.com/business-directory/company-profiles.datacom_group_limited.e71e65415779dae648723636310577a4.html']","['datacom services', 'datacom payroll customers', 'datacom group limited datacom', 'datacom’s managed services', 'datacom teams', 'leakage datacom cloud', 'datacom australia', 'customer service', 'digital customer service', 'experience design datacom']","[['Gregory Lance Davidson', 'Director'], 'https://app.avention.com/company/d1064cc7-fec7-3b31-95db-1f4fbf24875d#report/company_summary']","[['AppsInformation Technology'], 'https://www.crunchbase.com/organization/datacom']","['1965', 'https://www.crunchbase.com/organization/datacom']","['716M', 'https://app.avention.com/company/d1064cc7-fec7-3b31-95db-1f4fbf24875d#report/company_summary']",None,"[' Wellington, Wellington, New Zealand', 'https://www.crunchbase.com/organization/datacom']","['4.6k', 'https://app.avention.com/company/d1064cc7-fec7-3b31-95db-1f4fbf24875d#report/company_summary']","['Private', 'https://www.crunchbase.com/organization/datacom']",0.5,0.1875,0.375,0.0,0.265625
SecurityBrief New Zealand - New Zealand's leading source of ...,https://securitybrief.co.nz/,SecurityBrief is focused on technology-based security and threat news. Its readers include business and enterprise security decision makers  as well as security ...,securitybrief,"['Po Box 47 -318, Ponsonby, Auckland 1144 New Zealand', 'https://securitybrief.co.nz/our-terms']","['cyber@nimis.ai', 'https://www.crunchbase.com/organization/nimis-cybersecurity']","['+61 1300 092 195', 'https://securitybrief.co.nz/contact-us']","['cloud security', 'network security solutions', 'security threats', 'cloud security perceptions', 'security solutions', 'network security', 'security data', 'security companies', 'network security products', 'new security risks']","[['Rachael Falk', 'CEO'], 'https://securitybrief.com.au/story/australian-cyber-security-research-centre-appoints-rachael-falk-ceo']","[['Artificial IntelligenceCyber SecurityEnterprise SoftwareMachine Learning'], 'https://www.crunchbase.com/organization/nimis-cybersecurity']","['Jun 1, 2017', 'https://www.crunchbase.com/organization/nimis-cybersecurity']",None,None,None,None,"['Private', 'https://www.crunchbase.com/organization/nimis-cybersecurity']",0.25,0.25,0.0,0.0,0.125
Redman Solutions,https://www.redmansolutions.com.au/,_We help local government connect process and technology with people and purpose,redmansolutions,"['139 Gotha StreetFortitude Valley, QLD 4006', 'https://www.redmansolutions.com.au/']","['support@archistar.ai', 'https://www.crunchbase.com/organization/archistar']","['+61 (7) 3257 2655', 'https://www.redmansolutions.com.au/contact']","['redman solutions online budget publication redman solutions', 'local government records management', 'redman solutions', 'local government connect process', 'people redman solutions', 'council teams', 'local government websites', 'data platform redman solutions', 'Hotline IT: Business IT Support Australia & NZ | Small ...,https://hotlineit.com/,Providing Business IT Support For Over 20 Years. Servicing key industries with large and small Business IT support across Australia and New Zealand,hotlineit,"[""'BLD 4 03' SUITE 1 14 AQUATIC DRIVE FRENCHS FOREST, NEW SOUTH WALES, 2086 Australia"", 'https://www.dnb.com/business-directory/company-profiles.hotline_it_pty_ltd.8010859c68c00d31a7684e699918ee7a.html']","['sales@hotlineit.com', 'https://hotlineit.com/contact-us/']","['+612 9451 9111', 'https://hotlineit.com/it-risk-managemIBAK-Australia,http://www.ibak-australia.com.au/, ,ibak-australia,"['1 /26 Day Street Silverwater 2128 NSW Australia', 'http://www.ibak-australia.com.au/en/startseite/']","['info@ibak.de', 'https://www.crunchbase.com/organization/ibak']","['+61 (0) 2 964 820 50', 'http://www.ibak-australia.com.au/en/startseite/']","['pipe inspection cameras', 'ibak camera tractors', 'pipe inspection systems', 'ibak orpheus', 'ibak australia', 'conventional sewer inspection systems', 'ibak', 'pipe inspection data', 'k ibak', 'ibak t']","[['Darren Michalski IBAK Australia ', 'General Manager ..._LinkedIn'], 'from linkedin search google']","[['ElectronicsMachinery ManufacturingManufacturing'], 'https://www.crunchbase.com/organization/ibak']","['Jan 1, 1945', 'https://www.crunchbase.com/organization/ibak']","['$799,000 USD', 'https://www.dnb.com/business-directory/company-profiles.alpl_australia_pty_ltd.73525d773a4d5b55d578c1d55f535d1c.html']",None,"['Australia', 'https://opencorporates.com/companies/au/635314117']",None,"['Private', 'https://www.crunchbase.com/organization/ibak']",0.25,0.25,0.0,0.0,0.125
Expat Forum For People Moving Overseas And Living Abroad,https://www.expatforum.com/,A forum community dedicated to expatriates and enthusiasts. Come join the discussion about residency  taxes  documents  visas  travel  health care..._A forum community dedicated to expatriates and enthusiasts. Come join the discussion about residency  taxes  documents  visas  travel  health care  finances  banking  classifieds  and more!,expatforum,None,None,None,"['other information', 'such information', 'other verticalscope inc. web sites', 'account information', 'sensitive personal information', 'information', 'other sites', 'certain information', 'such sites', 'cookie information']",None,"['IT - Software, Manufacturing', 'from_classification_model']",None,None,None,None,None,None,0.0,0.0,0.0,0.0,0.0
Home - IDEXX Australia,https://www.idexx.com.au/en-au/,,idexx,"['Unit  6 , 38-46 South Street Rydalmere, NSW 2116 AUSTRALIA', 'https://www.idexx.com.au/en-au/water/water-products-services/idexx-qc/']","['contactdirectors@idexx.com', 'https://www.crunchbase.com/organization/idexx-laboratories']","['+64-7-839-1471', 'https://www.idexx.com/en/about-idexx/locations/']","['idexx snap', 'catalyst tests idexx', 'test product insert idexx', 'idexx catalyst', 'idexx snap t step', 'idexx laboratories', 'idexx customers', 'call idexx', 'idexx water', 'idexx cbc']","[['Carl Eden ', 'General Manager (Commercial) NZ_IDEXX ...'], 'from linkedin search google']","[['Health CareLivestockVeterinary'], 'https://www.crunchbase.com/organization/idexx-laboratories']","['1983', 'https://www.crunchbase.com/organization/idexx-laboratories']","['$5M', 'None']","['$0', 'None']",None,"['92', 'None']","['Public', 'https://www.crunchbase.com/organization/idexx-laboratories']",1.0,0.25,0.0,0.0,0.3125
CCS Cultural Cyber Security | Dark Market Scanning | Brian ...,https://www.culturalcybersecurity.com/,Proactive  intelligence-led cyber security to drive strategy  protect business and build culture,culturalcybersecurity,"['PO Box 1395, Cleveland QLD 4163 Australia', 'https://www.culturalcybersecurity.com']",None,"['+61430 457 027', 'https://www.culturalcybersecurity.com']","['effective data breach response', 'data breach incidents', 'suspected data breaches', 'data breaches loss', 'eligible data breaches', 'certain data breaches', 'personal information security', 'data breach response', 'data breach response strategy', 'cyber breaches']","[['Brian Hay - Co', 'founder'], 'https://au.linkedin.com/in/brian-hay-bab56757']","['IT - Software, Services - professional, scientific, and technical', 'from_classification_model']",None,None,None,None,None,None,0.25,0.25,0.0,0.0,0.125
Assurance,https://www.assurance.com.au/,,assurance,"['1028 Melbourne, Victoria 3001 AUSTRALIA', 'https://www.assurance.com.au/about.html']","['info@assurance.com.au', 'https://www.crunchbase.com/organization/assurance-f61c']","['+61 (0)3 9642 0000', 'https://www.assurance.com.au/about.html']","['lonsdale street info@assurance.com.au assurance', 'financial services', 'gpo box', 'critical infrastructure', 'specialist security and mobility services', 'fax', '+61', 'postal', 'government', 'office']","[['Peter Harmer', 'CEO'], 'https://www.mckinsey.com/featured-insights/asia-pacific/rallying-around-purpose-an-interview-with-the-managing-director-and-ceo-of-insurance-australia-group']","[['Security'], 'https://www.crunchbase.com/organization/assurance-f61c']",None,"['$756,422 USD', 'https://www.dnb.com/business-directory/company-profiles.assurance_wise_pty_ltd.adca8d411a7d1f6c2b3ab5fac89df1d1.html']",None,None,None,"['Private', 'https://www.crunchbase.com/organization/assurance-f61c']",0.25,0.75,0.0,0.0,0.25
CIO.com - Tech News_ Analysis_ Blogs_ Video,https://www.cio.com/au/,CIO.com delivers the latest tech news  analysis  how-to  blogs  and video for IT professionals. Covers apps  careers  cloud computing  data center  mobile  outsourcing  security  social media  hardware and software.,cio,"['14 001 592 650>Level 10, 15 Blue Street>North Sydney NSW 2060', 'https://www.cio.com/about/ccpa.html']","['peter_sayer@idg.com', 'https://www.cio.com/about/about.html']",None,"['de rest van de', 'een van de doelen van', 'de staat van de digitale', 'de mogelijkheden van de cloud', 'van de', 'de uitbreiding van het', 'de mogelijkheden van de cloud die', 'een van de doelen van het bedrijf', 'het gaat om de rol van de ceo', 'aan de vervanging van het']","[['Steve Godbee ', 'CIO Services Leader_Australia and New ...'], 'from linkedin search google']","['IT - Software, Finance and insurance', 'from_classification_model']",None,None,None,None,None,None,0.25,0.0,0.0,0.0,0.0625
IT Support & IT Services New Zealand | CodeBlue | Auckland ...,https://codeblue.co.nz/,"We Are An IT Services And IT Support Company Servicing Mid-Sized Companies In NZ. We Have Offices In Auckland  Wellington  Christchurch & Invercargill._We Are An IT Services And IT Support Company Servicing Mid-Sized Companies In NZ. We Have Offices In Auckland  Wellington  Christchurch & Invercargill._DELIVERING MANAGED IT  BUSINESS & CLOUD SOLUTIONS FOR SMBS.
First we understand your business  then we develop 
implement and manage an ongoing IT Service. read more     PSN & CodeBlue",codeblue,"['Level  1 , 142 Spey Street Invercargill 9840 New Zealand', 'https://codeblue.co.nz/it-services-southland/']","['info@codeblue.co.nz', 'https://www.crunchbase.com/organization/codeblue']","['+64 9 970 5613', 'https://codeblue.co.nz/it-support-north-shore/']","['cloud services business continuity', 'business information', 'business networks', 'business customers', 'more businesses', 'business staff', 'business strategy', 'auckland businesses', 'many businesses', 'business applications']","['Ken Davis', 'founder(s)', 'https://www.crunchbase.com/organization/codeblue']","[['Information TechnologyInfrastructureProcurement'], 'https://www.crunchbase.com/organization/codeblue']","['1994', 'https://www.crunchbase.com/organization/codeblue']","['$5M', 'None']","['$0', 'None']","['New Zealand', 'https://opencorporates.com/companies/nz/1566260']","['314', 'None']","['Private', 'https://www.crunchbase.com/organization/codeblue']",0.25,0.25,0.0,0.0,0.125
EthicalJobs.com.au :: Not-For-Profit & Community Jobs around ...,https://www.ethicaljobs.com.au/,Find community jobs  environmental jobs  not-for-profit jobs and social work jobs in Melbourne  Sydney  Brisbane  Perth & Adelaide.,ethicaljobs,"['Level  1 , 14-24 Easey St Collingwood, Melbourne, VIC 3066', 'https://www.ethicaljobs.com.au/organic-farming-gardening-jobs?modal=contact']","['info@ethicaljobs.com.au', 'https://www.crunchbase.com/organization/ethical-jobs']","['+613 9419 5979', 'https://www.ethicaljobs.com.au/privacypolicy']","['organiser support coordinator support worker', 'support support', 'community service experience', 'miAC3 | Leader in secure cloud solutions,https://www.ac3.com.au/,If you are looking for experts in secure cloud  AC3 can help. It’s the people behind the technology that make the difference. We’re uniquely positioned as your single end-to-end partner to end your tech headaches  by taking full accountability of your tech stack._At AC3  we bring clarity to the cloud. If you are looking for experts in secure cloud  we can help. We have the people  expertise and the technology to deliver.,ac3,None,"['info@ac3.com.au', 'https://www.crunchbase.com/organization/ac3']","['+612 9199 0888', 'https://www.crunchbase.com/organization/ac3']",None,"[['Simon Xistouris', 'CEO'], 'https://www.crunchbase.com/person/simon-xistouris']","[['Information ServicesInformation Technology'], 'https://www.crunchbase.com/organization/ac3']","['1999', 'https://www.crunchbase.com/organization/ac3']",None,None,"['New Zealand', 'httProcurement and Supply Australasia: PASA Home,https://procurementandsupply.com/,,procurementandsupply,None,"['anessa@bttbonline.com', 'https://procurementandsupply.com/advertise/']","['+617 5549 1092', 'https://procurementandsupply.com/contact-us/']","['procurement business', 'supply chain management', 'private business procurement issues', 'global supply chain risk', 'supply chain risk', 'supply chain organisations', 'global supply chains', 'many procurement teams', 'new procurement research', 'procurement procurement departments']","[['Joe Arena', 'CEO'], 'https://au.linkedin.com/in/joe-arena-164a1623']","['IT - Software, Finance and insurance', 'from_classification_model']",None,None,None,None,None,None,0.0,0.25,0.0,0.0,0.0625
PayScale - Salary Comparison_ Salary Survey_ Search Wages,https://www.payscale.com/,Research and compare average salaries. Free December 2020 salary information matched to your exact job profile. Find out what you are worth.,payscale,"['1000 1st Ave. South, Seattle, WA 9813', 'https://www.payscale.com/about/contact']","['privacy@payscale.com', 'https://www.payscale.com/data-protection']",None,"['payscale data', 'higher paying jobs', 'employee salary data', 'payscale information', 'good jobs', 'other job categories', 'more new york jobs', 'payscale data laleh hassibi', 'validated salary data', 'other data']",None,"['Finance and insurance, Real estate', 'from_classification_model']",None,None,None,None,None,None,0.25,0.0,0.0,0.0,0.0625
Suraksha | Security Solutions and Products |,http://www.suraksha.com.au/,,suraksha,"['305 ,  65 Victor Cr, Narre Warren , Victoria 3805 Australia', 'http://www.suraksha.com.au/contact-us']","['suresh.hungenahally@suraksha.com.au', 'http://www.suraksha.com.au/contact-us']",None,None,"[['Hungenahally', 'CEO'], 'https://au.linkedin.com/in/dhungenahally']","['IT - Software, Finance and insurance', 'from_classification_model']","['11 February 2015', 'https://opencorporates.com/companies/au/604154672']",None,None,"['Australia', 'https://opencorporates.com/companies/au/604154672']",None,"['Australian Proprietary Company, Limited By Shares', 'https://opencorporates.com/companies/au/604154672']",0.25,0.0,0.75,0.0,0.25
handson-uddvaelger - CompanYoung,http://handson-uddvaelger-dev.facebook.companyoung.com/,Great selection of modern and classic books waiting to be discovered. All free and available in most ereader formats.,handson-uddvaelger-dev.facebook,None,"['john@mail.com', 'https://www.crunchbase.com/organization/bookwell']",None,"['download business', 'service manual ebook', 'gothic ebook', 'construction ebook', 'funktion ebook', 'com ebook', 'computing ebook', 'download business studies', 'download briar', 'download bruce']","['Matthew Dyer', 'founder(s)', 'https://www.crunchbase.com/organization/bookwell']","[['BeautyInternetWellness'], 'https://www.crunchbase.com/organization/bookwell']","['2016', 'https://www.crunchbase.com/organization/bookwell']",None,None,None,None,"['Private', 'https://www.crunchbase.com/organization/bookwell']",0.0,0.0,0.0,0.0,0.0
