title,link,description,comp_name,address,email,telephone_number,keywords,contact_person,type_or_sector,founded_year,revenue,funding,headquarters,No_of_employees,company_status,address_confidence,tp_confidence,headquarters_confidence,contact_confidence,Total_confidence
Golder: Home,https://www.golder.com/,Our world is facing complex challenges that call for innovative solutions – solutions that push the boundaries of scientific discovery and deliver essential services to people around the world. Golder highly skilled engineers and scientists provide consulting  design  and construction services in ...,golder,"['PO Box 33-849, Takapuna, Auckland 0740', 'https://www.golder.com/testing-services/']","['bappy@olab.com.au', 'https://www.crunchbase.com/organization/olab']","['+61 428 770 086', 'https://www.crunchbase.com/organization/olab']","['de la société et de', 'de la base de', 'le cadre de la conception et de l’exploitation de la mine', 'ou de la gestion de la', 'et de l’exploitation de la mine', 'de la qualité de l’air et', 'de la construction et de l’exploitation', 'de restreindre la stimulation de la', 'de la fabrication et de l’énergie', 'de de planifier']","[['Stephen Golder ', 'Equifax_Australia'], 'None']","[['AppsConsultingEducationInformation TechnologySoftware'], 'https://www.crunchbase.com/organization/olab']","[' 9 August 2019', 'https://opencorporates.com/companies/au/635438710']",None,None,"['Australia', 'https://opencorporates.com/companies/au/635438710']",None,"['Private', 'https://www.crunchbase.com/organization/olab']",0.25,0.0,0.375,0.0,0.15625
Experienced Australian CRO | A Leading CRO In Australia,https://www.southernstarresearch.com.au/,Southern Star Research is an Australian CRO with a diverse client profile  ranging from large multinational pharmaceutical companies to small start-ups.,southernstarresearch,"['13 103 120 896  Head Office: 1 Merriwa Street, Gordon NSW 2072 Australia', 'https://www.southernstarresearch.com.au/contact-us/']","['info@southernstarresearch.com', 'https://www.southernstarresearch.com.au/privacy-policy/']","['+61 (0)2 9011 6266', 'https://www.southernstarresearch.com.au/contact-us/']","['southern star research pty ltd. southern star research', 'southern star research pty ltd. southern star research pty ltd', 'clinical trial phases', 'clinical trial services', 'early phase clinical trials', 'clinical trial cost', 'clinical trial design', 'clinical trial processes', 'clinical trial protocols', 'australian clinical trial sites']","[['David Lloyd', 'Managing_Director'], 'https://www.southernstarresearch.com.au/dr-david-lloyd-awarded-sector-advocate-2017/']","['Arts, entertainment and recreation, IT - Software', 'from_classification_model']","['11 December 2002', 'https://opencorporates.com/companies/au/103120896']",None,None,"['Australia', 'https://opencorporates.com/companies/au/103120896']",None,"['Australian Proprietary Company, Limited By Shares', 'https://opencorporates.com/companies/au/103120896']",0.625,0.25,0.0,0.0,0.21875
Stantec,https://www.stantec.com/en,Stantec designs with community in mind—whether that’s in engineering  architecture  energy  water  or project management. As a top-tier global design firm  we focus on creativity  client relationships  and how our projects transform communities.,stantec,"['Level 4/99 Walker St, North Sydney NSW 2060', ['Stantec, address', 'knowledge_panel']]","['media@stantec.com', 'https://www.crunchbase.com/organization/stantec']",None,"['building design', 'sustainable building design', 'school design', 'new office buildings', 'high school athletics facility design', 'design teams', 'design solutions', 'sustainable design', 'work design', 'design experience']","[['Andrew Atkinson ', 'Client Development Director_Stantec ...'], 'None']","[['ConsultingProfessional Services'], 'https://www.crunchbase.com/organization/stantec']","['1954', 'https://www.crunchbase.com/organization/stantec']",None,None,"['New Zealand', 'https://opencorporates.com/companies/nz/611799']",None,"['Public', 'https://www.crunchbase.com/organization/stantec']",0.0,0.0,0.375,0.0,0.09375
Scoop - New Zealand News,https://www.scoop.co.nz/,Scoop Provides up to the minute New Zealand News. ... Inner Mongolia Natural Dairy Co.  Ltd  a subsidiary of China Youran Dairy Group Limited ... More>> ...,scoop,"['PAKENHAM3810VictoriaAustralia', 'https://opencorporates.com/companies/au/074235626']","['info@scoop.co.nz', 'https://www.crunchbase.com/organization/scoop-2']","['+64 4 909 7594', 'https://www.scoop.co.nz/services/content-licensing.html?source=submit']","['new zealand', 'government new zealand', 'new zealand economic citizens', 'housing new zealand', 'aotearoa new zealand', 'business new zealand', 'new zealand economic residents', 'new zealand association', 'most new zealand', 'new zealand first']","[['founder Jagdev Singh', 'founder'], 'https://www.afr.com/companies/retail/the-australian-business-taking-the-war-on-waste-to-singapore-20191218-p53lag']","[['News'], 'https://www.crunchbase.com/organization/scoop-2']","['1999', 'https://www.crunchbase.com/organization/scoop-2']",None,None,"[' Wellington, Wellington, New Zealand', 'https://www.crunchbase.com/organization/scoop-2']",None,"['Private', 'https://www.crunchbase.com/organization/scoop-2']",0.0,0.25,0.0,0.0,0.0625
Mercer Australia | Health_ Wealth and Workforce solutions,https://www.mercer.com.au/,Mercer is a global consulting leader helping clients around the world advance the health  wealth and careers of their most vital asset — their people.,mercer,"['Post GPO Box 4303, Melbourne VIC 3001', 'https://www.mercer.com.au/privacy.html']","['privacy@mercer.com', 'https://www.mercer.com.au/privacy.html']","['+61 (03) 9623 5440', 'https://www.mercer.com.au/newsroom/Mercer-wins-2015-Victorian-AusContact-Association-Awards.html']","['mercer mercer', 'mercer mercer benefitsmonitor', 'mercer sentinel mercer australia', 'mercer solutions', 'mercer marketing services australia mercer super investment trust', 'mercer learn', 'consulting services mercer', 'mercer sentinel solutions', 'mercer careers', 'services mercer']","[['Ben Walsh', 'Managing_Director'], 'https://www.mercerfinancialservices.com/about-us.html']","[['BankingConsultingFinancial ServicesHuman Resources'], 'https://www.crunchbase.com/organization/mercer-us']","['1975', 'https://www.crunchbase.com/organization/mercer-us']","['$419.22 million USD', 'https://www.dnb.com/business-directory/company-profiles.mercer_%28australia%29_pty_ltd.d33ca9f6c82a6eb46e629aefd56cec85.html']",None,"['Australia', 'https://opencorporates.com/companies/au/008612397']",None,"['Private', 'https://www.crunchbase.com/organization/mercer-us']",0.25,0.25,0.0,0.0,0.125
Te Herenga Waka—Victoria University of Wellington–1st for ...,https://www.wgtn.ac.nz/,Discover your study options at NZ’s capital city university. Learn about our research impact  living in Wellington  scholarships and upcoming events.,wgtn.ac.nz,"['PO Box 600 , Wellington 6012 New Zealand', 'https://vup.victoria.ac.nz/']","['office@ecs.vuw.ac.nz', 'https://www.wgtn.ac.nz/ecs/research/chairs/sustainable-energy-systems']","['+64 4 463 5341', 'https://www.wgtn.ac.nz/ecs/research/chairs/sustainable-energy-systems']","['wellington university international', 'universities new zealand victoria university', 'new zealand university', 'victoria university', 'new zealand new zealand university entrance health promotion', 'new zealand university entrance', 'student information', 'victoria university alumni', 'other university programmes', 'research students']","[['DUGAL MCKINNON', 'Director'], 'https://www.dnb.com/business-directory/company-profiles.new_zealand_school_of_music_limited.dd768b557180c4a733dfbaa07d19d86b.html']","['Education, Arts, entertainment and recreation', 'from_classification_model']","['1904', 'https://www.crunchbase.com/organization/wellington-institute-of-technology']","['$5.22 million USD', 'https://www.dnb.com/business-directory/company-profiles.new_zealand_school_of_music_limited.dd768b557180c4a733dfbaa07d19d86b.html']",None,"['New Zealand', 'https://opencorporates.com/companies/nz/9429041925515']",None,"['Limited\xa0Company Independent', 'https://www.dnb.com/business-directory/company-profiles.new_zealand_school_of_music_limited.dd768b557180c4a733dfbaa07d19d86b.html']",1.0,0.25,0.0,0.0,0.3125
Paediatric Trials Network Australia (PTNA),https://www.ptna.com.au/,Paediatric Trials Network Australia,ptna,None,None,"['+61 3 9936 6443', 'https://www.ptna.com.au/index.php/contact-us']","['var path', 'var prefix', 'child health research', 'var', 'australian paediatric clinical trials', 'clinical trials', 'var addyde94ace795c907ecb2f5de0ef74323a2', 'var addy12f9c97380fed909cc6add8f46ce7812', 'var addy400768c7df5632ed5afcb2594b8d7850', 'paediatric trials']","[['Cathryn Cox', 'CEO'], 'https://www.schn.health.nsw.gov.au/about/network-management/executive-leadership-group']","['Agriculture, Education', 'from_classification_model']",None,None,None,None,None,None,0.0,0.25,0.0,0.0,0.0625
Vocera: Home,https://www.vocera.com/,Vocera offers the leading platform for communication and workflow optimization. We simplify and improve the lives of healthcare professionals and patients  ...,vocera,"['371 Macarthur Avenue Hamilton QLD 4007 Australia', 'https://www.vocera.com/about-us/locations']","['support@vocera.com', 'https://www.vocera.com/product/collaboration-suite']","['+64 2019-06-21', 'https://www.vocera.com/uk/sitemap.xml']","['vocera collaboration suite application vocera', 'vocera communication', 'vocera communications julie iskow vocera', 'vocera systems', 'vocera clinical communication software', 'vocera communication software', 'vocera solution', 'vocera support team members', 'vocera calls', 'vocera services']","[['Brent D. Lang', 'Chairman'], 'https://www.vocera.com/au/about-us/leadership/brent-d-lang']","['Wireless Telecommunications Carriers', 'https://app.avention.com/company/bdef097f-0eec-30cb-b006-993524e8f446#report/company_summary']",None,"['275k', 'https://app.avention.com/company/bdef097f-0eec-30cb-b006-993524e8f446#report/company_summary']",None,None,"['4', 'https://app.avention.com/company/bdef097f-0eec-30cb-b006-993524e8f446#report/company_summary']","['Private Subsidiary', 'https://app.avention.com/company/bdef097f-0eec-30cb-b006-993524e8f446#report/company_summary']",1.0,0.25,0.0,0.0,0.3125
Advancing the World of Health - United States | BD,https://www.bd.com/en-us,At BD  we seek to usher in a new era of healthcare by bringing medical products  capabilities and solutions to every corner of the world.,bd,None,"['cgarrett@engineersaustralia.org.au', 'https://www.crunchbase.com/organization/engineers-australia']","['+649-8870 780', 'https://www.bd.com/fi-fi/about-bd/services/training']","['bd bd', 'acerca de bd bd', 'bd og bd', 'bd facsaria door de bd', 'le monde de la santé bd bd diagnostics bd', 'quality policy acerca de bd bd', 'de prestaties van bd', 'faire progresser le monde de la santé bd bd diagnostics bd', 'van bd', 'de bd son']","[['Forlenza', 'CEO'], 'https://www.bd.com/contentmanager/b_article.asp?Item_ID=26712&ContentType_ID=1&BusinessCode=20001&d=&s=&dTitle=&dc=&dcTitle=']","[['AssociationNon Profit'], 'https://www.crunchbase.com/organization/engineers-australia']","['1919', 'https://www.crunchbase.com/organization/engineers-australia']",None,"['$0', 'None']","[' Canberra, Australian Capital Territory, Australia', 'https://www.crunchbase.com/organization/engineers-australia']","['122', 'None']","['Private', 'https://www.crunchbase.com/organization/engineers-australia']",0.0,0.25,0.0,0.0,0.0625
Elite Surface Technologies | Surface Treatment & Speciality ...,http://elitesurfacetechnologies.com.au/, | Surface Treatment & Speciality Chemical Coating  Servicing Australia & New Zealand,elitesurfacetechnologies,"['10 York Rd, Ingleburn, NSW 2565', 'http://elitesurfacetechnologies.com.au/contact-us/']","['sales@elitesurtech.com.au', 'http://elitesurfacetechnologies.com.au/contact-us/']","['+61 3 9768 2896', 'http://elitesurfacetechnologies.com.au/contact-us/']",None,"[['ANNE WOLSEY YOZIN', 'Director'], 'https://www.dnb.com/business-directory/company-profiles.elite_surface_technologies_nz_limited.d49cb3f93b977095d34fcca9d2161864.html']","['Manufacturing, Transport', 'from_classification_model']","['26 August 2011', 'https://opencorporates.com/companies/nz/3526751']","['$2.73 million USD', 'https://www.dnb.com/business-directory/company-profiles.elite_surface_technologies_nz_limited.d49cb3f93b977095d34fcca9d2161864.html']",None,"['New Zealand', 'https://opencorporates.com/companies/nz/3526751']",None,"['Limited\xa0Company Independent', 'https://www.dnb.com/business-directory/company-profiles.elite_surface_technologies_nz_limited.d49cb3f93b977095d34fcca9d2161864.html']",0.5,0.25,0.75,0.0,0.375
CenterWatch: Clinical Research and Drug Information,https://www.centerwatch.com/,CenterWatch provides a variety of clinical research products and services: including clinical trials and results  drug approvals  study grants  news and analysis  career and training opportunities for patients and professionals.,centerwatch,None,"['russ.titsch@centerwatch.com', 'https://www.centerwatch.com/advertise']",None,"['covid-19 vaccine trial', 'covid-19 trial data', 'clinical trial data', 'covid-19 trials', 'vaccine trial', 'clinical trial participants', 'covid-19 challenge trials', 'clinical trial development', 'clinical trials information', 'clinical trial results']","[['Tufail Syed', 'CEO'], 'https://www.centerwatch.com/articles/13651']","['Agriculture, Education', 'from_classification_model']",None,None,None,None,None,None,0.0,0.0,0.0,0.0,0.0
CoinSpot: Australian Crypto & Bitcoin Exchange_ Crypto Trading,https://www.coinspot.com.au/,CoinSpot is Australia's trusted Bitcoin & cryptocurrency trading platform with instant delivery and easy verification.,coinspot,"['SE 4 U 5 40 Green St Windsor, VICTORIA, 3181 Australia', 'https://www.dnb.com/business-directory/company-profiles.casey_block_services_pty_ltd.fa9fb6ecad1c5942d545d5f6f96f28d1.html']","['support@coinspot.com.au', 'https://www.coinspot.com.au/press']",None,"['buy akropolis sell tellor ost', 'buy order', 'buy status instant buy', 'buy tomochain', 'buy compound', 'buy pivx', 'buy quant', 'sell blockstack abbc sell compound', 'buy quarkchain', 'buy wanchain']","[['Russell Wilson', 'founder'], 'https://www.coindesk.com/australian-crypto-exchange-coinspot-wins-iso-security-accreditation']","[['BitcoinBlockchainFinanceVenture Capital'], 'https://www.crunchbase.com/organization/coinspot']","['May 13, 2014', 'https://www.crunchbase.com/organization/coinspot']","['$79,912 USD', 'https://www.dnb.com/business-directory/company-profiles.casey_block_services_pty_ltd.fa9fb6ecad1c5942d545d5f6f96f28d1.html']",None,None,None,"['Private', 'https://www.crunchbase.com/organization/coinspot']",0.0,0.0,0.375,0.0,0.09375
Diabetes Australia,https://www.diabetesaustralia.com.au/,,diabetesaustralia,"['L 1 101 Northbourne Ave Turner, AUSTRALIAN CAPITAL TERRITORY, 2612 Australia', 'https://www.dnb.com/business-directory/company-profiles.diabetes_australia.b6606c321d5d144a292f788cb2b75dfe.html']",None,"['+61 1300 136 588', 'https://www.crunchbase.com/organization/diabetes-australia-victoria']",None,"[['Greg Johnson', 'CEO'], 'https://www.diabetesaustralia.com.au/about-us/governance/']","[['CommunitiesEducation'], 'https://www.crunchbase.com/organization/diabetes-australia-victoria']","['1953', 'https://www.crunchbase.com/organization/diabetes-australia-victoria']","['$32.01 million USD', 'https://www.dnb.com/business-directory/company-profiles.diabetes_australia.b6606c321d5d144a292f788cb2b75dfe.html']",None,None,None,"['Private', 'https://www.crunchbase.com/organization/diabetes-australia-victoria']",0.0,0.0,0.0,0.0,0.0
Unleashed Software: Inventory Management Software,https://www.unleashedsoftware.com/,The world’s easiest inventory software for your business. Powerful inventory management solution helps your business grow.,unleashedsoftware,"['Level  2 , 12-14 Northcroft Street Takapuna, 0622 New Zealand', 'https://www.unleashedsoftware.com/contact-us?contact-sales']","['sales@unleashedsoftware.com', 'https://www.crunchbase.com/organization/unleashed-software']","['+61 3 9999 5038', 'https://www.unleashedsoftware.com']","['effective inventory management unleashed', 'unleashed software inventory', 'inventory stock', 'inventory management software', 'inventory management system', 'inventory management software solution', 'unleashed inventory management software', 'unleashed inventory data', 'excess inventory stock', 'good inventory management']","['Greg Murphy', 'founder(s)', 'https://www.crunchbase.com/organization/unleashed-software']","[['E-CommerceSaaSSmall and Medium BusinessesSoftware'], 'https://www.crunchbase.com/organization/unleashed-software']","['Dec 10, 2009', 'https://www.crunchbase.com/organization/unleashed-software']","['$1.66 million USD', 'https://www.dnb.com/business-directory/company-profiles.unleashed_software_pty_ltd.f5362092f5d705b29abb180e75e4d877.html']",None,None,None,"['Private', 'https://www.crunchbase.com/organization/unleashed-software']",0.25,0.25,0.375,0.0,0.21875
Integrated Sciences Pty Ltd,http://www.integratedsci.com.au/,,integratedsci,"['54 Gibbes Street Chatswood NSW 2067', 'http://www.integratedsci.com.au/contact-us.html']","['tech@integratedsci.com.au', 'https://www.crunchbase.com/organization/integrated-sciences']","['+61 2 9417 7866', 'http://www.integratedsci.com.au/contact-us.html']","['integrated sciences sureprint g3 mouse cgh', 'integrated sciences', 'k microarray cytogenetics integrated sciences coronavirus', 'dna samples', 'integrated sciences coronavirus', 'biomark hd system dna', 'dna isolation products', 'research system biosciences range sureprint g3 human exon', 'agilent tapestation systems', 'k microarray rna']","[['Rex Bennett', 'Managing_Director'], 'https://au.linkedin.com/in/rex-bennett-98ab5430']","[['Biotechnology'], 'https://www.crunchbase.com/organization/integrated-sciences']","['1983', 'https://www.crunchbase.com/organization/integrated-sciences']","['$9.20 million USD', 'https://www.dnb.com/business-directory/company-profiles.integrated_sciences_pty_ltd.c83e67478229ac12a5a4b016cbc23495.html']",None,None,None,"['Private', 'https://www.crunchbase.com/organization/integrated-sciences']",1.0,0.375,0.75,0.0,0.53125
LabOnline: industry news_ comment_ feature articles_ case ...,https://www.labonline.com.au/,Lab+Life Scientist magazine and LabOnline website providing The latest industry news  articles  Case studies  products  directory  Events_,labonline,"['2226 North Ryde BC NSW 1670 Australia', 'https://www.labonline.com.au/privacy']","['privacy@westwick-farrow.com', 'https://www.labonline.com.au/privacy']","['+613 9769 0666', 'https://www.labonline.com.au/content/lab-equipment/hot-product/hanna-instruments-hi9-2c-automatic-titration-system-494041247']",None,"[['Rebecca Mason ', 'Senior Ministerial Liaison Officer ..._LinkedIn'], 'from linkedin search google']","['Agriculture, Healthcare', 'from_classification_model']",None,None,None,None,None,None,0.25,0.25,0.0,0.0,0.125
Financial Times,https://www.ft.com/,News  analysis and comment from the Financial Times  the world's leading global business publication,ft,"['41 BROWN AVE ASCOT VALE, VICTORIA, 3032 Australia', 'https://www.dnb.com/business-directory/company-profiles.ft_engineering_pty_ltd.51b54063d21f676eaf917997cd935faf.html']","['help@ft.com', 'https://www.crunchbase.com/organization/financial-times']","['+61-402057277', 'https://www.dnb.com/business-directory/company-profiles.ft_engineering_pty_ltd.51b54063d21f676eaf917997cd935faf.html']","['uk telecoms group', 'telecoms group us advisory firms', 'telecoms groups', 'chinese telecoms group', 'swedish telecoms equipment group', 'swedish telecoms group', 'us networks group', 'european telecoms groups', 'broadband swedish telecoms group', 'chinese group']","[['Thomas Dunne', 'Managing_Director'], 'https://au.linkedin.com/in/thomaspdunne']","[['Digital MediaNewsPublishing'], 'https://www.crunchbase.com/organization/financial-times']","['Jan 9, 1888', 'https://www.crunchbase.com/organization/financial-times']","['$244,539 USD', 'https://www.dnb.com/business-directory/company-profiles.ft_engineering_pty_ltd.51b54063d21f676eaf917997cd935faf.html']",None,"['Australia', 'https://opencorporates.com/companies/au/633053059']",None,"['Private', 'https://www.crunchbase.com/organization/financial-times']",0.0,0.0,0.0,0.0,0.0
Intertek,https://www.intertek.com/,,intertek,"['L1/12 Exell St, Banksmeadow NSW 2019', ['Intertek Testing Services PTY Ltd., address', 'knowledge_panel']]","['social.media@intertek.com', 'https://www.crunchbase.com/organization/intertek']","['+61 8 9316 9500', 'https://www.intertek.com/technical-staffing/global-recruitment-assignment-support/']","['product testing', 'intertek network communication testing', 'connected products device', 'product safety', 'testing products', 'product quality', 'safety critical products', 'products', 'many other products', 'product development']","[['Brett Coleman', 'Managing_Director'], 'https://au.linkedin.com/in/brett-coleman-94509532']","[['ConsultingTraining'], 'https://www.crunchbase.com/organization/intertek']","['1996', 'https://www.crunchbase.com/organization/intertek']",None,None,None,None,"['Public', 'https://www.crunchbase.com/organization/intertek']",0.0,0.25,0.0,0.0,0.0625
iStart,https://istart.com.au/,About iStart · Subscribe · Advertise with iStart · Become a supporter · Contact iStart · Privacy policy · +64 9 623 1480 · 0800 928 268 (NZ) · 1800 462 388 (AU).,istart,"['PO Box 91 ,   North Ryde NSW 1670 Australia', 'https://istart.com.au/vendor-exhibit/microsoft-dynamics-crm/']","['infoapac@netsuite.com', 'https://istart.com.au/vendor-exhibit/netsuite-erp/']","['1800 462 388', ['iStart Australia, phone', 'knowledge_panel']]","['business solutions', 'business management solutions', 'business systems', 'erp solutions', 'business software', 'business processes', 'ageing business systems', 'many business processes', 'business processes automation', 'sap’s business']","[['Jayne Lewis', 'CEO'], 'https://istart.com.au/case-studies/two-birds-brewing-netsuite-real-time-reporting/']","['Utilities, Manufacturing', 'from_classification_model']","[' 2 July 2012', 'https://opencorporates.com/companies/au/159295628']","['$162,660 USD', 'https://www.dnb.com/business-directory/company-profiles.istart_online_pty_ltd.486f556f2ff66646945081dfeef907ce.html']",None,"['Australia', 'https://opencorporates.com/companies/au/159295628']",None,"['Proprietorship Independent', 'https://www.dnb.com/business-directory/company-profiles.istart_online_pty_ltd.486f556f2ff66646945081dfeef907ce.html']",error,error,error,error,error
Clinical Trials – Clinical trials information,https://clinicaltrials.health.nz/,Clinical Trials in New Zealand,clinicaltrials.health.nz,"['Medical Foundation Building, 92-94 Parramatta Rd, Camperdown NSW 2050', ['Australian New Zealand Clinical Trials Registry, address', 'knowledge_panel']]",None,"['info@paratusclinical.com', 'https://www.crunchbase.com/organization/paratus-clinical']","['+61 2 4393 3855', 'https://www.crunchbase.com/organization/paratus-clinical']",None,"['new zealand new zealand', 'clinical studies', 'trial new zealand', 'interventional clinical trials', 'clinical trials sites', 'large clinical trials', 'most clinical studies', 'trial participants', 'study participants', 'new zealand clinical trials clinical trials sites']","['Jeff Wall', 'founder(s)', 'https://www.crunchbase.com/organization/paratus-clinical']",None,"[['Clinical TrialsHealth CarePharmaceutical'], 'https://www.crunchbase.com/organization/paratus-clinical']","['2013', 'https://www.crunchbase.com/organization/paratus-clinical']",None,None,"['New Zealand', 'https://opencorporates.com/companies/nz/2151809']",None,"['Private', 'https://www.crunchbase.com/organization/paratus-clinical']",0.0,0.0,0.0,0.0,0.0
Future Market Insights: Market Research & Business Intelligence,https://www.futuremarketinsights.com/,Explore Future Market Insights’ 15 000+ market research reports and business intelligence. Research and consulting partner to 80% of Fortune 1 000 companies.,futuremarketinsights,None,None,None,"['market market overview', 'market players antioxidants market', 'market attractiveness analysis liner hanger market', 'pilates mats market cream cheese market', 'market attractiveness analysis future market insights', 'global markets', 'market definition future market insights', 'market', 'market growth', 'market segmentation oil gcc functional food market']",None,"['Real estate, Manufacturing', 'from_classification_model']",None,None,None,None,None,None,0.0,0.0,0.0,0.0,0.0
