title,link,description,comp_name,address,email,telephone_number,keywords,contact_person,type_or_sector,founded_year,revenue,funding,headquarters,No_of_employees,company_status,address_confidence,tp_confidence,headquarters_confidence,contact_confidence,Total_confidence
Pulse+IT - News,https://www.pulseitmagazine.com.au/,Pulse+IT is Australasia's first and only Digital Health publication.,pulseitmagazine,"['95 SHERIDAN ST GUNDAGAI, NEW SOUTH WALES, 2722 Australia', 'https://www.dnb.com/business-directory/company-profiles.the_trustee_for_pulse_it_magazine_trust.866f49eabf6bc4b901360d8d17c32ba1.html']",None,"['+6102) 8006 5185', ['Pulse+IT Magazine, phone', 'knowledge_panel']]","['digital health digital health news', 'covid-19 digital health news', 'covid-19 emergency digital health news', 'digital health news', 'digital health services', 'covid-19 data digital health news', 'civilian health care systems', 'july digital health news', 'teleconsult digital health news', 'monday digital health news']","[['Amanda Cattermole', 'CEO'], 'https://www.pulseitmagazine.com.au/news/movers-and-shakers/5698-amanda-cattermole-confirmed-as-new-adha-ceo']","['IT - Software, Agriculture', 'from_classification_model']",None,"['$114,386 USD', 'https://www.dnb.com/business-directory/company-profiles.the_trustee_for_pulse_it_magazine_trust.866f49eabf6bc4b901360d8d17c32ba1.html']",None,None,None,"['Independent', 'https://www.dnb.com/business-directory/company-profiles.the_trustee_for_pulse_it_magazine_trust.866f49eabf6bc4b901360d8d17c32ba1.html']",0.0,0.0,0.0,0.0,0.0
Biosciences | BD Biosciences-US,https://www.bdbiosciences.com/en-us,BD Biosciences provides flow cytometers  reagents  tools  and a wide range of services to support the work of researchers and clinicians who understand disease and improve care.,bdbiosciences,None,"['rders@bd.com', 'https://www.bdbiosciences.com/en-us/reagents/research-reagents/optibuild-reagents']","['+617417-1880', 'https://www.bdbiosciences.com/en-us/contact-us']","['bd horizon', 'bd antibodies', 'bd product', 'bd horizon dyes', 'bd horizon brilliant reagents', 'ruo bd horizon', 'bd biosciences', 'bd optibuild', 'multiple bd horizon', 'bd optibuild products']","[['Pierre Rivaux ', 'Business Director BD Biosciences ..._LinkedIn'], 'from linkedin search google']","[['BioinformaticsBiotechnologyHealth CareInformation TechnologyLife ScienceMedical'], 'https://www.crunchbase.com/organization/bd-biosciences']","['1967', 'https://www.crunchbase.com/organization/bd-biosciences']",None,None,None,None,"['Private', 'https://www.crunchbase.com/organization/bd-biosciences']",0.0,0.25,0.0,0.0,0.0625
ResearchCareer: Research Jobs_ News_ Events and Education,http://www.researchcareer.com.au/,Find Jobs  Events  Education and News for Clinical Research  Biotechnical and Senior Research Management Professionals in Australia and New Zealand.,researchcareer,"['Unit  18 , 347 Bay Road Cheltenham Victoria 3192 Australia', 'http://www.researchcareer.com.au/jobs/620-university-of-western-sydney/70244']","['jobs@aifs.gov.au', 'http://www.researchcareer.com.au/jobs/8341-australian-institute-of-family-studies/70100']","['+64708108749', 'http://www.researchcareer.com.au/archived-news/university-of-adelaide-sets-up-50m-agriculture-endowment-fund']","['new research', 'new research projects', 'new research fellows', 'research projects', 'research development', 'research', 'research australia', 'cancer research projects', 'cancer research', 'research collaborations']",None,"['Education, Arts, entertainment and recreation', 'from_classification_model']",None,None,None,None,None,None,0.25,0.25,0.0,0.0,0.125
Avance Clinical - Contract Research Organisation,https://www.avancecro.com/,Avance Clinical is a full-service Australian CRO with an international reputation for delivering high quality clinical trial results.,avancecro,"['Level  1 , 2 Ann Nelson Drive Thebarton, South Australia 5031', 'https://www.avancecro.com/zh/contact-us/']","['careers@avancecro.com', 'https://www.avancecro.com/ko/careers/']","['+61 8 8249 4788', 'https://www.avancecro.com/ko/contact-us/']","['avance clinical 带来了深入的临床运营经验。她的全面知识来自于与澳大利亚小型cro和大型跨国cro（包括前五名）的工作经验，特别关注早期阶段的健康志愿者和肿瘤学临床开发。 avance clinical', '및 avance clinical', 'et avance clinical', 'cro avance clinical', '。 avance clinical', 'à avance clinical', 'de preuve de concept de', 'mit avance clinical', 'biospectrumasia et avance clinical', 'australian cro avance clinical']",None,"['Healthcare, Agriculture', 'from_classification_model']",None,None,None,None,None,None,1.0,0.25,0.0,0.0,0.3125
PRA Health Sciences | A global healthcare intelligence partner,https://prahs.com/,We are a global healthcare intelligence partner with everything you need to take your assets from concept to compound to cure.,prahs,"['Suite 1701/323 Castlereagh St, Haymarket NSW 2000', ['PRA Health Sciences, address', 'knowledge_panel']]","['heather.varela@symphonyhealth.com', 'https://www.crunchbase.com/organization/symphony-health-solutions']",None,"['potential clinical study patients', 'clinical research studies', 'clinical studies', 'rare disease clinical development', 'many clinical trials', 'diabetes clinical trials', 'clinical diagnostic studies', 'late phase clinical studies', 'human clinical trials', 'competing clinical studies']","[['Benjamin Michael James SHARP', ' director'], 'https://opencorporates.com/companies/nz/2450085']","[['Health CareHealth DiagnosticsPharmaceutical'], 'https://www.crunchbase.com/organization/symphony-health-solutions']","['2012', 'https://www.crunchbase.com/organization/symphony-health-solutions']",None,None,"['New Zealand', 'https://opencorporates.com/companies/nz/2450085']",None,"['Private', 'https://www.crunchbase.com/organization/symphony-health-solutions']",0.0,0.0,0.0,0.0,0.0
Transforming Industries_ Markets and Customer Experiences ...,https://ifwe.3ds.com/,The 3DEXPERIENCE®  helps you create unique and disruptive innovations thanks to a rich portfolio of Industry Solution Experiences._Every day our customers turn industry challenges into business opportunities and deliver value to their customers. The 3DEXPERIENCE® platform connects Knowledge and Know-How. It helps you create unique and disruptive innovations thanks to a rich portfolio of Industry Solution Experiences.,ifwe.3ds,None,"['europe.supportcenter@3ds.com', 'https://www.crunchbase.com/organization/geensoft']",None,"['design excellence new business model optimize product design', 'successful product design', 'new products', 'company process', 'concept design process', 'design time', 'product development data', 'italian ship design company', 'new product profits', 'business processes']",None,"[['Embedded SystemsProfessional ServicesSoftware'], 'https://www.crunchbase.com/organization/geensoft']","['2009', 'https://www.crunchbase.com/organization/geensoft']",None,None,None,None,"['Private', 'https://www.crunchbase.com/organization/geensoft']",0.0,0.0,0.0,0.0,0.0
Pfizer: One of the world's premier biopharmaceutical companies,https://www.pfizer.com/,,pfizer,"['Level 15/18, 151 Clarence St, Sydney NSW 2000', ['Pfizer Australia, address', 'knowledge_panel']]",None,None,"['pfizer innovative health', 'pfizer medicines', 'pfizer', 'many breast cancer patients', 'supporting breast cancer care', 'pfizer global health topics', 'pfizer global', 'pfizer colleagues', 'pfizer scientists', 'pfizer rxpathways']","[['Melissa McGregor', 'CEO'], 'http://www.pfizer.com.au/sites/g/files/g10035716/f/201705/PfizerCARES2016_1.pdf']","[['BiotechnologyHealth CareMedicalPharmaceutical'], 'https://www.crunchbase.com/organization/pfizer']","['1849', 'https://www.crunchbase.com/organization/pfizer']",None,None,None,None,"['Public', 'https://www.crunchbase.com/organization/pfizer']",0.0,0.0,0.375,0.0,0.09375
Sysmex New Zealand Limited – Health IT Solutions,https://www.sysmex.co.nz/,Sysmex New Zealand specialises in the development of integrated health IT solutions that complement Sysmex’s core business and commitment to advancing healthcare through technology,sysmex,"['386 Manukau Road Epsom, Auckland 1023 New Zealand', 'https://www.sysmex.co.nz/contact-us/sysmex-new-zealand-limited/']",None,"['+64-9-630-3554', 'https://www.sysmex.co.nz']","['sysmex new zealand', 'sysmex new zealand staff', 'sysmex new zealand ceo', 'sysmex new zealand software products', 'sysmex new zealand director', 'sysmex new zealand partner', 'sysmex new zealand ltd', 'sysmex new zealand project', 'sysmex new zealand commence', 'motutapu island sysmex new zealand']","[['James Webster', 'CEO'], 'https://www.sysmex.com.au/corporate-profile/our-team/']","['Manufacturing, Utilities', 'from_classification_model']","['30 May 1986', 'https://opencorporates.com/companies/nz/292112']",None,None,"['New Zealand', 'https://opencorporates.com/companies/nz/292112']",None,"['NZ Limited Company', 'https://opencorporates.com/companies/nz/292112']",0.625,0.25,0.375,0.0,0.3125
SOCAmps CROI: Conversion Rate Optimization - CRO Software,https://croi.socamps.com/,SOCAmps CROI is a Conversion Rate Optimization - CRO Software for Digital Marketers. It provides CRO Tools to Track & Convert Visitors to Leads to Sales,croi.socamps,None,"['sales@aaromba.com', 'https://www.crunchbase.com/organization/aaromba-technologies']","['+61 2 9966 1101', 'https://www.crunchbase.com/organization/aaromba-technologies']","['such other websites', 'visitor information', 'other websites', 'visitor conversion', 'croi e-commerce visitor engagement triggers', 'service data a visitor', 'croi cro tools', 'such information', 'more visitors', 'fulfilment conversion rate optimization']",None,"[['CRMSoftware'], 'https://www.crunchbase.com/organization/aaromba-technologies']","['2002', 'https://www.crunchbase.com/organization/aaromba-technologies']",None,None,None,None,"['Private', 'https://www.crunchbase.com/organization/aaromba-technologies']",0.0,0.0,0.0,0.0,0.0
The Market Herald: ASX News Today | Australian Stock ...,https://themarketherald.com.au/,The Market Herald – First with the news that moves markets. Breaking Australian stock market news  ASX 200 announcements and the latest ASX news today.,themarketherald,"['Level  11 , 28 The Esplanade, Perth WA 6000', 'https://themarketherald.com.au/contact-us/']","['contact@themarketherald.com.au', 'https://themarketherald.com.au/contact-us/']","['+618 6169 3114', 'https://themarketherald.com.au/contact-us/']",None,"[['Dr James GarnerSource', 'CEO'], 'https://muckrack.com/media-outlet/themarketheraldcom']","[['3D TechnologyAugmented RealityCADInformation TechnologyInternet of ThingsReal TimeSoftwareVirtual Reality'], 'https://www.crunchbase.com/organization/servtech-global']","['2016', 'https://www.crunchbase.com/organization/servtech-global']","['$7.88 million USD', 'https://www.dnb.com/business-directory/company-profiles.hotcopper_holdings_limited.53849f4eb765841b7f2b8cf08f6e54e1.html']",None,None,None,"['Public', 'https://www.crunchbase.com/organization/servtech-global']",1.0,0.25,0.75,0.0,0.5
Clinical Genomics,https://www.clinicalgenomics.com/,,clinicalgenomics,"['3681 CLINICAL GENOMICS AUSTRALIA 2 Eden Park Drive North Ryde, NSW 2113 Australia', 'https://www.clinicalgenomics.com/contact']","['contact@clinicalgenomics.com', 'https://www.crunchbase.com/organization/clinical-genomics-technologies']","['+612 9887 5300', 'https://www.clinicalgenomics.com/contact']","['colorectal cancer https://gi.org/wp-content/uploads/2018/04/acg-colorectal-cancer-screening-guideline-summary.pdf clinical genomics', 'clinical genomics pty ltd clinical genomics', 'colorectal cancer blood test sensitivity', 'liquid biopsy company clinical genomics clinical genomics', 'clinical genomics', 'clinical epigenetics https://cebp.aacrjournals.org/content/early/2020/09/19/1055-9965.epi-20-0574 clinical genomics', 'colvera clinical genomics', 'disease recurrence clinical genomics', 'clinical genomics products', 'clinical genomics presents clinical utility data']","['Lawrence LaPointe', 'founder(s)', 'https://www.crunchbase.com/organization/clinical-genomics-technologies']","[['BiotechnologyGeneticsHealth CareHealth Diagnostics'], 'https://www.crunchbase.com/organization/clinical-genomics-technologies']","['2006', 'https://www.crunchbase.com/organization/clinical-genomics-technologies']","['$14.92 million USD', 'https://www.dnb.com/business-directory/company-profiles.clinical_genomics_technologies_pty_ltd.f6bf014ed9d91fc6664b82162a899c9d.html']",None,None,None,"['Private', 'https://www.crunchbase.com/organization/clinical-genomics-technologies']",1.0,0.25,0.0,0.0,0.3125
Neuroscience Trials Australia: Home,http://www.neurotrialsaustralia.com/,,neurotrialsaustralia,"['245 Burgundy Street Heidelberg VIC 3084 Australia', 'http://www.neurotrialsaustralia.com/contact/']","['athina.soulis@unimelb.edu.au', 'http://www.neurotrialsaustralia.com/contact/']","['+61 3 9496 2881', 'http://www.neurotrialsaustralia.com/contact/']","['clinical trial development', 'many clinical trials', 'clinical trials information', 'neuroscience clinical trials', 'clinical trial sites', 'clinical trial recruitment', 'clinical trial expertise', 'controlled clinical trials', 'ongoing clinical trials', 'contemporary clinical trials']",None,"['Education, Agriculture', 'from_classification_model']",None,None,None,None,None,None,1.0,0.25,0.0,0.0,0.3125
LabMagic Dental Laboratory Management Software,https://www.labmagic.com.au/,Omega Ceramics is one of Australia's leading and influential Dental Laboratories and has been a pioneer in dental restorations for over 40 years. Their latest ...,labmagic,None,None,"['+61 404 455 325', 'https://www.labmagic.com.au/ContactUs.aspx']","['labmagic labmagic', 'labmagic laboratory', 'labmagic labmagic stores', 'labmagic labmagic versions', 'labmagic software', 'labmagic features', 'labmagic products loyalty program', 'labmagic products loyalty program international time clock stock', 'lab staff', 'dental labs']",None,"['Manufacturing, IT - Software', 'from_classification_model']",None,None,None,None,None,None,0.0,0.25,0.0,0.0,0.0625
Home » EBOS Group Limited,https://www.ebosgroup.com/,,ebosgroup,"['108 Wrights Rd Christchurch, CANTERBURY New Zealand', 'https://www.dnb.com/business-directory/company-profiles.ebos_group_limited.c76acf1aaff3bd59e4377e3d71a7304c.html']","['ebos@ebosgroup.com', 'https://www.crunchbase.com/organization/ebos-group']","['+61 3 9918 5555', 'https://www.ebosgroup.com/contact-us/']","['vitapet ebos group history ebos group', 'ebos group limited', 'ebos group chief executive', 'ebos group revenues', 'ebos group chairman', 'ebos group ltd.', 'ebos group subsidiaries', 'ebos businesses', 'ebos group’s', 'rap ebos group limited']","[['John Cullity', 'CEO'], 'https://www.ebosgroup.com/about-us/leadership-team/']","[['Health CareHospital'], 'https://www.crunchbase.com/organization/ebos-group']","['1922', 'https://www.crunchbase.com/organization/ebos-group']","['$6.50 billion USD', 'https://www.dnb.com/business-directory/company-profiles.ebos_group_limited.c76acf1aaff3bd59e4377e3d71a7304c.html']",None,"['Australia', 'https://opencorporates.com/companies/au/125401247']",None,"['Private', 'https://www.crunchbase.com/organization/ebos-group']",0.25,0.25,0.0,0.0,0.125
Te Herenga Waka—Victoria University of Wellington–1st for ...,http://www.victoria.ac.nz/,Discover your study options at NZ’s capital city university. Learn about our research impact  living in Wellington  scholarships and upcoming events.,victoria.ac.nz,"['PO Box 600 Victoria University of Wellington Wellington 6140 New Zealand', 'http://www.victoria.ac.nz/law/about/contact']","['shannon.ryan@vu.edu.au', 'https://www.crunchbase.com/organization/victoria-university-australia']","['+64 4 463 6365', 'http://www.victoria.ac.nz/law/about/contact']",None,"[['Kate McGrath ', 'Deputy Vice_Chancellor and Vice ...'], 'from linkedin search google']","['Education, Real estate', 'from_classification_model']","['1916', 'https://www.crunchbase.com/organization/victoria-university-australia']","['$3.4M', 'None']","['$0', 'None']","['New Zealand', 'https://opencorporates.com/companies/nz/9429041925515']","['53', 'None']","['Business\xa0Name Independent', 'https://www.dnb.com/business-directory/company-profiles.victoria_university_of_wellington.a54c3d099986ed75f8d9af0a3cfd9458.html']",0.25,0.25,0.0,0.0,0.125
AWQC - Home,https://www.awqc.com.au/,,awqc,"['Level  5 / 1H Royal Parade, Parkville, VIC 3050', 'https://www.awqc.com.au/news/australian-water-quality-centre-melbourne-laboratory']","['awqccsu@sawater.com.au', 'https://www.awqc.com.au/our-services/Water-quality-testing-and-analysis/bore-water-testing']","['+61 2 9886 0222', 'https://www.awqc.com.au/our-services/product-testing/products-directory/product-certification']","['water samples', 'water quality testing', 'water source samples', 'water quality tests', 'water quality results', 'drinking water quality', 'water extract samples', 'water quality sampling', 'test waters', 'water quality monitoring']","[['Michael Glasson ', 'Supervisor Product Testing_SA ...'], 'from linkedin search google']","['Manufacturing, Healthcare', 'from_classification_model']",None,None,None,None,None,None,0.25,0.25,0.0,0.0,0.125
RED (Real Estate Dynamics): Property Management ...,https://realestatedynamics.com.au/,Real Estate Dynamics (RED): Australia's leading Property Management Consultancy & Broker of Real Estate Agencies  Businesses  and Property Mgt Rent Rolls.,realestatedynamics,"['Suite  33 , 17 Bowen Bridge Road, Herston QLD 4006', 'https://realestatedynamics.com.au/privacy/']","['privacyofficer@rea-group.com', 'https://www.crunchbase.com/organization/realestate-com-au']","['+61448 166 196', 'https://realestatedynamics.com.au/blog-articles/spring-clean-your-rent-roll/']","['personal information real estate dynamics', 'real estate dynamics rent roll market reports', 'rent roll businesses', 'real estate dynamics service', 'real estate dynamics reviews', 'property management property managers', 'property management rent roll insights sellers', 'property management businesses', 'real estate dynamics rent roll market reports contains industry', 'real estate dynamics']","[['NATHAN ROBERT BRETT', 'Director'], 'https://www.dnb.com/business-directory/company-profiles.real_estate_dynamics_pty_ltd.f731525ea8ab1b5a218c7bb55c23309d.html']","[['Digital MediaProperty ManagementReal Estate'], 'https://www.crunchbase.com/organization/realestate-com-au']","['2017', 'https://www.crunchbase.com/organization/realestate-com-au']","['$3.14 million USD', 'https://www.dnb.com/business-directory/company-profiles.real_estate_dynamics_pty_ltd.f731525ea8ab1b5a218c7bb55c23309d.html']",None,None,None,"['Private', 'https://www.crunchbase.com/organization/realestate-com-au']",1.0,0.25,0.75,0.0,0.5
SmartyGrants | Home,https://smartygrants.com.au/,SmartyGrants is Australia's most-used and best-loved grants administration system.,smartygrants,"['552 Victoria Street North Melbourne, Victoria 3051 Australia', 'https://smartygrants.com.au/contact-us']","['ate@katecaldecott.com.au', 'https://smartygrants.com.au/about/consultants']","['+61 3 9320 6888', 'https://smartygrants.com.au/contact-us']","['grants programs', 'grant application assessments', 'existing grants programs', 'grant program design', 'grant funding', 'equitable grants programs', 'administer grants programs', 'quality grant applications', 'smartygrants smartygrants', 'community grants']","[['Denis Moriarty', 'founder'], 'https://smartygrants.com.au/about/our-team']","['Finance and insurance, IT - Software', 'from_classification_model']",None,None,None,None,None,None,0.25,0.25,0.0,0.0,0.125
Water Services Association of Australia,https://www.wsaa.asn.au/,Home · About us▽Toggle Nav. What we do · How we do it · Our board · Our team · Our members · Membership · Contact us · WSAA Shop · News ...,wsaa.asn.au,"['Level  9 | 420\xa0George Street\xa0| Sydney | NSW 2000', 'https://www.wsaa.asn.au/about-us/contact-us']","['info@wsaa.asn.au', 'https://www.crunchbase.com/organization/water-services-association-of-australia']","['+61 (0)3 8605 7605', 'https://www.wsaa.asn.au/about-us/membership']","['urban water industry', 'water industry', 'urban water', 'urban water utilities', 'water utilities', 'water industry purposes', 'water applications', 'water services', 'water industry standards', 'water industry investments']","[['Adam Lovell', 'Managing_Director'], 'https://www.wsaa.asn.au/about-us/our-team']","[['AssociationFitnessFood and BeverageHealth Care'], 'https://www.crunchbase.com/organization/water-services-association-of-australia']","['1998', 'https://www.crunchbase.com/organization/water-services-association-of-australia']","['7.5M', 'https://app.avention.com/company/5b52a909-8e9c-3883-b60b-213ec17d4c1f#report/company_summary']",None,"[' Docklands, Victoria, Australia', 'https://www.crunchbase.com/organization/water-services-association-of-australia']","['11', 'https://app.avention.com/company/5b52a909-8e9c-3883-b60b-213ec17d4c1f#report/company_summary']","['Private', 'https://www.crunchbase.com/organization/water-services-association-of-australia']",0.25,0.375,0.0,0.0,0.15625
Arup: We shape a better world,https://www.arup.com/,Arup is an independent firm of designers  planners  engineers  architects  consultants and technical specialists  working across every aspect of today's built ...,arup,"['39 Hunter Street Sydney  Sydney, New South Wales Australia', 'https://www.arup.com/expertise/services/buildings/building-retrofit']",None,"['+61 (0) 7 3023 6000', 'https://www.arup.com/expertise/services/buildings/architecture']","['design arup', 'arup’s building services', 'arup corporate finance limited arup', 'new lighting design', 'arup project managers', 'arup corporate finance limited arup staff', 'arup’s water team', 'iconic building design', 'sustainable building envelope designs', 'systems design']","[['Martin James Ansley-Young', 'Director'], 'https://app.avention.com/company/9a2b368f-51a5-3328-90a4-872777d027ae#report/company_summary']","['Architecture and Engineering', 'https://app.avention.com/company/9a2b368f-51a5-3328-90a4-872777d027ae#report/company_summary']","['30 April 1975', 'https://opencorporates.com/companies/au/001285105']","['289M', 'https://app.avention.com/company/9a2b368f-51a5-3328-90a4-872777d027ae#report/company_summary']",None,"['Australia', 'https://opencorporates.com/companies/au/001285105']","['3,000', 'None']","['Private Subsidiary, Headquarters', 'https://app.avention.com/company/9a2b368f-51a5-3328-90a4-872777d027ae#report/company_summary']",0.4375,0.25,0.375,0.0,0.265625
Home | Bank of Sydney | Bank of Sydney,https://www.banksyd.com.au/,Bank of Sydney offers award winning Home Loan and Transaction Accounts. Our Services include Term Deposits  Foreign Exchange  Savings Accounts as well as Business Banking services. ,banksyd,"['219-223 Castlereagh St, Sydney NSW 2000', ['Bank of Sydney, address', 'knowledge_panel']]","['ohn.tougiannidis@banksyd.com.au', 'https://www.banksyd.com.au/contact-us']","['+61 2 8262 9191', 'https://www.banksyd.com.au/contact-us']","['sydney home loan', 'sydney customer', 'sydney branch', 'business accounts', 'business online banking', 'home loan customers', 'bank', 'business online banking users', 'bos online banking', 'sydney transaction account number']","[['NICHOLAS PAPPAS', 'Director'], 'https://www.dnb.com/business-directory/company-profiles.bank_of_sydney_ltd.67f97b20997139bd0cbe4ac7c69258fc.html']","['Finance and insurance, Real estate', 'from_classification_model']","['27 January 2017', 'https://opencorporates.com/companies/nz/6220488']","['$64.38 million USD', 'https://www.dnb.com/business-directory/company-profiles.bank_of_sydney_ltd.67f97b20997139bd0cbe4ac7c69258fc.html']",None,"['New Zealand', 'https://opencorporates.com/companies/nz/6220488']",None,"['Public\xa0Limited\xa0Company Subsidiary', 'https://www.dnb.com/business-directory/company-profiles.bank_of_sydney_ltd.67f97b20997139bd0cbe4ac7c69258fc.html']",0.75,0.25,0.0,0.0,0.25
International Journal of Emergency Medicine | Home page,https://intjem.biomedcentral.com/,The first open access journal primarily focussed on the global practice of emergency medicine  International Journal of Emergency Medicine (INTJEM) aims to ...,intjem.biomedcentral,None,"['enquiries@csiro.au', 'https://www.crunchbase.com/organization/csiro']",None,None,"['David Burt', 'founder(s)', 'https://www.crunchbase.com/organization/csiro']","[['Consumer ResearchMarine TechnologyMarket ResearchProduct Research'], 'https://www.crunchbase.com/organization/csiro']","['1916', 'https://www.crunchbase.com/organization/csiro']","['$3.2M', 'None']","['$24.2M', 'None']",None,"['77', 'None']","['Private', 'https://www.crunchbase.com/organization/csiro']",0.0,0.0,0.0,0.0,0.0
