title,link,description,comp_name,address,email,telephone_number,keywords,contact_person,type_or_sector,founded_year,revenue,funding,headquarters,No_of_employees,company_status,address_confidence,tp_confidence,headquarters_confidence,contact_confidence,Total_confidence
Slack: Welcome to your new HQ,https://slack.com/,Slack is a new way to communicate with your team. It’s faster  better organised and more secure than email.,slack,None,"['feedback@slack.com', 'https://www.crunchbase.com/organization/slack']",None,None,"[['Melanie Slack', 'CEO'], 'https://www.insurancebusinessmag.com/au/special-reports/hot-list-2018/melanie-slack-ceo-australia-and-new-zealand-swiss-re-corporate-solutions-93073.aspx']","[['CollaborationEnterprise SoftwareMessagingReal TimeSaaSSoftware'], 'https://www.crunchbase.com/organization/slack']","['Jan 1, 2009', 'https://www.crunchbase.com/organization/slack']",None,None,None,None,"['Public', 'https://www.crunchbase.com/organization/slack']",0.5,0.0,0.375,0.0,0.21875
Science Industry Australia: Home,http://www.scienceindustry.com.au/,,scienceindustry,"['13 /62 Ramset Drive, Chirnside Park, Victoria 3116 Australia', 'http://www.scienceindustry.com.au/index.php/members-1/member-list/ezzivision']","['resources@industry.gov.au', 'https://www.crunchbase.com/organization/department-of-industry-innovation-and-science']","['+61 3 9872 5111', 'http://www.scienceindustry.com.au/index.php/about/privacy']","['science industry australia ltd', 'laboratory safety science industry australia', 'science industry australia', 'australasian laboratory managers association science industry australia', 'science industry australia members', 'australia pty ltd', 'privacy science industry australia', 'science industry australia ltd.', 'biomelbourne network science industry australia ltd', 'labware australia pty ltd']","[['Matthew Cossey', 'CEO'], 'https://www.croplife.org.au/media/media-releases/experts-to-continue-to-lead-australias-plant-science-industry/']","[['GovernmentOffice Administration'], 'https://www.crunchbase.com/organization/department-of-industry-innovation-and-science']",None,"['$145,811 USD', 'https://www.dnb.com/business-directory/company-profiles.science_industry_australia_incorporated.09504b42f232dc64412a2961bfbb8367.html']",None,None,None,"['Private', 'https://www.crunchbase.com/organization/department-of-industry-innovation-and-science']",0.25,0.25,0.0,0.0,0.125
Interdisciplinary Maternal Perinatal Australasian ... - PSANZ,https://impact.psanz.com.au/,,impact.psanz,"['374 Bagot Road Subiaco WA 6008 Australia', 'https://impact.psanz.com.au/clinical-trials/clinical-trials-2/?Sort=Topic&Dir=ASC&start=0&Filter=All&action_download=true']","['makeaDIF@socialventures.com.au', 'https://www.crunchbase.com/organization/social-ventures-australia']","['+64 9 923 7720', 'https://impact.psanz.com.au/clinical-trials/clinical-trials-2/?Sort=StatusRecruitment&Dir=ASC&start=0&Filter=Current']","['randomised controlled trial', 'canberra hospital logan hospital', 'townsville hospital dandenong hospital', 'randomised trials', 'controlled trial', 'randomised clinical trials', 'hospital', 'royal hospital', 'mercy hospital women', 'children hospital']","['Michael Traill', 'founder(s)', 'https://www.crunchbase.com/organization/social-ventures-australia']","[['ConsultingImpact InvestingVenture Capital'], 'https://www.crunchbase.com/organization/social-ventures-australia']","['2002', 'https://www.crunchbase.com/organization/social-ventures-australia']",None,None,None,None,None,0.25,0.25,0.0,0.0,0.125
Transparency Market Research: Market Research Reports ...,https://www.transparencymarketresearch.com/,Transparency Market Research offers meticulously researched market studies backed by 4 million hours of research experience. Currently handling over 350 ...,transparencymarketresearch,None,"['hr@transparencymarketresearch.com', 'https://www.transparencymarketresearch.com/career/home']",None,"['market injection molded plastics market', 'market report', 'global construction market', 'markets', 'market research', 'global antibacterial drugs market', 'global atrial fibrillation market asia pacific endocrine testing market', 'market players', 'market trends', 'oil market report']","[['Community Acquired Pneumonia Market ', 'Global ..._LinkedIn'], 'from linkedin search google']","['Finance and insurance, Manufacturing', 'from_classification_model']",None,None,None,None,None,None,0.0,0.0,0.0,0.0,0.0
Welcome to the LabWare LIMS Solutions web site,https://www.labware.com/,,labware,"['1101 Whitehorse Road Box Hill Victoria 3128 Australia', 'https://www.labware.com/lwwebdev3.nsf/child4_1.xsp?OpenXpage&p1=Contact-Us&p2=Asia-Pacific&p3=Australia-and-New-Zealand&p4=']","['info@labware.com', 'https://www.crunchbase.com/organization/labware']","['+61 (0) 3 9898 7814', 'https://www.labware.com/lwwebdev3.nsf/child4_1.xsp?OpenXpage&p1=Contact-Us&p2=Asia-Pacific&p3=Australia-and-New-Zealand&p4=']","['labware saas lims', 'ready labware saas lims', 'labware', 'labware system', 'labware mobile', 'labware services', 'labware lims', 'labware development', 'labware verification', 'labware table']","[['Karl Mandekic', 'CEO'], 'https://au.linkedin.com/in/karl-mandekic-1407a5110']","[['Information TechnologyManufacturing'], 'https://www.crunchbase.com/organization/labware']","['1987', 'https://www.crunchbase.com/organization/labware']",None,None,None,None,"['Private', 'https://www.crunchbase.com/organization/labware']",1.0,0.25,0.0,0.0,0.3125
MedRecruit: Locum and Permanent Doctor Jobs,https://www.medrecruit.com/,MedRecruit is a medical recruitment agency offering locum and permanent doctor jobs throughout Australia & New Zealand. Our team of recruitment specialists ...,medrecruit,"['Remarkables House L 2 26 Hawthorne Drive , Frankton Queenstown, 9300 New Zealand ', 'https://app.avention.com/company/76461bed-afaa-3df3-8749-826b8f48eb83#report/company_summary']","['tina.barclay@medrecruit.com', 'https://www.medrecruit.com/blog/day-life-general-practitioner-jobs/']","['+64 3 4412470', 'https://www.medrecruit.com/privacy-policy/']","['new doctor jobs', 'medical doctors', 'more doctor jobs', 'permanent doctor jobs', 'available doctor jobs', 'good doctors', 'locum doctors', 'new doctors', 'doctor recruitment agency', 'permanent doctor job opportunities']","[['Sam Bolton Hazledine', 'Director'], 'https://app.avention.com/company/76461bed-afaa-3df3-8749-826b8f48eb83#report/company_summary']","['Employment Services', 'https://app.avention.com/company/76461bed-afaa-3df3-8749-826b8f48eb83#report/company_summary']","['22 June 2015', 'https://opencorporates.com/companies/nz/5732610']","['4M', 'https://app.avention.com/company/76461bed-afaa-3df3-8749-826b8f48eb83#report/company_summary']",None,"['New Zealand', 'https://opencorporates.com/companies/nz/5732610']","['57', 'https://app.avention.com/company/76461bed-afaa-3df3-8749-826b8f48eb83#report/company_summary']","['Private Independent', 'https://app.avention.com/company/76461bed-afaa-3df3-8749-826b8f48eb83#report/company_summary']",0.0,0.25,0.375,0.0,0.15625
InterSystems: Database Management & Healthcare ...,https://www.intersystems.com/,Discover InterSystems  an industry-leading vendor for database management  rapid application development and integration  and healthcare information ...,intersystems,"['Level  12 , 383 Kent Street Sydney NSW 2000 Australia', 'https://www.intersystems.com/who-we-are/worldwide-offices/']","['ap.sales@inter-systems.com', 'https://www.crunchbase.com/organization/intersystems-c6f3']","['+61 403 352 232', 'https://www.intersystems.com/news-events/news/news-item/rxmx-builds-chameleon-technology-platform-on-intersystems-iris-for-health-to-accelerate-the-safe-use-of-medicines-globally/']","['intersystems iris intersystems', 'intersystems healthshare intersystems', 'intersystems caché', 'intersystems iris data platform intersystems', 'caché 5.0.x intersystems', 'uses intersystems caché database system', 'intersystems data platform', 'intersystems data platform technology', 'intersystems data management technology', 'aix intersystems bv caché']","[['Alexandre Thomas WOLFORD', ' director'], 'https://opencorporates.com/companies/nz/7159313']","[['Information TechnologyProfessional Services'], 'https://www.crunchbase.com/organization/intersystems-c6f3']","['1976', 'https://www.crunchbase.com/organization/intersystems-c6f3']","['39M', 'https://app.avention.com/company/0e9227d2-aa0e-3db2-a9f2-8145d0b5c8c9#report/company_summary']",None,"[' Brisbane, Queensland, Australia', 'https://www.crunchbase.com/organization/intersystems-c6f3']","['162', 'https://app.avention.com/company/0e9227d2-aa0e-3db2-a9f2-8145d0b5c8c9#report/company_summary']","['Private', 'https://www.crunchbase.com/organization/intersystems-c6f3']",0.25,0.25,0.25,0.0,0.1875
SGS New Zealand | When You Need To Be Sure,https://www.sgs.co.nz/,SGS is the world's leading inspection  verification  testing and certification company. We are recognized as the global benchmark for quality and integrity._,sgs,"['Level  4 , 8 Rockridge Avenue, Penrose Onehunga Auckland 1061 New Zealand', 'https://www.sgs.co.nz/en/our-company/compliance-and-integrity/integrity-at-sgs']",None,"['+64 9 634 3637', 'https://www.sgs.co.nz/en/our-company/compliance-and-integrity/integrity-at-sgs']","['organismo de certificação de que não', 'o organismo de certificação de que não deseja renovar', 'organismo de certificação que', 'ao organismo de certificação', 'pelo organismo de certificação', 'conditions sgs', 'organismo de certificação e fechada', 'contra o organismo de certificação', 'sgs documents', 'sgs société générale de surveillance sa']","[['Frankie Ng', 'CEO'], 'https://www.sgs.com.au/en-gb/our-company/about-sgs/operations-council']","[['CommercialProfessional Services'], 'https://www.crunchbase.com/organization/australian-radiation-services']","['1986', 'https://www.crunchbase.com/organization/australian-radiation-services']","['$194.13 million USD', 'https://www.dnb.com/business-directory/company-profiles.sgs_australia_pty_ltd.4b96d76019d188f1d7bd538b1d0acb5c.html']",None,"['Australia', 'https://opencorporates.com/companies/au/632513412']",None,"['Private', 'https://www.crunchbase.com/organization/australian-radiation-services']",0.25,0.25,0.0,0.0,0.125
Biopharma Dealmakers - Nature,https://www.nature.com/biopharmdeal,Biopharma Dealmakers brings together life sciences companies and individuals looking to identify and attract partners and dealmaking opportunities. ,biopharmadealmakers.nature,"['9 CHILVERS ROAD THORNLEIGH, NEW SOUTH WALES, 2120 Australia', 'https://www.dnb.com/business-directory/company-profiles.rainbow_and_nature_pty_ltd.0638050d75b04ce1.html']","['support@hipages.com.au', 'https://www.crunchbase.com/organization/hipages-group']","['+649-2013-0052', 'https://www.nature.com/articles/s41599-019-0272-3']","['other nature research journals', 'springer nature research journals', 'published nature journal authors', 'nature research authors', 'relevant nature research journals', 'new nature journals', 'springer nature journals', 'nature research errata webcasts author information', 'university college london', 'nature research policies']","['David Vitek', 'founder(s)', 'https://www.crunchbase.com/organization/hipages-group']","[['AdvertisingHome and GardenHome ImprovementHome RenovationHome ServicesLead Generation'], 'https://www.crunchbase.com/organization/hipages-group']","['2006', 'https://www.crunchbase.com/organization/hipages-group']","['$5.06 million USD', 'https://www.dnb.com/business-directory/company-profiles.rainbow_and_nature_pty_ltd.0638050d75b04ce1.html']",None,None,None,"['Private', 'https://www.crunchbase.com/organization/hipages-group']",0.0,0.25,0.0,0.0,0.0625
MinterEllison - Legal and Consulting - MinterEllison,https://www.minterellison.com/,Discover our legal and consulting services for your industry. Our people are ready whenever you need us.,minterellison,"['L 40 Governor Macquarie Tower 1 Farrer Pl Sydney, NEW SOUTH WALES, 2000 Australia', 'https://www.dnb.com/business-directory/company-profiles.minter_ellison.432f53c568d111f4.html']","['enquiries@oaic.gov.au', 'https://www.minterellison.com/privacypolicy']","['+61 419 585 488', 'https://www.minterellison.com/people/kathy_reid']","['commercial legal services', 'legal services', 'financial services businesses', 'legal teams', 'commercial legal counsel', 'major financial services client', 'legal risk', 'legal issues', 'innovative legal teams', 'financial services organisations']","[['Annette Kimmitt', 'CEO'], 'https://www.minterellison.com/people/annette-kimmitt']","[['Law EnforcementLegalProfessional Services'], 'https://www.crunchbase.com/organization/minter-ellison']","['1827', 'https://www.crunchbase.com/organization/minter-ellison']","['$35.69 million USD', 'https://www.dnb.com/business-directory/company-profiles.minter_ellison.432f53c568d111f4.html']",None,"['New Zealand', 'https://opencorporates.com/companies/nz/1151899']",None,"['Private', 'https://www.crunchbase.com/organization/minter-ellison']",0.25,0.25,0.0,0.0,0.125
Yahoo Finance – stock market live_ quotes_ business & finance ...,https://au.finance.yahoo.com/,Australian finance news  stock quotes  currency information and blogs,au.finance.yahoo,"['Level 8 /react-text react-text: 13 Perth, WA 6000', 'https://au.finance.yahoo.com/quote/ARV.AX/profile?p=ARV.AX']","['support@theoneshotketo.com', 'https://au.finance.yahoo.com/news/tianqi-lithium-says-no-cash-114038420.html']","['+61 8 9486 4036', 'https://au.finance.yahoo.com/quote/ARV.AX/profile?p=ARV.AX']","['keto one shot keto', 'shot keto', 'shot keto review', 'keto?one shot keto', 'keto works?one shot', 'keto product purchases', 'company insiders', 'keto product', 'other weight loss products', 'cash burning companies']","[['PETER RALPH MARRIOTT', 'Director'], 'https://www.dnb.com/business-directory/company-profiles.asx_limited.5dabc7431846f94170abccd0dc59ff78.html']","[['MessagingNewsSearch Engine'], 'https://www.crunchbase.com/organization/yahoo-4']","['1994', 'https://www.crunchbase.com/organization/yahoo-4']","['$657.27 million USD', 'https://www.dnb.com/business-directory/company-profiles.asx_limited.5dabc7431846f94170abccd0dc59ff78.html']",None,None,None,"['Private', 'https://www.crunchbase.com/organization/yahoo-4']",0.25,0.25,0.0,0.0,0.125
Zwick Roell,https://www.zwickroell.com/en,ZwickRoell is the world's leading supplier of materials testing machines. Our materials testing machines are used worldwide in R&D  quality assurance in more than 20 industries.,zwickroell,None,"['datenschutz@zwickroell.com', 'https://www.zwickroell.com/en/data-privacy']",None,"['zwickroell testing solution fatigue tests', 'zwickroell testing machines', 'zwickroell testing systems', 'test zwickroell', 'zwickroell robotic testing systems', 'zwickroell testing software', 'static materials testing machines', 'zwickroell test fixtures', 'allroundline materials testing machines', 'testing system']","[['Alan Thomas ', 'Director & Country Manager_Routyn Australia ...'], 'from linkedin search google']","['Manufacturing, Healthcare', 'from_classification_model']",None,None,None,None,None,None,0.0,0.0,0.0,0.0,0.0
TrialAssure: Home,https://www.trialassure.com/,,trialassure,None,"['curtis@digitalliance.com', 'https://www.trialassure.com/category/blog/page/2/']",None,"['clinical trial transparency', 'clinical trial transparency tools', 'clinical trial results', 'increased clinical trial transparency', 'advancing clinical trial transparency', 'clinical trial transparency solutions', 'clinical trial information', 'clinical trial reporting', 'clinical trial results summaries', 'unreported clinical trial data']",None,"['Agriculture, IT - Software', 'from_classification_model']",None,None,None,None,None,None,0.0,0.0,0.0,0.0,0.0
Bushfire & Natural Hazards CRC,https://www.bnhcrc.com.au/,23 Jul. Minister for Industry Science and Resources. $88.1 million for new world class disaster research centre. Tweets. Tweets by bnhcrc. Landgate FireWatch.,bnhcrc,"['4 Murray Rose Avenue Sydney Olympic Park  NSW 2127 Australia', 'https://www.bnhcrc.com.au/events/2019-raf-sydney2']","['david.boxshall@bnhcrc.com.au', 'https://www.bnhcrc.com.au/about/board-staff']","['+61 3 9418 5208', 'https://www.bnhcrc.com.au/about/board-staff']","['fire risk', 'natural hazard risk management', 'natural hazards emergency management', 'fire management', 'community fire managers', 'natural hazard risk reduction crc reports', 'disaster risk reduction research programs', 'fire management agencies', 'fire australia', 'community bushfire risk reduction']","[['Blythe McLennan ', 'Research Fellow_ Centre for ..._LinkedIn'], 'from linkedin search google']","['Mining, oil and gas, Real estate', 'from_classification_model']",None,None,None,None,None,None,0.25,0.25,0.0,0.0,0.125
Flinders Clinical Trial Services,https://flinderscts.com/,,flinderscts,"['15 Lum Street Export Park, Adelaide Airport South Australia 5950', 'https://flinderscts.com/contact/']",None,"['+61 8 8150 0000', 'https://flinderscts.com/contact/']","['flinders clinical trial services', 'clinical trial services', 'heman flinders clinical trial services', 'clinical trial drug storage', 'clinical trial', 'leading clinical trial service providers', 'clinical trials', 'clinical trial materials', 'clinical trial drugs', 'major clinical trial companies']","[['Sandra Dolan ', 'Manager_Flinders Clinical Trial ...'], 'from linkedin search google']","['IT - Software, Education', 'from_classification_model']","['29 January 1987', 'https://opencorporates.com/companies/au/008126752']","['$6.69 million USD', 'https://www.dnb.com/business-directory/company-profiles.cutters_landing-flinders_cts_31318.51dba1bc6ae1d62f0eccf60c65095e09.html']",None,"['Australia', 'https://opencorporates.com/companies/au/008126752']",None,"['Independent', 'https://www.dnb.com/business-directory/company-profiles.cutters_landing-flinders_cts_31318.51dba1bc6ae1d62f0eccf60c65095e09.html']",0.625,0.25,0.0,0.0,0.21875
Welcome to Metagenics | Metagenics -,https://www.metagenics.com.au/,,metagenics,"['121-129 Crown St, Darlinghurst NSW 2010', ['The Compounding Pharmacy Australia, address', 'knowledge_panel']]",None,"['1800 777 648', 'https://www.metagenics.com.au/help']","['g oral powder', 'oral liquid', 'ml oral liquid', 'tablet', 'oral liquid r omega care', 'tablets videos metapure epa', 'tablets c calmx tropical flavour', 'ultra probioplex 150 g oral powder', 'g', 'bioavailable zinc tablets']","[['Paula Hann', 'Managing_Director'], 'https://au.linkedin.com/in/paula-hann-39b70a28']","['Healthcare, Manufacturing', 'from_classification_model']","['22 January 2008', 'https://opencorporates.com/companies/nz/2076695']","['$88.36 million USD', 'https://www.dnb.com/business-directory/company-profiles.metagenics_australia_pty_ltd.5d816e4adc48224176a370a2680591c3.html']",None,"['New Zealand', 'https://opencorporates.com/companies/nz/2076695']",None,"['Proprietorship Parent', 'https://www.dnb.com/business-directory/company-profiles.metagenics_australia_pty_ltd.5d816e4adc48224176a370a2680591c3.html']",0.0,0.25,0.25,0.0,0.125
NZ Herald - Breaking news_ latest news_ business_ sport and ...,https://www.nzherald.co.nz/,Latest breaking news articles  photos  video  blogs  reviews  analysis  opinion and reader comment from New Zealand and around the World - NZ Herald.,nzherald,"['80 ,000 EVs on New Zealand road by 2023 NZ', 'https://www.nzherald.co.nz/']","['dylan.cleaver@nzherald.co.nz', 'https://www.nzherald.co.nz/sport/news/article.cfm?c_id=4&objectid=12056958']",None,"['new zealand people', 'former new zealand player', 'new zealand rugby', 'new zealand', 'most new zealand people', 'new zealand sport', 'new zealand rugby league', 'new zealand rugby union', 'new zealand herald', 'new zealand travel']","[['Dinesh Singh AMARNATH', ' director'], 'https://opencorporates.com/companies/nz/1870385']","['Manufacturing, Arts, entertainment and recreation', 'from_classification_model']","[' 4 October 2006', 'https://opencorporates.com/companies/nz/1870385']",None,None,"['New Zealand', 'https://opencorporates.com/companies/nz/1870385']",None,"['NZ Limited Company', 'https://opencorporates.com/companies/nz/1870385']",0.25,0.0,0.0,0.0,0.0625
ABN Newswire - Business News and Corporate Press Releases,https://www.abnnewswire.net/,,abnnewswire.net,"['Level  3 , 1 Bligh Street Sydney NSW 2000 Australia', 'https://www.abnnewswire.net/companies/en/29844/NSX-Ltd-29844.html']","['index@otcmarkets.com', 'https://www.abnnewswire.net/press/en/79923/']","['+61-8-9388-1980', 'https://www.abnnewswire.net/press/ru/32717/%D0%90%D1%81%D0%BF%D0%B0%D0%B9%D1%80-%D0%9C%D0%B0%D0%B9%D0%BD%D0%B8%D0%BD%D0%B3-%D0%9B%D0%B8%D0%BC%D0%B8%D1%82%D0%B5%D0%B4-%D0%9E%D0%B2%D0%BE%D0%BE%D1%82%D1%8B%D0%BD-%D0%BA%D0%BE%D0%BA%D1%81%D0%B6%D0%B8%D1%85-%D0%BD%D2%AF%D2%AF%D1%80%D1%81%D0%BD%D0%B8%D0%B9-%D0%BE%D1%80%D0%B4%D1%8B%D0%B3-%D0%B0%D1%88%D0%B8%D0%B3%D0%BB%D0%B0%D1%85-%D1%82%D1%83%D1%81%D0%B3%D0%B0%D0%B9-%D0%B7%D3%A9%D0%B2%D1%88%D3%A9%D3%A9%D1%80%D3%A9%D0%BB%D1%82%D1%8D%D0%B9-%D0%B1%D0%BE%D0%BB%D0%BB%D0%BE%D0%BE-32717.html']","['mindax limited asx', 'newenergy limited santos limited ดูในภาษาอื่น', 'บริษัท avanco resources limited', 'บริษัท aquila resources limited', 'บริษัท canyon resources limited', 'บริษัท prosperity resources limited', 'บริษัท interra resources limited', 'บริษัท bannerman resources limited', 'บริษัท jameson resources limited', 'บริษัท mindoro resources limited']",None,"[['MarketingOil and Gas'], 'https://www.crunchbase.com/organization/central-petroleum']","['1998', 'https://www.crunchbase.com/organization/central-petroleum']",None,None,None,None,"['Public', 'https://www.crunchbase.com/organization/central-petroleum']",0.25,0.25,0.0,0.0,0.125
Emerson Global | Emerson,https://www.emerson.com/,Helping address the world's most critical needs through our core business platforms - Automation Solutions and Commercial & Residential Solutions. Please ...,emerson,"['Level 8, 15 Talavera Road North Ryde, New South Wales, 2113 Australia', 'https://app.avention.com/company/c9c514a8-2d14-3fac-8201-e19678d3a712#report/company_summary']",None,"['+61-299191100', 'https://app.avention.com/company/c9c514a8-2d14-3fac-8201-e19678d3a712#report/company_summary']",None,"[['Boris Gabin', 'Director'], 'https://app.avention.com/company/c9c514a8-2d14-3fac-8201-e19678d3a712#report/company_summary']","['Electromedical and Control Instruments Manufacturing', 'https://app.avention.com/company/c9c514a8-2d14-3fac-8201-e19678d3a712#report/company_summary']","['26 March 1970', 'https://opencorporates.com/companies/au/008478699']","['176M', 'https://app.avention.com/company/c9c514a8-2d14-3fac-8201-e19678d3a712#report/company_summary']",None,"['Australia', 'https://opencorporates.com/companies/au/008478699']","['489', 'https://app.avention.com/company/c9c514a8-2d14-3fac-8201-e19678d3a712#report/company_summary']","['Private Subsidiary, Headquarters', 'https://app.avention.com/company/c9c514a8-2d14-3fac-8201-e19678d3a712#report/company_summary']",0.0,0.0,0.0,0.0,0.0
Novotech CRO: Contract Research Organization (CRO),https://novotech-cro.com/,Novotech CRO is a premier CRO Company providing clinical research solutions world-wide. Talk to our experts about your clinical research strategy today!,novotech-cro,"['Level 6, 3 Ferncroft Street, Grafton, Auckland1010NZ', 'https://opencorporates.com/companies/nz/1206392']","['communications@novotech-cro.com', 'https://novotech-cro.com/news/asia-pacific-has-record-year-clinical-trials-according-novotech']","['+64 9307 4360', 'https://novotech-cro.com/']","['clinical trial services', 'full clinical trial management cro services', 'cro clinical research companies', 'clinical trial sites', 'clinical trial organization companies', 'large clinical trials', 'clinical trial management', 'oncology clinical trials', 'quality clinical trial services', 'clinical trial activity']","[['Alek SAFARIAN', ' director'], 'https://opencorporates.com/companies/nz/1206392']","[['BiotechnologyHealth Care'], 'https://www.crunchbase.com/organization/novotech']","['1996', 'https://www.crunchbase.com/organization/novotech']",None,None,"['New Zealand', 'https://opencorporates.com/companies/nz/1206392']",None,"['Private', 'https://www.crunchbase.com/organization/novotech']",0.375,0.25,0.0,0.0,0.15625
