title,link,description,comp_name,address,email,telephone_number,keywords,contact_person,type_or_sector,founded_year,revenue,funding,headquarters,No_of_employees,company_status,address_confidence,tp_confidence,headquarters_confidence,contact_confidence,Total_confidence
Grant Thornton Australia | Audit_ Tax and Advisory,https://www.grantthornton.com.au/,Grant Thornton is one of the world's leading organisations of independent assurance  tax and advisory firms.,grantthornton,"['Level  17 , 383 Kent Street, Sydney NSW 2000', 'https://www.grantthornton.com.au/locations/sydney/']","['belfast@ie.gt.com', 'https://www.crunchbase.com/organization/grant-thornton']","['+61 2 8297 2509', 'https://www.grantthornton.com.au/PeopleService/GetVCard?contentGuid=306ddbf2-993d-4774-a336-39eb53f852ce&lang=en']","['grant thornton australia limited grant thornton australia', 'business tax risk', 'international tax grant thornton foundation', 'grant thornton australia', 'australian family businesses', 'grant thornton tax', 'grant thornton', 'australian businesses', 'grant thornton tax partner', 'grant thornton international']","[['Greg Keith', 'CEO'], 'https://www.grantthornton.com.au/news-centre/new-ceo-appointed-for-grant-thornton-effective-1-july-2015/']","[['AccountingFinance'], 'https://www.crunchbase.com/organization/grant-thornton']","['1899', 'https://www.crunchbase.com/organization/grant-thornton']",None,None,"['Australia', 'https://opencorporates.com/companies/au/086953013']","['53,000', 'None']","['Private', 'https://www.crunchbase.com/organization/grant-thornton']",1.0,0.25,0.0,0.0,0.3125
EMC Technologies: Product Certification_ Compliance ...,https://www.emctech.com.au/,EMC  Radio  Safety  SAR  EMR  IP  Environmental Accredited Product Compliance Testing & Approvals. EMC Technologies has 4 Test Labs in AU & NZ.,emctech,"['Unit  18 , 88 Merrindale Drive  Croydon South Victoria 3136', 'https://www.emctech.com.au/contact-enquiries/']","['auklab@ihug.co.n', 'https://www.emctech.com.au/careers/']","['+613 9365 1000', 'https://www.emctech.com.au/']","['emc technologies emc technologies', 'electrical safety testing product compliance testing', 'radio testing emc technologies', 'emc testing services', 'emc testing requirements', 'safety manager emc emc technologies', 'emc technologies test reports', 'product compliance testing services', 'product compliance testing positions', 'product testing']","[['Chris Zombolas', 'CEO'], 'https://www.emctech.jp/en/our-team-2/']","['Nonclassifiable Establishments', 'https://app.avention.com/company/62d00deb-5f07-3429-943f-498c65ca5c10#report/company_summary']",None,None,None,None,None,"['Private Independent', 'https://app.avention.com/company/62d00deb-5f07-3429-943f-498c65ca5c10#report/company_summary']",0.25,0.25,0.75,0.0,0.3125
InBody Body Composition Analysers – InBody Body ...,https://inbody.net.au/,,inbody.net.au,"['247 McLeod Street, Cairns, QLD 4870', 'https://inbody.net.au/nutrifocus-dietitians/']","['jeffrey@inbody.com', 'https://www.crunchbase.com/organization/inbody']","['+617 5526 0183', 'https://inbody.net.au/book-a-scan/']","['inbody inbody devices', 'inbody body composition analysers devices', 'inbody results', 'body composition analysers inbody', 'inbody scans', 'inbody tissues inbody', 'inbody bia technology', 'inbody bia', 'inbody body composition analysers director', 'body composition results']","['Kichul Cha', 'founder(s)', 'https://www.crunchbase.com/organization/inbody']","[['Health Care'], 'https://www.crunchbase.com/organization/inbody']","['1996', 'https://www.crunchbase.com/organization/inbody']",None,None,None,None,"['Private', 'https://www.crunchbase.com/organization/inbody']",0.25,0.25,0.0,0.0,0.125
FindAMasters Degree Worldwide - Postgraduate MSc MA ...,https://www.findamasters.com/,Postgraduate Masters Degrees  courses & programmes in Europe  including online and distance learning courses,findamasters,None,"['coronavirusenquiries@exeter.ac.uk', 'https://www.exeter.ac.uk/coronavirus/prospectivestudents/?utm_source=FindAUniversity&utm_medium=ad&utm_campaign=open_events&utm_term=Nov2020']",None,"['international postgraduate students', 'phd students', 'current postgraduate students', 'postgraduate students', 'new students', 'international phd students', 'masters students', 'postgraduate student recruitment', 'new international students', 'prospective postgraduate students']",None,"['Education, Healthcare', 'from_classification_model']",None,None,None,None,None,None,0.0,0.0,0.0,0.0,0.0
Digital Marketing Adelaide - Market Ease Digital Marketing ...,https://marketease.com.au/,Market Ease Digital is a digital marketing agency in Adelaide with 100's of proven success stories and real life Adelaide case studies.,marketease,"['19 Contact   Market Ease Digital 28 Greenhill Road, Wayville, SA 5034 Australia', 'https://marketease.com.au']",None,"['1300 662 990', 'https://marketease.com.au']","['social marketing sites', 'good social media marketing', 'other social media sites', 'good google', 'big screen video google ads business blog', 'business websites', 'google adsense participants sites', 'official google blog post', 'good google rankings', 'many other sites']","[['Binh An Nguyen', 'CEO'], 'https://marketease.com.au/about-market-ease/']","['IT - Software, Real estate', 'from_classification_model']",None,None,None,None,None,None,1.0,0.25,0.0,0.0,0.3125
Water Polo Australia: Home,https://www.waterpoloaustralia.com.au/,Water Polo Australia is the governing body for the sport of water polo in Australia,waterpoloaustralia,"[""'BUILDING B' LEVEL 2 6 FIGTREE DRIVE SYDNEY OLYMPIC PARK, NEW SOUTH WALES, 2127 Australia"", 'https://www.dnb.com/business-directory/company-profiles.water_polo_australia_ltd.9f39c6cca9c2c5b7.html']","['admin@actwaterpolo.com', 'https://www.waterpoloaustralia.com.au/about-us/contacts/']","['+61 2 9763 0600', 'https://www.waterpoloaustralia.com.au/about-us/contacts/']",None,"[['Joelie Chisholm', 'CEO'], 'https://www.waterpoloaustralia.com.au/news/wpa-board-appoints-joelie-chisholm-as-new-ceo/']","['Education, Real estate', 'from_classification_model']",None,"['$4.56 million USD', 'https://www.dnb.com/business-directory/company-profiles.water_polo_australia_ltd.9f39c6cca9c2c5b7.html']",None,None,None,"['Public\xa0Limited\xa0Company Independent', 'https://www.dnb.com/business-directory/company-profiles.water_polo_australia_ltd.9f39c6cca9c2c5b7.html']",0.75,0.25,0.0,0.0,0.25
BOQ Personal Banking | Bank accounts_ credit cards_ home ...,https://www.boq.com.au/,Find your next banking solution at BOQ  including bank accounts  credit cards  home loans  personal loans  savings and investments and insurance.,boq,"[""'ASIC MAIL RETURNED 16/04/2020' 100 **SKYRING TERRACE NEWSTEAD, QUEENSLAND, 4006 Australia"", 'https://www.dnb.com/business-directory/company-profiles.bank_of_queensland_limited.5709f66c58e0c7bfc2aa7f1dc51bd11d.html']","['banking@boqspecialist.com.au', 'https://www.crunchbase.com/organization/bank-of-queensland']","['+61 2 9287 0303', 'https://www.boq.com.au/Shareholder-centre/my-shareholding/Shareholder-FAQs']","['boq boq', 'boq boq branch', 'boq hobart boq call', 'existing boq loans', 'home loan interest rates', 'boq boq money shareholder faqs', 'rate home loans', 'boq’s clear path home loan', 'fixed rate home loans', 'account boq']","[['George Frazis', 'CEO'], 'https://www.boq.com.au/About-us/executive-team']","[['BankingFinanceFinancial Services'], 'https://www.crunchbase.com/organization/bank-of-queensland']","['1874', 'https://www.crunchbase.com/organization/bank-of-queensland']","['$723.30 million USD', 'https://www.dnb.com/business-directory/company-profiles.bank_of_queensland_limited.5709f66c58e0c7bfc2aa7f1dc51bd11d.html']",None,"['Australia', 'https://opencorporates.com/companies/au/009656740']",None,"['Public\xa0Limited\xa0Company Parent', 'https://www.dnb.com/business-directory/company-profiles.bank_of_queensland_limited.5709f66c58e0c7bfc2aa7f1dc51bd11d.html']",0.25,0.25,0.0,0.0,0.125
3M Science. Applied to Life. 3M United States,https://www.3m.com/,3M applies science and innovation to make a real impact by igniting progress and inspiring innovation in lives and communities across the globe.,3m,"['Building A/1 Rivett Rd, North Ryde NSW 2113', ['3M Australia, address', 'knowledge_panel']]","['commission@privacycommission.be', 'https://www.3m.com/3M/en_US/company-us/privacy-policy/']","['+61500045119', 'https://www.3m.com/3M/en_US/company-us/all-3m-products/~/3M-White-Super-Polish-Pad-4100/?N=5002385+3293724967&rt=rud']","['3m 3m company', 'm', 'm orthodontic', 'm data', 'm films', 'm apps', 'm center', 'petty m', 'm collects', 'm particulate respirator']","[['Chris LeBlanc', 'Managing_Director'], 'https://au.linkedin.com/in/chris-leblanc-045ab921']","[['AutomotiveElectronicsEnterprise SoftwareManufacturing'], 'https://www.crunchbase.com/organization/3m']","['1902', 'https://www.crunchbase.com/organization/3m']",None,None,"['Australia', 'https://opencorporates.com/companies/au/630800403']",None,"['Public', 'https://www.crunchbase.com/organization/3m']",0.0,0.25,0.375,0.0,0.15625
Johnsons Corporate,https://johnsonscorporate.com.au/,Looking to Sell or Buy a Mid-Sized Business? We specialise in businesses valued from $1M to $50M. +600 Deals Completed over 5 Decades. Speak confidentially with one of our directors today.,johnsonscorporate,"['Level  31 , 120 Collins Street | Melbourne VIC 3000', 'https://johnsonscorporate.com.au/contact-us/']","['sydney@johnsonscorporate.com.au', 'https://www.crunchbase.com/organization/mergers-acquisitions']","['+61 7 3012 6483', 'https://www.crunchbase.com/organization/mergers-acquisitions']","['mid-market business sales', 'specialised mid-market business brokers', 'experienced mid-market business brokers', 'business sales', 'specialist australian mid-market business brokers', 'business services', 'mid-sized businesses', 'mid-market businesses', 'mid-sized private businesses', 'mid-size private businesses']","[['ALEXANDER DARIAN JAMES BIJKERK', 'Director'], 'https://www.dnb.com/business-directory/company-profiles.janszoon_pty_ltd.40bf85a7373bb54d2e15311ee37f3ead.html']","[['Consulting'], 'https://www.crunchbase.com/organization/mergers-acquisitions']","[' 5 June 2019', 'https://opencorporates.com/companies/au/633930926']","['$330,217 USD', 'https://www.dnb.com/business-directory/company-profiles.janszoon_pty_ltd.40bf85a7373bb54d2e15311ee37f3ead.html']",None,"['Australia', 'https://opencorporates.com/companies/au/633930926']",None,"['Private', 'https://www.crunchbase.com/organization/mergers-acquisitions']",0.25,0.375,0.0,0.0,0.15625
Matific,https://www.matific.com/,Online mathematics teaching resource for schools. Focuses on improving core skills such as addition  subtraction  division  multiplication and more,matific,"['447 Kent St, Sydney NSW 2000', ['Matific AUS ( Slate Science Pty LTD ), address', 'knowledge_panel']]","['support@slatescience.com', 'https://www.matific.com/au/en-au/login-page/']","['+61 458 297 751', 'https://www.matific.com/co/es-ar/home/colombiamoe/']","['de educación de colombia y matific', 'de matific', 'entre las ventajas de uso de matific', 'entre las ventajas de uso de matific está', 'el ministerio de educación de colombia', 'de agosto como parte de la respuesta', 'los expertos tutores de matific', 'mínimas y técnicas para el uso de la plataforma durante', 'el aprendizaje de las matemáticas', 'para la implementación de esta']","[['Leon Kamenev', 'founder'], 'https://www.crunchbase.com/person/leon-kamenev']","['Education, IT - Software', 'from_classification_model']",None,"['$1.72 million USD', 'https://www.dnb.com/business-directory/company-profiles.slate_science_operations_pty_ltd.c7706e10562b434efe063e402f9961f8.html']",None,None,None,"['Proprietorship Subsidiary', 'https://www.dnb.com/business-directory/company-profiles.slate_science_operations_pty_ltd.c7706e10562b434efe063e402f9961f8.html']",0.75,0.25,0.375,0.0,0.34375
Novartis,https://www.novartis.com/,Novartis is a global healthcare company based in Switzerland that provides solutions to address the evolving needs of patients worldwide.,novartis,"['54 Waterloo Rd, Macquarie Park NSW 2113', ['Novartis Pharmaceuticals Australia, address', 'knowledge_panel']]","['eric.althoff@novartis.com', 'https://www.crunchbase.com/organization/novartis']","['+64 2020-05-14', 'https://www.novartis.com/sitemap.xml']","['novartis novartis', 'other novartis units', 'other novartis subsidiaries', 'novartis beovu', 'novartis pharmaceuticals', 'novartis group', 'novartis oncology', 'novartis shares', 'novartis institutes', 'novartis cosentyx']","[['Jason Smith', 'Managing_Director'], 'https://pharmaboardroom.com/interviews/interview-with-jason-smith-managing-director-novartis-australia/']","[['BiotechnologyHealth CareMedicalPharmaceutical'], 'https://www.crunchbase.com/organization/novartis']","['1996', 'https://www.crunchbase.com/organization/novartis']",None,None,None,None,"['Public', 'https://www.crunchbase.com/organization/novartis']",0.0,0.25,0.0,0.0,0.0625
The Think Curiouser,https://thinkcuriouser.com/,,thinkcuriouser,"['4004 W Lake Sammamish,  Pkway B9 Redmond, WA 9805', 'https://thinkcuriouser.com/tag/car-beauty-service-market-analysis/']",None,None,"['market report', 'market sizeand market share prices', 'market sizeand market share estimates', 'covid-19 market research report', 'audiobooks market report', 'market intelligence reports', 'rich market reports', 'cheese market research report', 'covid-19 market study report', 'toothbrush sales market report']",None,"['Manufacturing, Finance and insurance', 'from_classification_model']",None,None,None,None,None,None,0.25,0.0,0.0,0.0,0.0625
Karger Publishers,https://www.karger.com/,Leading biomedical publisher of international speciality journals and books covering basic and clinical research subjects across the medical spectrum and related scientific areas.,karger,None,None,None,None,"[['Daniel Ebneter', 'CEO'], 'https://www.enago.com/news/enago-karger']","['Agriculture, Healthcare', 'from_classification_model']",None,None,None,None,None,None,0.0,0.0,0.0,0.0,0.0
imercer US Homepage,https://www.imercer.com/,,imercer,"['100 Barangaroo Ave, Barangaroo NSW 2000', ['Mercer, address', 'knowledge_panel']]","['client.solutions.asia@mercer.com', 'https://www.imercer.com/mercer-job-library']","['+64 9 984 3500', 'https://www.imercer.com/uploads/common/HTML/LandingPages/contact/contact-us.html']","['employee benefits data', 'benefits data', 'survey data', 'new survey data', 'mercer data', 'compensation data', 'traditional market data reports', 'salary data', 'market data practices', 'pay data']","[['David Bryant', 'CEO'], 'https://industrymoves.com/moves/mercer-hires-new-australia-ceo-from-australian-unity']","[['BankingConsultingFinancial ServicesHuman Resources'], 'https://www.crunchbase.com/organization/mercer-us']","['1975', 'https://www.crunchbase.com/organization/mercer-us']",None,None,None,None,"['Private', 'https://www.crunchbase.com/organization/mercer-us']",0.0,0.25,0.0,0.0,0.0625
Nature,https://www.nature.com/,First published in 1869  Nature is the world’s leading multidisciplinary science journal. Nature publishes the finest peer-reviewed research that drives ground-breaking discovery  and is read by thought-leaders and decision-makers around the world._Nature is the world’s foremost international weekly scientific journal and is the flagship journal for Nature Research. It publishes the finest peer-reviewed ...,go.nature,"['239/171 Mann St, Gosford NSW 2250', ['Go Nature Acupuncture & Massage, address', 'knowledge_panel']]","['support@hipages.com.au', 'https://www.crunchbase.com/organization/hipages-group']","['+617335 2015', 'https://www.nature.com/articles/nmicrobiol201627']",None,"[['David Worth', 'Managing_Director'], 'https://au.linkedin.com/in/david-worth-b8788718']","[['AdvertisingHome and GardenHome ImprovementHome RenovationHome ServicesLead Generation'], 'https://www.crunchbase.com/organization/hipages-group']","['2006', 'https://www.crunchbase.com/organization/hipages-group']",None,None,None,None,"['Private', 'https://www.crunchbase.com/organization/hipages-group']",0.0,0.25,0.375,0.0,0.15625
Nutrisearch_ Nutrition and Research – Nutrisearch New ...,https://www.nutrisearch.co.nz/,,nutrisearch,"['1105 Plunket Street, St Leonards, Hastings 4120, New Zealand', ['Nutrisearch, address', 'knowledge_panel']]","['info@nutrisearch.co.nz', 'https://www.nutrisearch.co.nz/events/webinars/']","['+64 (6) 8777-230', 'https://www.nutrisearch.co.nz/brands/quicksilver-scientific/']","['____________________________________________________________________________________________', '___________________________________________________________________________________________________ advantages', '__________________________________________________________________________________________________ serum sst financial pressures', '_______________________________________________________________________ us biotek laboratories', '______________________________________________________________________________________________ - heidi marriott', '____________________________ fitgenes', 'natural health products', 'health practitioners', 'health care practitioners', 'nz integrative health practitioners']","[['Eric Bakker N.D. ', 'Specialist Dietary Supplement ..._LinkedIn'], 'None']","['Healthcare, Agriculture', 'from_classification_model']","['22 January 2007', 'https://opencorporates.com/companies/nz/1895105']","['$378,000 USD', 'https://www.dnb.com/business-directory/company-profiles.nutrisearch_pty_ltd.9fdfe5f574428fcef17845f204e08348.html']",None,"['New Zealand', 'https://opencorporates.com/companies/nz/1895105']",None,"['Proprietorship Independent', 'https://www.dnb.com/business-directory/company-profiles.nutrisearch_pty_ltd.9fdfe5f574428fcef17845f204e08348.html']",0.0,0.25,0.25,0.0,0.125
Agilent: Chemical Analysis_ Life Sciences_ and Diagnostics,https://www.agilent.com/,Agilent delivers complete scientific solutions  helping customers achieve superior outcomes in their labs  clinics  business and the world they seek to improve.,agilent,"['5042 700001713 7000030936 G US7000030936 instrument WA 5063', 'https://www.agilent.com/en/product/molecular-spectroscopy/uv-vis-uv-vis-nir-spectroscopy/uv-vis-uv-vis-nir-software']","['contact_us@agilent.com', 'https://www.crunchbase.com/organization/agilent']",None,"['agilent seahorse xf analysis', 'agilent seahorse xf', 'agilent openlab agilent technologies', 'agilent seahorse xf technology', 'agilent podcast series agilent', 'agilent seahorse xf analyzers', 'agilent seahorse xf hu', 'agilent cell analysis data', 'agilent xf assay kits', 'agilent seahorse']","[['Philip Binns', 'CEO'], 'https://www.bionicsinstitute.org/FAQs/mr-phil-binns']","[['BiotechnologyHardwareHealth Diagnostics'], 'https://www.crunchbase.com/organization/agilent']","['1999', 'https://www.crunchbase.com/organization/agilent']",None,None,"['Australia', 'https://opencorporates.com/companies/au/004559540']",None,"['Public', 'https://www.crunchbase.com/organization/agilent']",0.25,0.0,0.0,0.0,0.0625
Computerworld: IT news_ careers_ business technology_ reviews,https://www.computerworld.com/,Computerworld covers a range of technology topics  with a focus on these core areas of IT: Windows  Mobile  Apple/enterprise  Office and productivity suites  collaboration  web browsers and blockchain  as well as relevant information about companies such as Microsoft  Apple and Google.,computerworld,"['14 001 592 650>Level 10, 15 Blue Street>North Sydney NSW 2060', 'https://www.computerworld.com/article/3591239/google-pixel-chips.html']","['gpinsky@idgcommunications.com', 'https://www.computerworld.com/about/copyright.html']","['+61 2 9902 2700', 'https://www.crunchbase.com/organization/computerworld-australia']","['new android phone options', 'android apps', 'google android', 'android app support', 'other android email apps', 'other android devices', 'most other android phones', 'google photos app', 'google app use', 'android phones']","[['Andrew Johnson', 'CEO'], 'https://www.arnnet.com.au/author/5679235/computerworld-australia-staff/articles']","[['Information Technology'], 'https://www.crunchbase.com/organization/computerworld-australia']",None,None,None,None,None,"['Private', 'https://www.crunchbase.com/organization/computerworld-australia']",0.25,0.0,0.0,0.0,0.0625
Pharmaceutical Technology | Drug Development News ...,https://www.pharmaceutical-technology.com/,Pharmaceutical news and in-depth feature articles on the new drug discoveries  healthcare research and development  big pharma trends and company deals.,pharmaceutical-technology,"['Unit  17 /104 Ferntree Gully Rd    Waverly Business Park Victoria 3166', 'https://www.pharmaceutical-technology.com/contractors/lab_equip/vivascience/']","['privacy@api.net.au', 'https://www.crunchbase.com/organization/australian-pharmaceutical-industries']","['+61 39590 8800', 'https://www.pharmaceutical-technology.com/contractors/lab_equip/vivascience/']","['pharmaceutical products', 'pharmaceutical quality systems', 'higher quality product', 'primary pharmaceutical packaging products', 'other pharmaceutical products', 'global pharmaceutical companies', 'pharmaceutical services', 'new products', 'leading global pharmaceutical companies', 'contract pharmaceutical development services']","['Jeremy Cutts', 'founder(s)', 'https://www.crunchbase.com/organization/australian-pharmaceutical-industries']","[['PharmaceuticalWholesale'], 'https://www.crunchbase.com/organization/australian-pharmaceutical-industries']","['1910', 'https://www.crunchbase.com/organization/australian-pharmaceutical-industries']",None,None,None,None,"['Private', 'https://www.crunchbase.com/organization/australian-pharmaceutical-industries']",0.25,0.25,0.0,0.0,0.125
Mint Metrics: Conversion Optimisation & Analytics Melbourne,https://mintmetrics.io/,Mint Metrics provides full service conversion rate optimisation and web analytics from Melbourne  Australia. Request our rates & availability.,mintmetrics.io,None,"['cosmin@mintmetrics.com', 'https://www.crunchbase.com/organization/mintmetrics']","['+61 (0)405 158 725', 'https://mintmetrics.io/contact/']","['saas testing tools', 'building experiments', 'other saas testing tools', 'testing tools', 'experiment code', 'many split testing tools', 'track experiment data', 'most testing tools', 'better experiment code', 'tracking experiments']","['Cosmin Daraban', 'founder(s)', 'https://www.crunchbase.com/organization/mintmetrics']","[['AnalyticsInternetSocial Media'], 'https://www.crunchbase.com/organization/mintmetrics']","['Jan 31, 2013', 'https://www.crunchbase.com/organization/mintmetrics']",None,None,None,None,"['Private', 'https://www.crunchbase.com/organization/mintmetrics']",0.0,0.25,0.0,0.0,0.0625
iTWire - Technology News_ Technology Jobs Australia,https://www.itwire.com/,iTWire Technology News & Jobs Australia.,itwire,"['1/9 Dadley St, Alexandria NSW 2015', ['iTWire Technology News Sydney, address', 'knowledge_panel']]","['andrew.matler@itwire.com', 'https://www.crunchbase.com/organization/itwire']","['+614122390000', 'https://www.itwire.com/component-k2-38300']","['promapp business process', 'new processes', 'new zealand business process management software company', 'ongoing business process improvement', 'core business processes', 'process management', 'process information', 'managing processes', 'process improvements', 'internet services provider']","[['Narelle Clark', 'CEO'], 'https://www.itwire.com/people-moves/narelle-clark-appointed-ceo-of-internet-association.html']","[['NewsPublishing'], 'https://www.crunchbase.com/organization/itwire']","['2005', 'https://www.crunchbase.com/organization/itwire']",None,None,None,None,"['Private', 'https://www.crunchbase.com/organization/itwire']",0.0,0.25,0.0,0.0,0.0625
Life Sciences Queensland,https://www.lsq.com.au/,Representing our Member entities  Life Sciences Queensland Limited is an Australian peak industry group  working to assist the growth of individual firms.,lsq,"['PO Box 2366 , Toowong DC, QLD 4066', 'https://www.lsq.com.au/privacy-statement/']","['emily.samuels@rowland.com.au', 'https://www.lsq.com.au/queensland-companies-to-lead-the-way-in-on-shore-covid-19-vaccine-manufacture/']","['+61 (0) 3 9828 1414', 'https://www.lsq.com.au/joint-industry-statement-industry-unites-in-call-to-back-our-biotechs-to-keep-jobs-during-covid-19/']","['life sciences queensland', 'queensland life sciences companies', 'sciences queensland limited', 'sciences queensland', 'life sciences queensland limited reserves', 'life sciences queensland limited', 'queensland lsq ambassadors', 'queensland companies', 'queensland university', 'queensland organisations']","[['Clare Blain', 'CEO'], 'https://www.lsq.com.au/about-lsq/']","[['FinanceFinancial ServicesFinTech'], 'https://www.crunchbase.com/organization/lsq-funding-group']","['1996', 'https://www.crunchbase.com/organization/lsq-funding-group']",None,None,None,None,"['Private', 'https://www.crunchbase.com/organization/lsq-funding-group']",0.25,0.25,0.0,0.0,0.125
