title,link,description,comp_name,address,email,telephone_number,keywords,contact_person,type_or_sector,founded_year,revenue,funding,headquarters,No_of_employees,company_status,address_confidence,tp_confidence,headquarters_confidence,contact_confidence,Total_confidence
HealthCert,https://www.healthcert.com/,HealthCert provides university assured courses for GPs wishing to meet CPD requirements  increase their revenue and acquire skills pertinent to primary care.,healthcert,None,"['customers@health.com.au', 'https://www.crunchbase.com/organization/health-com-au']","['+61 429 399 831', 'https://www.healthcert.com/partners']","['skin cancer medicine course', 'healthcert skin cancer certificate courses', 'skin cancer certificate courses', 'skin cancer dr', 'healthcert medical courses', 'skin cancer medicine', 'skin cancer treatments', 'skin cancer medicine treatments', 'bond university skin cancer courses', 'skin cancer patients']","['Andy Sheats', 'founder(s)', 'https://www.crunchbase.com/organization/health-com-au']","[['Health CareHealth Insurance'], 'https://www.crunchbase.com/organization/health-com-au']","['Jun 20, 2011', 'https://www.crunchbase.com/organization/health-com-au']",None,None,"[' Abbotsford, New South Wales, Australia', 'https://www.crunchbase.com/organization/health-com-au']",None,"['Private', 'https://www.crunchbase.com/organization/health-com-au']",0.0,0.25,0.0,0.0,0.0625
School Governance,https://www.schoolgovernance.net.au/,School Governance is the Australian school sector’s leading news and information source on issues related to governance  risk management  compliance and policy management. School Governance is published by CompliSpace Media.,schoolgovernance.net.au,"['Level  4 , 179 Elizabeth Street, Sydney NSW 2000', 'https://www.schoolgovernance.net.au/privacy-policy']","['contactus@complispace.com.au', 'https://www.schoolgovernance.net.au/privacy-policy']","['1300 132 090', 'https://www.schoolgovernance.net.au']","['school students', 'school policies', 'other school policies', 'many school policies', 'boarding school students', 'secondary school students', 'information schools', 'queensland school students', 'other schools', 'new schools']","[['ALAN EDWIN BLENCOWE', 'Director'], 'https://www.dnb.com/business-directory/company-profiles.vetis_consulting_services_pty_ltd.bd978199fc5c9d046f18535cd8f64bf2.html']","[['E-LearningEdTechEducation'], 'https://www.crunchbase.com/organization/christian-schools-australia']","['Jan 1, 2002', 'https://www.crunchbase.com/organization/christian-schools-australia']","['$3.17 million USD', 'https://www.dnb.com/business-directory/company-profiles.vetis_consulting_services_pty_ltd.bd978199fc5c9d046f18535cd8f64bf2.html']",None,"[' Rockingham, Western Australia, Australia', 'https://www.crunchbase.com/organization/christian-schools-australia']",None,"['Private', 'https://www.crunchbase.com/organization/christian-schools-australia']",0.25,0.25,0.0,0.0,0.125
Ausmed | Document CPD Online For Free,https://www.ausmed.com.au/,Ausmed  the place for all health professionals. Document and learn online with the online portfolio  subscribe to learn online. Attend one of 200+ conferences and seminars in a city near you.,ausmed,"['L 1 171 La Trobe St Melbourne, VICTORIA, 3000 Australia', 'https://www.dnb.com/business-directory/company-profiles.ausmed_education_pty_ltd.8ef540527fcdb6349ed0e00a215c3f94.html']","['support@ausmed.com.au', 'https://www.ausmed.com.au/about/contact']","['1300 287 633', ['Ausmed Education, phone', 'knowledge_panel']]","['cpd ausmed cpd help', 'other health care professionals', 'cpd portfolios online cpd', 'other health care workers', 'health care', 'other health professionals', 'wound care education', 'such other information', 'third party personal information', 'other health practitioners']","[['CYNTHEA ANNE WELLINGS', 'Chief Executive Officer'], 'https://www.dnb.com/business-directory/company-profiles.ausmed_education_pty_ltd.8ef540527fcdb6349ed0e00a215c3f94.html']","[['EducationHealth Care'], 'https://www.crunchbase.com/organization/ausmed']","['Jul 1, 1987', 'https://www.crunchbase.com/organization/ausmed']","['$2.76 million USD', 'https://www.dnb.com/business-directory/company-profiles.ausmed_education_pty_ltd.8ef540527fcdb6349ed0e00a215c3f94.html']",None,"[' Melbourne, Victoria, Australia', 'https://www.crunchbase.com/organization/ausmed']",None,"['Private', 'https://www.crunchbase.com/organization/ausmed']",0.375,0.375,0.75,0.0,0.375
Studio Pilates Studios & Courses | Studio Pilates,https://www.studiopilates.com/,Looking for the ultimate pilates experience in your city? Find one of our Studio Pilates studio's near you. We look forward to seeing you soon.,studiopilates,"['243 BRIDGE ROAD RICHMOND, VICTORIA, 3121 Australia', 'https://www.dnb.com/business-directory/company-profiles.studio_pilates_australia_pty_ltd.2fd9d27e291dee7e5ef6a6b2fb97d36b.html']","['ashgrove@studiopilates.com', 'https://www.studiopilates.com/studio-pilates-ashgrove/']","['+617 3871 2422', 'https://www.studiopilates.com/studio-pilates-toowong/']","['studio pilates posture pilates classes', 'studio pilates classes', 'studio pilates international classes', 'studio pilates courses', 'studio pilates studios', 'studio pilates international products', 'studio pilates cairns', 'studio pilates international®', 'studio pilates norwood', 'studio pilates international']","[['JADE WINTER', 'Director'], 'https://www.dnb.com/business-directory/company-profiles.studio_pilates_australia_pty_ltd.2fd9d27e291dee7e5ef6a6b2fb97d36b.html']","[['Fitness'], 'https://www.crunchbase.com/organization/studio-pilates-fitness-wellness']","[' 9 February 2006', 'https://opencorporates.com/companies/nz/1767599']","['$1.73 million USD', 'https://www.dnb.com/business-directory/company-profiles.studio_pilates_australia_pty_ltd.2fd9d27e291dee7e5ef6a6b2fb97d36b.html']",None,"['New Zealand', 'https://opencorporates.com/companies/nz/1767599']",None,"['Private', 'https://www.crunchbase.com/organization/studio-pilates-fitness-wellness']",0.75,0.25,0.375,0.0,0.34375
Sun_ Sangría and CELTA? TEFL Jobs in Spain are ... - StudyCELTA,https://staging4.studycelta.com/blog/teaching-abroad/sun-sangria-celta-tefl-jobs-spain-booming/,,staging4.studycelta,None,None,None,None,None,"['Manufacturing, Healthcare', 'from_classification_model']",None,None,None,None,None,None,0.0,0.0,0.0,0.0,0.0
HealthStaff Recruitment: Medical & Healthcare Job Recruitment,https://www.healthstaffrecruitment.com.au/,We assist you in finding doctor  medical  allied health  nursing and midwifery jobs in Australia  New Zealand  Canada  UK and the Middle East.,healthstaffrecruitment,"['Level  2 ,\xa0Alan Burns\xa0Insurance\xa0House, 69 Boulcott Street, Wellington 6011', 'https://www.healthstaffrecruitment.com.au/registration-in-new-zealand/']","['hello@jobwords.io', 'https://www.crunchbase.com/organization/jobwords']","['+64 4 802 0235', 'https://www.healthstaffrecruitment.com.au/working-as-a-nurse-in-new-zealand/']","['health service australia', 'new zealand gp jobs australia', 'australia doctors jobs new zealand south eastern sydney local health service', 'australia sydney new south wales australia staff specialist', 'cobar district hospital western australia', 'new zealand new app', 'australia nsw health support', 'new zealand registration process', 'faq new zealand working visas south western sydney local health district mental health nursing', 'new zealand website jobs']","['Tim Semple', 'founder(s)', 'https://www.crunchbase.com/organization/jobwords']","[['AdvertisingEnterprise SoftwareHuman Resources'], 'https://www.crunchbase.com/organization/jobwords']","['Jun 16, 2018', 'https://www.crunchbase.com/organization/jobwords']",None,None,"[' Sydney, New South Wales, Australia', 'https://www.crunchbase.com/organization/jobwords']",None,"['Private', 'https://www.crunchbase.com/organization/jobwords']",0.25,0.25,0.0,0.0,0.125
Modern Teaching Aids - New Zealand's largest supplier of ...,https://www.teaching.co.nz/,Learning resources  education supplies & toys for childcare  preschool  primary school  secondary and high schools. Maths equipment  literacy resources  art & craft supplies  outdoor equipment  furniture,teaching,"['9 GILBERT ST TUMBARUMBA, NEW SOUTH WALES, 2653 Australia', 'https://www.dnb.com/business-directory/company-profiles.teaching_all_over_pty_ltd.5c59ba3a04a8b9a9b8047517b46be4ad.html']","['support@teachstarter.com', 'https://www.crunchbase.com/organization/teach-starter']","['+64 21 493 507', 'https://www.teaching.co.nz/page/mta-nz-reps']","['art activity children', 'classroom activities', 'make dad', 'student information', 'learning resources children', 'paint children', 'christmas activity', 'other speaking activities', 'website children', 'school activities']","['Scott Tonges', 'founder(s)', 'https://www.crunchbase.com/organization/teach-starter']","[['Education'], 'https://www.crunchbase.com/organization/teach-starter']","['Aug 1, 2012', 'https://www.crunchbase.com/organization/teach-starter']","['$2.81 million USD', 'https://www.dnb.com/business-directory/company-profiles.teaching_all_over_pty_ltd.5c59ba3a04a8b9a9b8047517b46be4ad.html']",None,"[' Pilton, Queensland, Australia', 'https://www.crunchbase.com/organization/teach-starter']",None,"['Private', 'https://www.crunchbase.com/organization/teach-starter']",0.0,0.25,0.0,0.0,0.0625
EducationHQ,https://educationhq.com/,Latest education news  jobs  resources  events  comment and analysis on primary and secondary schools  for principals  teachers and educators.,educationhq,"['PO Box 250 , Brunswick West VIC 3055 Australia', 'https://educationhq.com/news-home/']","['media@open.edu.au', 'https://www.crunchbase.com/organization/open-universities-australia']","['+64 9 889 0303', 'https://educationhq.com/contact-us/']","['secondary school students', 'schools kiwi students', 'school education', 'primary school teachers', 'school', 'high school', 'independent schools', 'victorian schools', 'school teams', 'schools subscriptions']","[['Sandra Colli ', 'Business Development Manager ..._LinkedIn'], 'from linkedin search google']","[['EducationHigher EducationMarketplace'], 'https://www.crunchbase.com/organization/open-universities-australia']","['1993', 'https://www.crunchbase.com/organization/open-universities-australia']",None,None,"[' Melbourne, Victoria, Australia', 'https://www.crunchbase.com/organization/open-universities-australia']",None,None,0.25,0.25,0.0,0.0,0.125
Prospero Teaching,https://prosperoteaching.com/,_Prospero Teaching is a teaching agency with permanent & supply teaching jobs for teachers & support staff in Primary  Secondary & Special Needs Schools._Prospero Teaching is a teaching agency with permanent & supply teaching jobs for teachers & support staff in Primary  Secondary & Special Needs Schools.,prosperoteaching,"['Phibbs & Co. Limited, 8 Murdoch Road, Grey Lynn, Auckland1021NZ', 'https://opencorporates.com/companies/nz/5831390']","['teaching@prosperoteaching.com', 'https://prosperoteaching.com/']","['+61 1300 655 420', 'https://www.crunchbase.com/organization/class-cover']","['teaching prospero teaching', 'primary teacher prospero teaching', 'graduate teaching assistant prospero teaching', 'send supply teaching assistant prospero teaching', 'special needs teacher prospero teaching', 'schools prospero teaching', 'maths prospero teaching', 'ongoing prospero teaching', 'uae prospero teaching', 'redditch prospero teaching']","['Ben Grozier', 'founder(s)', 'https://www.crunchbase.com/organization/class-cover']","[['AppsMobile AppsRecruiting'], 'https://www.crunchbase.com/organization/class-cover']","['Jan 20, 2012', 'https://www.crunchbase.com/organization/class-cover']",None,None,"[' Sydney, New South Wales, Australia', 'https://www.crunchbase.com/organization/class-cover']",None,"['Private', 'https://www.crunchbase.com/organization/class-cover']",0.0,0.0,0.0,0.0,0.0
Google for Education: Solutions built for teachers and students,https://edu.google.com/,Schools and universities are using Google’s products  programs  and philanthropy to help them improve learning and innovation._Schools and universities are using Google’s products  programs  and philanthropy to help them improve learning and innovation._Schools and universities are using Google’s products  programs  and philanthropy to help them improve learning and innovation.,edu.google,"['The University of Sydney Sydney, NEW SOUTH WALES, 2006 Australia', 'https://www.dnb.com/business-directory/company-profiles.university_of_sydney.6862b03eca083ec02a104024368bb2cf.html']","['info@finder.com.au', 'https://www.crunchbase.com/organization/finder-com-au']","['+61 2 9299 7602', 'https://www.crunchbase.com/organization/finder-com-au']",None,"['Frank Restuccia', 'founder(s)', 'https://www.crunchbase.com/organization/finder-com-au']","[['Financial ServicesOnline Portals'], 'https://www.crunchbase.com/organization/finder-com-au']","['2006', 'https://www.crunchbase.com/organization/finder-com-au']","['$1.80 billion USD', 'https://www.dnb.com/business-directory/company-profiles.university_of_sydney.6862b03eca083ec02a104024368bb2cf.html']",None,"[' Sydney, New South Wales, Australia', 'https://www.crunchbase.com/organization/finder-com-au']",None,"['Private', 'https://www.crunchbase.com/organization/finder-com-au']",0.0,0.0,0.0,0.0,0.0
Chartered Accountants Australia & New Zealand | CA ANZ,https://www.charteredaccountantsanz.com/,Chartered Accountants Australia & New Zealand (CA ANZ) represents over 120 000 members in Australia  New Zealand & overseas. CA ANZ creates prosperity for everyone. Learn more about the opportunities  CA program or memberships that CA ANZ offers.,charteredaccountantsanz,"['33 Erskine Street Sydney, NSW 2000 Australia', 'https://www.charteredaccountantsanz.com/terms-of-use']","['onald@charteredaccountantsanz.com', 'https://www.charteredaccountantsanz.com/about-us/governance/voting/2019-member-vote/australian-regional-council-elections']","['+64 4 474 7840', 'https://www.charteredaccountantsanz.com/about-us/governance/voting/2019-member-vote/new-zealand-elections']","['ca anz members', 'ca anz services', 'ca anz council', 'ca anz submission', 'ca anz students', 'ca anz board', 'ca anz group', 'ca anz resident', 'ca anz ip', 'ca anz sydney']","[['MURRAY JACK', 'Director'], 'https://www.dnb.com/business-directory/company-profiles.chartered_accountants_australia_and_new_zealand.ee7d7298bea6f5d8f788ba8408587a1b.html']","[['Association'], 'https://www.crunchbase.com/organization/chartered-accountants-australia-and-new-zealand']",None,"['$3.72 million USD', 'https://www.dnb.com/business-directory/company-profiles.chartered_accountants_australia_and_new_zealand.ee7d7298bea6f5d8f788ba8408587a1b.html']",None,"[' Sydney, New South Wales, Australia', 'https://www.crunchbase.com/organization/chartered-accountants-australia-and-new-zealand']",None,"['Private', 'https://www.crunchbase.com/organization/chartered-accountants-australia-and-new-zealand']",0.25,0.25,0.0,0.0,0.125
Leadership Development for Teachers - Australia and New ...,https://coachingfocus.com.au/,Want to lift the leadership capacity of your teachers? Coaching Focus specialises in developing role model leaders._Want to lift the leadership capacity of your teachers? Coaching Focus specialises in developing role model leaders._,coachingfocus,"['0400 1208 22  E:  janine@coachingfocus.com.au  A: Highett VIC 3190', 'https://coachingfocus.com.au/contact/']","['info@hewsons.com.au', 'https://www.crunchbase.com/organization/hewsons-executive-development']","['+613 9598 8582', 'https://coachingfocus.com.au']","['elevating leadership program elevating leadership', 'leadership programs', 'leadership development programs', 'school leadership', 'leadership style', 'leadership roles', 'great leadership', 'good leadership', 'developing leaders', 'leadership coach']","[['JANINE STRATFORD', 'Owner'], 'https://www.dnb.com/business-directory/company-profiles.mrs_janine_pamela_stratford.82e08cd45b51c4d7c68e060540bf787b.html']","[['ConsultingHuman ResourcesInformation Technology'], 'https://www.crunchbase.com/organization/hewsons-executive-development']","['Jul 1, 1997', 'https://www.crunchbase.com/organization/hewsons-executive-development']","['$105,072 USD', 'https://www.dnb.com/business-directory/company-profiles.mrs_janine_pamela_stratford.82e08cd45b51c4d7c68e060540bf787b.html']",None,"['New Zealand', 'https://opencorporates.com/companies/nz/3309770']",None,"['Private', 'https://www.crunchbase.com/organization/hewsons-executive-development']",0.25,0.25,0.0,0.0,0.125
SPS: Learning creates Leaders,https://www.spseducation.com.au/,SPS provide comprehensive  easy-to-learn training & certification of the SEQTA suite  as well as professional development workshops and services.,spseducation,"['PO Box 740 Joondalup WA 6919', 'https://www.spseducation.com.au/contact-us/']","['10963-1614261600-1614267000@www.spseducation.com.au', 'https://www.spseducation.com.au/course/webinar-qt101-seqta-tutor-awst-time-zone-2-2/?ical=1']","['+61 8 6404 0788', 'https://www.spseducation.com.au/']","['seqta schools', 'seqta programmes', 'seqta suite', 'seqta suite knowledge', 'seqta staff', 'seqta level', 'seqta analyse', 'seqta teach', 'seqta attendance', 'seqta learn']",None,"['Education, IT - Software', 'from_classification_model']",None,None,None,None,None,None,0.25,0.25,0.0,0.0,0.125
AFMLTA: Home,https://www.afmlta.asn.au/,,afmlta.asn.au,None,"['info@afmlta.asn.au', 'https://www.afmlta.asn.au/content/contact-us']","['+61 1300 655 420', 'https://www.crunchbase.com/organization/class-cover']",None,"['Ben Grozier', 'founder(s)', 'https://www.crunchbase.com/organization/class-cover']","[['AppsMobile AppsRecruiting'], 'https://www.crunchbase.com/organization/class-cover']","['Jan 20, 2012', 'https://www.crunchbase.com/organization/class-cover']",None,None,"[' Sydney, New South Wales, Australia', 'https://www.crunchbase.com/organization/class-cover']",None,"['Private', 'https://www.crunchbase.com/organization/class-cover']",0.0,0.0,0.0,0.0,0.0
Spectrum Education,https://www.spectrumeducation.com/,Spectrum Education shares easy-to-implement strategies  techniques and teaching resources to help students  parents & teachers with advanced study skills. Our conference & Teachers Matter Magazine helps create more effective learning environments & classrooms in New Zealand  Australia & worldwide.,spectrumeducation,"['19 Rondane Place Tirohanga Lower Hutt, WELLINGTON, 5010 New Zealand', 'https://www.dnb.com/business-directory/company-profiles.spectrum_education_limited.54cc61491de9bb693e390d72072af5c6.html']",None,"['+64 4 528 9969', 'https://www.spectrumeducation.com/']","['study resources teachers matter single issue', 'downloadable teachers matter single issue', 'setting goals', 'hope teachers matter single issue', 'teachers matter single issue', '| study skills teachers matter single issue', 'teachers matter', 'nz orders teachers matter single issue', 'australian orders teachers matter single issue', 'short term goals']","['Ben Grozier', 'founder(s)', 'https://www.crunchbase.com/organization/class-cover']","[['AppsMobile AppsRecruiting'], 'https://www.crunchbase.com/organization/class-cover']","['Jan 20, 2012', 'https://www.crunchbase.com/organization/class-cover']","['$530,000 USD', 'https://www.dnb.com/business-directory/company-profiles.spectrum_education_limited.54cc61491de9bb693e390d72072af5c6.html']",None,"[' Sydney, New South Wales, Australia', 'https://www.crunchbase.com/organization/class-cover']",None,"['Private', 'https://www.crunchbase.com/organization/class-cover']",0.0,0.25,0.0,0.0,0.0625
PTE Academic: Pearson English Language Test,https://pearsonpte.com/,,pearsonpte,None,"['dataprivacy@pearson.com', 'https://pearsonpte.com/privacy-policy/']","['1800882768', 'https://pearsonpte.com/contact-us/']","['pte test', 'academic pte academic', 'pte academic qualification specification pte academic', 'pte academic test takers', 'pte home handbook pte academic', 'pte academic scores', 'pte home b1 test', 'trong khi thi test format pte academic', 'english academic test taker handbook', 'pte academic english booster']","[['Joe Hernandez ', 'Regional Manager_Asia Pacific ...'], 'from linkedin search google']","[['EducationFitness'], 'https://www.crunchbase.com/organization/pte-online']",None,None,None,None,None,"['Private', 'https://www.crunchbase.com/organization/pte-online']",0.0,0.25,0.0,0.0,0.0625
Training.co.nz: Online Courses NZ,https://www.training.co.nz/,Find A Perfect Course. Used by Thousands of NZ Students. Only Top NZ Universities & Training Academies. Fast Track Your Career & Job Prospects.,training,"['127 Erskine Street, Middle Park, Victoria 3206 Australia', 'https://www.training.co.nz/privacy/']","['monstergirl22@hotmail.com', 'https://www.training.co.nz/is-your-resume-still-relevant-4-steps-on-how-to-improve-it/']",None,None,"[['Angelique Vaughan ', 'Regional Training Manager ..._LinkedIn'], 'from linkedin search google']","[['EducationHigher EducationHuman ResourcesVocational Education'], 'https://www.crunchbase.com/organization/education-training-australia']","[' 5 February 2020', 'https://opencorporates.com/companies/au/638915910']",None,None,"[' Sydney, New South Wales, Australia', 'https://www.crunchbase.com/organization/education-training-australia']",None,"['Private', 'https://www.crunchbase.com/organization/education-training-australia']",0.25,0.0,0.0,0.0,0.0625
ep.education: Home,https://edperson.co.nz/,,edperson,"['94 Dixon Street Wellington New Zealand', 'https://edperson.co.nz/privacy-policy/']","['info@datacom.com.au', 'https://www.crunchbase.com/organization/datacom']","['+64 4 387 9988', 'https://edperson.co.nz/education-personnel-application-declaration-form-v4/']","['pacific', 'new zealand beginning teachers', 'new zealand webinar', 'new zealand', 'new zealand educators', 'new zealand \\nwhether', 'new zealand webinar welcome', 'aotearoa new zealand', 'new zealand teacher registration', 'other teachers']","[['STUART JOHN BIRCH', 'Director'], 'https://www.dnb.com/business-directory/company-profiles.education_personnel_limited.f3179e8c576a0b0a6a251f52724106fc.html']","[['AppsInformation Technology'], 'https://www.crunchbase.com/organization/datacom']","['1965', 'https://www.crunchbase.com/organization/datacom']","['$4.25 million USD', 'https://www.dnb.com/business-directory/company-profiles.education_personnel_limited.f3179e8c576a0b0a6a251f52724106fc.html']",None,"[' Wellington, Wellington, New Zealand', 'https://www.crunchbase.com/organization/datacom']",None,"['Private', 'https://www.crunchbase.com/organization/datacom']",1.0,0.25,0.0,0.0,0.3125
ACCA Global: Home,https://www.accaglobal.com/,ACCA (the Association of Chartered Certified Accountants) is the global body for professional accountants.,accaglobal,None,"['members@accaglobal.com', 'https://www.crunchbase.com/organization/acca']",None,"['acca nigeria certificate', 'bermuda secondary school certificate certificate', 'acca diploma', 'acca students', 'solomon islands school certificate certificate', 'secondary school certificate', 'acca', 'acca exams', 'secondary vocational school certificate', 'acca qualifications']","[['Samuel Leach ', 'Manager_EY'], 'from linkedin search google']","[['AccountingBusiness DevelopmentEducationFinanceFinancial ServicesNon Profit'], 'https://www.crunchbase.com/organization/acca']","['1904', 'https://www.crunchbase.com/organization/acca']",None,None,"[' Sydney, New South Wales, Australia', 'https://www.crunchbase.com/organization/acca']",None,"['Private', 'https://www.crunchbase.com/organization/acca']",0.0,0.0,0.0,0.0,0.0
Australian Swimming Coaches & Teachers Association,https://ascta.com/,,ascta,None,None,"['+61 7 5494 6785', 'https://ascta.com/learn/teacher-courses-aquatics-courses/swim-australia-teacher/']","['swim insurance australia', 'swim australia', 'swim australia teacher', 'swim australia teacher qualifications', 'swim insurance', 'swim school insurance', 'swim teachers', 'swim', 'insurance advisernet australia', 'swim central']","[['Jan Cameron ', 'Swimming Australia_LinkedIn'], 'from linkedin search google']","['Education, Mining, oil and gas', 'from_classification_model']",None,None,None,None,None,None,0.0,0.25,0.0,0.0,0.0625
Welcome to ASG,https://www.asg.com.au/,ASG is a member owned organisation which supports parents to invest in their children's education journey.,asg,"['131 274) Mail ASG Complaints 23-35 Hanover Street Oakleigh VIC 3166 Australia', 'https://www.asg.com.au/complaints-faq']","['customercare@asg.com.au', 'https://www.crunchbase.com/organization/asg-1fb4']","['+61 2 9284 9666', 'https://www.asg.com.au/about-asg/privacy-policy']","['other information', 'such information', 'personal information', 'financial information', 'cookie information', 'relevant information', 'further information', 'certain information', 'general information', 'information systems']","[['IAN GORDON CAMPBELL', 'Director'], 'https://www.dnb.com/business-directory/company-profiles.asg_group_limited.7c2f7c036f51ec81ab4e8c285d71c6c6.html']","[['EducationFinancial ServicesInformation Services'], 'https://www.crunchbase.com/organization/asg-1fb4']","['Jan 1, 1974', 'https://www.crunchbase.com/organization/asg-1fb4']","['$78.94 million USD', 'https://www.dnb.com/business-directory/company-profiles.asg_group_limited.7c2f7c036f51ec81ab4e8c285d71c6c6.html']",None,"[' Oakleigh, Victoria, Australia', 'https://www.crunchbase.com/organization/asg-1fb4']",None,"['Private', 'https://www.crunchbase.com/organization/asg-1fb4']",0.25,0.25,0.0,0.0,0.125
